art,fazıl   viyana orkestrası
art,barış müzik donizetti klasik müzik ödüllerinde özel başarı ödülüne layık görüldü ödülü layık gören
art,balesi sahnelendi türkiye
art,çin tarihle yüzleş maskelemeye devam  yekta kopan yazdi
art,biletler  iksv zorlu psmde
art,dün gece büyüleyici performansıyla izleyicileri kendine hayran bırakan balesi akşam
art,iksv  yıl serisinin ilki yayınlandı
art,balesi göl  kuğu gölüne ithafen akşam işbirliğiyle zorlu psmde
art,medya ilişkileri direktörüne doğrudan bağlı görev alacak medya ilişkileri yöneticisi aranıyor başvuru
art,ekibinde görev alacak grafiker aranıyor başvuru ayrıntılı bilgi
art,genç sinemacıları destekliyoruz atölyelerinin ilki  haziran temmuzda yapılacak başvuru tarihi
art,başvuru ayrıntılı bilgi
art,sponsorluk programı departmanında zamanlı görev alacak sponsorluk ilişkileri asistanı aranıyor
art,biletler  iksv zorlu psmde
art,nefeslerinizi tutmaya hazırlanın balesi akşam yarın akşam
art,yılı içerisinde düzenlenecek atölyelerin ilki  haziran temmuz tarihlerinde gerçekleşecek
art,köprüde buluşmalar nin desteği türkiyede fragman atölyeleri serisi düzenliyor
art,türkiyedeki fragman atölyesi köprüde yapılıyor ayrıntılı bilgi başvuru
art,biletler iksvde
art,hazırlıkları devam bienalin gerçekleşmesine destek olurken bienali ayrıcalıklarla yaşama fı
art,bienali özel biletleri satışa çıktı
art,balesi göl  kuğu gölüne ithafen akşam yarın işbirliğiyle zorlu psmde
art,tarihin parçası sanatçılara izleyicilere destekçilerimize teşekkür ederiz
art,iksv yıldır istanbulda kültür sanat yaşamına katkıda bulunuyor
art,mcbrides  kandace biletler iksvde
art,büyüleyici vokaliyle  caz popu birleştiren eğlenceli şarkılarıyla sıcacık yaz akşamında
art,biletlerinizi  iksv alabilirsiniz
art,balesi göl  kuğu gölüne ithafen gösterisiyle yarın istanbulda
art,sanatçılar gelen tehlikeyi duyuruyor  murat yetkin
art,cevdet erekin çin başlıklı işinden etkilendiğinden bahsediyor
art,yazarlarından farago venedik bienali yazısında türkiye pavyonunun gü
art,güçlü ulusal pavyon türkiye pavyonu
art,biletler  iksv
art,mayısta mükemmelliğin temsili haline gelen  başarılı dansçıdan oluşan balesi buluş
art,biletler  iksv
art,mayıstaki balesi göl  kuğu gölüne ithafende ihtişamlı kostümlerden gözlerinizi alamayaca
art,göl  kuğu gölüne ithafen biletleri  iksv
art,göl geri sayım başladı  mayısta unutulmayacak deneyim sizleri bekliyor
art,venedik bienali türkiye pavyonu başlıyor
art,venedik bienali  uluslararası sanat sergisi kapılarını açıyor
art,venedik bienali özel yayını afişte ekrana geldi
art,cevdet erekin çını venedik bienalinde venedik bienalinde cevdet erek araya geldi
art,rus filarmonisi hüseyin sermet vassilis varvaresos konser biletleri iksvde
art,genç yetenek vassilis varvaresos tanışın  haziranda festivalde
art,venedik bienali  uluslararası sanat sergisi yarın kapılarını açıyor gtgt
art,göl iksvnin katkıları  mayıs salı  mayıs çarşamba akşamları zorlu psmde sahne alıyor
art,venedik bienali nci uluslararası sanat sergisinin türkiye pavyonu açıldı
art,müzik festivali programıyla  mayısta başlıyor biletler iksvde
art,sıradan anı kılmak müzik yeter
art,venedik uluslararası sanat bienalindeki türkiye pavyonu açıldı
art,resmi açılışa iksv yönetim kurulu başkanı bülent eczacıbaşı türkiye pavyonu sponsoru adı
art,türkiye pavyonunda sanatçı cevdet erekin çin başlıklı işi alıyor ayrıntılı bilgi
art,kültür sanat vakfı koordinasyonunda türkiye sponsorluğunda gerçekleştirilen türkiye pavyonu dün açıl
art,cevdet erekin çin adlı mekana özgü çalışmasının aldığı venedik bienali türkiye pavyonu cumartesi açılıyor http
art,biletler  iksv
art,mükemmelliğin temsili haline gelen dünyaca ünlü balesi  mayısta istanbulda
art,iksv koordinasyonunda sponsorluğunda gerçekleştirilen türkiye pavyonunda cevdet
art,uluslararası sanat sergisi türkiye pavyonu bugün açıldı
art,çin arsenale
art,ön gösterime venedikte yapmanız yapmamanız gereken  hareketi sıralıyoruz
art,çellistanbul celloberlin konser biletleri iksvde
art,çellistanbul celloberlin konseri öncesi aya irini müzesinde çello sevgisi üzerine sohbet
art,kiremitçi  müzik festivalinde
art,iksv galaları yaratık biletler iksvde
art,sinemaseverler akşam yaratık covenantı nda izleme keyfi yaşayacak
art,göl  kuğu gölüne ithafen haftaya
art,göl  kuğu gölüne ithafen  mayısta istanbulda biletler  iksv
art,boşluk bırakılmamaya çalışılan koreografinin sinematografik anlatımı akıyor
art,iksvnin kuruluş hikayesini bülent eczacıbaşından dinledik
art,geri sayım başladı heyecanla beklediğimiz  covenantı vizyondan iksv galalarında izliyoruz
art,gösteriminde izleyeceğimiz yaratık biletler iksvde
art,iksv galaları yaratık buluşmak  gün
art,biletler  iksv zorlu psmde
art,göl  kuğu gölüne ithafen büyülü gece yaşamaya kaldı balesi  mayısta
art,genç caz konserleri başvuru tarihi  mayıs başvuru ayrıntılı bilgi
art,şehrin yerlerinde önünüze çıkan afişe bakınca gelmiyor aklınıza
art,cevdet erek  venedik bienalindeki türkiye pavyonunu şekillendirecek çalışması çinı anlattı
art,ayrıntılı bilgi başvuru
art,düzenlenecek atölyelerin birincisi  temmuz tarihlerinde yapılacak başvuru tarihi
art,köprüde buluşmalar nin desteği ikinci kısa filmini sinemacılara yönelik kısa atöl
art,kampanya sayfamıza ulaşabilirsiniz
art,mavi lale askıda rtleyip instagramdan ı takip  üniversiteliye hediye
art,istanbulun kültür sanat şehrine dönüştüğünü ünlü sanatçı zülfü livaneliden dinledik
art,yaptın isimleri salonda izledin şimdi sezon şekilleniyor çorbada
art,biletler  mayıs  iksv gösterim günü
art,yönetmenliğini scottın  mayıs akşamı saat
art,düzenlediği iksv galalarının filmi serisinin filmi yaratık
art,biletler iksvde
art,haziranda boğaz manzarasına karşı müziğin tadına varacağınız konser sizleri bekl
art,göl iksvnin katkıları istanbula geliyor detaylar yarın çıkacak alemin sayısında
art,kısıtlamalardan azat edilmiş kuğu gölü balesinin yönetmeni jeanchristophe röportaj http
art,annenize güzel hediye kültür sanatla dolu yıl lale hediye etmek
art,balesi göl  kuğu gölüne ithafen biletleri  iksv
art,mükemmelliğin temsili haline gelen balesi   mayısta istanbullu izleyicilerle buluşuyor
art,bienali kapsamındaki etkinlik mekânında görev alacak sergi görevlisi aranıyor baş
art,bienalinde sergi sergilenen eserler rehberlik sergi rehberi
art,bienali öncesi süresince sanatçılara eşlik etmek amacıyla sanatçı asistanı aran
art,hazırlık süresince destek olacak sergi kurulum asistanları aranıyor başvuru
art,cevdet erek
art,mayıs haziran tarihleri arasında gerçekleşecek festivalin biletleri iksvde
art,hayatın sıradan anları klasik müzikle bürünüyor  müzik festivali sıradışı programı
art,balesi göl  kuğu gölüne ithafen  mayısta istanbulda biletler  iksv
art,olgunluk mükemmelliğin temsili haline gelen balesi  başarılı dansçıdan oluşuyor
art,montecarlo zorlu psm
art,mozarttan ellingtona biletleri iksvde
art,günümüzün şaşırtıcı piyanistlerinden   haziranda aya irini müzesinde
art,fazıl   viyana orkestrası
art,ayrıntılı bilgi başvuru
art,kapsamındaki etkinlik mekânlarında alacak  hostes aranıyor
art,ayrıntılı bilgi başvuru
art,kapsamında ekip koordinatörünün liderliğinde dışından gelecek sanatçılara eşlik
art,muhteşem deneyim biletler  iksv
art,balesi göl  kuğu gölüne ithafen heyecan verici çağdaş yorumla gece üst üste seyircisi
art,kültür sanat vakfı  ulusal egemenlik çocuk bayramını kutluyoruz
art,ötenel dostları caz gecesi  nisanda iksvde
art,konserine kaldı biletler
art,biletler  iksv gişe gişelerinde
art,balesinden göl  kuğu gölüne ithafen çarpıcı sahne tasarımı kostümleriyle  mayısta büyüley
art,üyeliği iksv etkinlikleri hakkında bilgi almak isterseniz uluslararası çikolata festivalind
art,tiyatro festivali  kasım izleyicileriyle buluşacak
art,iksvnin  yılında başlattığı  yılından yılda düzenlenen tiyatro festivali
art,yılında uzun zamandır üzerinde çalıştığı projeyi hayata geçiriyor
art,tiyatro festivali artık yıl düzenleniyor ayrıntılı bilgi
art,küçük sürprizimiz sizleri bekliyor
art,lale üyeliği etkinlikleri hakkında bilgi almak isterseniz deki standımıza bekleriz
art,ekibi içinde alacak geliştirme sorumlusu aranıyor başvuru ayrıntılı bilgi
art,saat  çocukla zorlu psm tiyatro sahnesindeyiz herkesi bekleriz biletler biletixte
art,muhteşem deneyim biletler  iksv
art,bambaşka kuğu gölü deneyimine hazır olun montecarlo balesinden göl  kuğu gölüne ithafen   mayıst
art,nisanda
art,ödüller sahiplerini bekliyor
art,konserine  gün kaldı çocuklarınıza  hediyesi biletinizi aldınız
art,festivali  nisanda sona eriyor biletler sinemalarında
art,festivali  yılında açık hava tiyatrosunda sovyet klasik topluluğunu ağırlamıştı
art,desteğiyle düzenlenen atölyesinde ödüller dağıtıldı detaylar
art,köprüde buluşmalar ödül gecesi uzmanı yasemen özlem mailoğlunun konuşmasıyla devam
art,nin destekleriyle     tarihlerinde düzenlenen köprüde buluşmaların yöneticisi gülin üstün
art,direktörü kerem ayan konuşmasını
art,köprüde buluşmalar yıl   sırasında nin destekleriyle
art,nin destekleriyle     tarihlerinde düzenlenen köprüde buluşmaların ödülleri akşam sahipl
art,nin destekleriyle gerçekleşen köprüde buluşmalarda  geçti
art,ekibinde görev alacak prodüksiyon sorumlusu aranıyor başvurular ayrıntılı bilgi
art,nin destekleriyle gerçekleşen köprüde buluşmalarda  geçti
art,nin destekleriyle gerçekleşen köprüde buluşmalarda  geçti
art,iın desteğiyle gerçekleştirilen köprüde buluşmalar  geliştirme atölyesinden
art,kapsamında istka destekli geliştirme atölyesi eğitimleri başladı
art,göl  kuğu gölüne ithafen gösterisinin biletleri  iksv
art,kuğu gölü tazeleyici olmamıştı balesinden göl  kuğu gölüne ithafen   mayıs
art,çocuğun aynı sahneyi paylaşarak yetişkinlere vereceği birlik beraberlik barış mesajına verelim
art,ian mckellenın gösterimlerinin ardından bugün yarın rexx sinemasında katılacağı sunumları canlı
art,ian mckellenla bugün işbirliğiyle gerçekleşecek söyleşi instagram hesabımızdan canlı yayınlanacak
art,cevdet erek
art,balesi göl  kuğu gölüne ithafen  mayısta istanbulda biletler  iksv
art,göl formunun zirvesinde topluluğu gözler önüne seriyor montecarlo balesi fevkalade dansçılara ev sahipliği
art,açılış töreni hakkındaki haber
art,çevirideki aksaklığın konuşma sırasında sahne üzerine ses ulaşmaması yaşandığını kasıt
art,nin onur konuğu ian mckellenın açılış törenindeki konuşmasının sansürlendiği yönünde yanlış algı oluşmuştur
art,biletler  iksv zorlu psm gişelerinde
art,balesi göl  kuğu gölüne ithafen   mayısta tiyatroda izleyiciyle buluşacak
art,caz festivali biletleri satışta biletler iksvde
art,kültür sanat vakfı ebültenlerine abone olun festivallerden etkinliklerden habersiz kalmayın
art,biletler  iksv gişe gişelerinde
art,balesinden göl  kuğu gölüne ithafen çarpıcı sahne tasarımı kostümleriyle  mayısta büyüley
art,kültür sanat kartımız olsaydı dedik ortaya güzel etkinlikleri özeti çıktı gtgt
art,biletler  iksv zorlu psm gişelerinde
art,nefesinizi tutarak izleyeceğiniz balesi göl  kuğu gölüne ithafen  mayısta iksv
art,kapsamında görev alacak sanatçı asistanı aranıyor başvuru ayrıntılı bilgi
art,caz festivalinde şarkılar konuşacak biletler  nisandan iksvde
art,ayrıntılı bilgi
art,bülent özer anısına çağdaş mimarlık sanat sempozyumu    martta fındıklı yerleşk
art,kültür sanat kartı sahibi öğrenciler caz festivalinde neleri seçecek
art,festivali başlıyor
art,temmuz tarihlerinde gerçekleşecek festivalin biletleri  nisandan iksvde
art,caz festivalinde şarkılar konuşacak hakkında ayrıntılı bilgi
art,bariş müzik orkestralari  konseri biletleri çikti sizde  nisanda bizimle beraber isterseniz htt
art,caz festivali basın toplantısını canlı izlemek
art,biletler biletix iksv gişelerinde
art,bambaşka kuğu gölüne hazır olun balesinden göl  kuğu gölüne ithafen   mayısta istanb
art,olun buradayız başkadır  yaşında
art,çarşamba akşamı saat yepyeni repertuarla pera müzesinde tekrar sizlerleyiz biletler biletixte http
art,dünya tiyatro günü kutlu tiyatro
art,merhaba sorun gözükmemektedir ilginiz teşekkür ederiz
art,biletler satış kanalları rexx sinemalarındaki gişelerde
art,festivali biletleri bugünden satışta
art,tarihleri arasında gerçekleşecek  biletleri yarından satışta
art,edebiyat tasarımın konuşulacağı okuma odası sohbeti saat binasında
art,nuri ceylana ödülünü duygu asena vermişti
art,nuri ceylan kasaba filmiyle  ulusal yarışmada jüri özel ödülü onat kutlar anısına
art,kültürsanat hayırseverlik konulu söyleşimizde genel müdürü görgün taner birlikteydik
art,yıl sonu konserinde araya gelecek ayrıntılı bilgi konser bilgileri
art,mekânlarda konserler verecek  kasımda barış müzik sistema türkiyenin orkestraları zorlu psmde gerçekleştirilecek
art,barış müzik vakfı orkestraları  nin yanı sıra sahne
art,dünya çapında yürütülen sistema müzik projesinin parçası çalışmalarını türkiyenin farklı illerine
art,imkânları sınırlı çocuklara karşılıksız müzik eğitimi olanağı sağlamak amacıyla  yılında kurulan barış müzik vakfı
art,sistema türkiye türkiyeye yayılıyor ayrıntılı bilgi
art,mayısta gerçekleşecek gösterinin biletleri  iksv gişelerinde
art,balesi göl  kuğu gölüne ithafen heyecan verici çağdaş yorumla gece üst üste seyircilerle buluş
art,balesi göl  kuğu gölüne ithafen biletler  iksv
art,çaykovskinin balesi üzerine yapılmış derece çarpıcı göl heyecan verici görüntülere sahip
art,katalan grup comediants  kapsamında ortaköy meydanında gösteri gerçekleştirmişti
art,canlı yayını izleyebileceğiniz lale instagram hesabı
art,lale instagram hesabından katılabileceğiniz canlı yayın sorularınızı şimdiden hazırlayın
art,direktörü kerem ayan  cuma günü canlı yayında sorularınızı yanıtlıyor
art,balesi göl  kuğu gölüne ithafen  mayısta tiyatroda biletler  iksvde
art,göl formunun zirvesinde topluluğu gözler önüne seriyor montecarlo balesi fevkalade dansçılara ev sahipliği
art,festivali programını incelemek
art,festivali kataloğunu iksv kitaplık uygulamasından indirebilirsiniz
art,biletler  marttan satış kanalları rexx sinemalarındaki gişelerde olacak
art,başlıyor  festivali  tarihleri arasında gerçekleşecek
art,müzede barış müzik konseri biletler
art,marttaki konserde vakfının eğittiği  çocuk arasından yaylı müziğe odaklanan geleceğin müzisyenleri olacak
art,nin vakfı birliğiyle başlattığı müzede barış müzik adlı konser serisi
art,medya ilişkileri ekibinde zamanlı görev alacak medya ilişkileri sorumlusu aranıyor başvuru bilgi
art,hepimizi derinden üzen kazada hayatını kaybedenlere allahtan rahmet yakınlarına başsağlığı diliyoruz
art,biletler  iksv gişelerinde
art,bambaşka kuğu gölüne hazır olun nefesinizi tutarak izleyeceğiniz göl  kuğu gölüne ithafen   mayıs
art,kültür sanat vakfı  yılında büyük kültür ödülünü kazanmıştı
art,ekibi içinde alacak konuk ağırlama sorumlusu aranıyor başvuru
art,kazananlar iksv kültür sanat kartlarını  marta teslim alabilir
art,yedek listeden iksv kültür sanat kazanmaya kazananlar kazananlar
art,idil biret sagalassos vakfı yararına  nisanda konser salonunda konser verecek biletler
art,iksv yüzde  sinemaya gitmiyor yüzde  kitap okumuyor
art,biletler  iksv gişe zorlu psm gişelerinde
art,balesinden göl  kuğu gölüne ithafen   mayısta zorlu psm tiyatroda
art,iksv  gerçekleştirdikleri işbirliğiyle mayıs ayında özel projeyi istanbulda ağırlıyor
art,gerçekleştirilecek  festivalinde  özel
art,komşu temalı  uzun  kısa metrajlı  festivalinde
art,farklı etkinliklerle ziyaretçilere açılan arşiv yaratıcı keşif süreçlerine odaklanan genişletilmiş kitap kulü
art,tasarım bienali okuma odası iksv yenilikçilik merkezi tasarım bienalinin mimarlık tasarım arşivlerini
art,okuma odasına dönüştürdü   tarihleri arasında hafta içi gün  saatleri arasında zi
art,tasarım bienali ev sahipliği yapan şişhanedeki nejat eczacıbaşı binasının giriş katını geç
art,tasarım bienali okuma odasına bekliyor
art,kültür politikaları çalışmaları dahilinde rapor yayımladı kültürsanatta katılımcı yaklaşımlar
art,balesinden göl  kuğu gölüne ithafenin biletleri  iksv gişe zorlu psm gişelerinde
art,ünlü yönetmen koreograf jeanchristophe maillotnun kuğu gölüne getirdiği heyecan verici çağdaş yorum
art,venedikin kulaklarını çınlatacak
art,keith jarrett istanbuldaki konserini yılında gerçekleşen festivalinde vermişti
art,komşu projesi
art,nın hazırlık sürecinde atölyeler sırasında görev almak isteyenler
art,tarihleri arasında gerçekleşecek köprüde buluşmalar hazırlık sürecinde görev almak isteyen stajyer
art,cevdet erek çin
art,gittiğini gitmek istediğini anlattığın videonu bizimle paylaş hazırlayacağımız filmlerde görüntülerin alsın
art,kültür sanat kazananları arasındaysan etiketiyle hislerini yolculuğunu
art,venedik bienalinde cevdet erek çinlatacak
art,toplantıya iksv genel müdürü görgün taner türkiye pavyonu sponsoru adına tofaş kurumsal iletişim direktör
art,türkiye pavyonunda alacak çin başlıklı işin kavramsal çerçevesi  şubatta düzenlenen basın
art,uluslararası sanat sergisi türkiye pavyonunda cevdet erekin çin başlıklı işi alacak
art,cevdet erek venedik bienalinde kulakları çinlatacak
art,türkiye pavyonu sponsorluğunda dışişleri bakanlığı kültür turizm bakanlığı himayesinde gerçekleştiriliyor
art,venedik bienali  uluslararası sanat sergisi yıl  mayıs   kasım  tarihlerinde gerçekleştirilecek
art,sanatçı cevdet erekin çin başlıklı işi alacak
art,uluslararası sanat sergisinde iksv koordinasyonuyla gerçekleştirilen türkiye pavyonu sergisinde
art,türkiye pavyonu sponsoru adına tofaş kurumsal iletişim direktörü arzu çolakoğlu konuşmasını
art,iksv genel müdürü görgün taner  uluslararası sanat sergisi türkiye pavyonu basın toplantısında konuşmasını
art,uluslararası sanat sergisi türkiye pavyonu basın toplantısı başladı
art,yıldır canlandırdığı  karakterine bürünüyor biletler iksvde
art,dünya vizyonundan xmen filmi  şubatta nda
art,izlemek
art,iksvnin kültür politikaları çalışmaları kapsamındaki beşinci raporu yerel yönetimler kültürel planlamanın konuşulacağı programı
art,iksv genel müdürü görgün taner kültür politikaları çalışmaları direktörü özlem ece bugün saat
art,etkinlikleri hakkında bilgi almak isterseniz bugün daki standımıza bekleriz
art,biletler  iksv gişe zorlu psm gişelerinde
art,balesinden göl  kuğu gölüne ithafen heyecan verici çağdaş yorumla   mayısta
art,biletler bugünden iksvde
art,müzik festivali  mayıs   haziran tarihleri arasında sıradışı programla seyircisiyle buluşuyor
art,kuğu gölü tazeleyici olmamıştı suddeutsche zeitung
art,bulgaristan pirin halk şarkıları topluluğu yılında yedikule zindanlarında gösterisini sahnelemişti
art,etiketiyle paylaş hazırlayacağımız filmlerde görüntülerin alsın
art,kartını teslim almak çıktığın yolculuğu etkinliklere gittiğini gitmek istediğini anlattığın videonu
art,iksv kültür sanat kazananları belirlendi kazananlar arasındaysan başvuru hikâyeni kazandığını öğrendi
art,öğrenciye kültür
art,biletler  iksv gişe zorlu psm gişelerinde
art,dünyaca ünlü koreograf jeanchristophe maillotnun kuğu gölüne getirdiği heyecan verici çağdaş yorum tiyatroda
art,balesi büyüleyici performansla   mayısta istanbulda ayrıntılı bilgi
art,iksv kültür sanat kazananlarını görmek
art,kültür sanat vakfı yönetim kurulu başkanı bülent eczacıbaşı
art,iksv kültür sanat sahipleri çekilen kura sonucunda belirlendi kazanan öğrencilerden üçüne kartlarını
art,sebeple kartınızı  şubat   tarihleri arasında iksv fuaye alanından almanız gerekmektedir tebrik ederiz
art,merhaba milli piyango şartları gereğince kartların teslimatları sahiplerinin yapılacaktır
art,sebeple kartınızı  şubat   tarihleri arasında iksv fuaye alanından almanız gerekmektedir tebrik ederiz
art,merhabalar milli piyango şartları gereğince kartların teslimatları sahiplerinin yapılacaktır
art,iksvnin kültürsanatta katılımcı yaklaşımlar raporu yayımlandı okumak
art,iksv genel müdürü  yılında vakfı anlattı baezin türkiye sorusunu cevaplıyorduk
art,sorularınız sitemizi ziyaret edebilirsiniz  günler
art,tebrikler  şubat    tarihleri arasında iksv fuaye alanına gelerek kartınızı teslim alabilirsiniz
art,merhaba kültür sanat çekiliş koşullarını sitemizden öğrenebilirsiniz  ilginiz teşekkürler
art,merhabalar kültür sanat çekiliş koşullarını sitemizden öğrenebilirsiniz  teşekkürler
art,merhabalar sitemiz aktif gelmiştir sayfayı yenileyerek tekrar kontrol etmenizi rica ederiz ilginiz teşekkür ederiz
art,merhabalar sitemiz aktif gelmiştir tekrar kontrol ettiğiniz takdirde kazananlar listesini görebilirsiniz teşekkürler
art,merhabalar sitemiz aktif gelmiştir tekrar kontrol ettiğiniz takdirde kazananlar listesini görebilirsiniz teşekkürler
art,üniversiteli iksv kültür sanat kazananlarını görmek
art,ayrıntılı bilgi
art,mayısta izleyiciyle buluşacak göl  kuğu gölüne ithafenin biletleri
art,göl  kuğu gölüne ithafende çarpıcı sahne tasarımına kostümlerin büyüleyiciliğine hayran kalacaksınız
art,biletler  iksv gişe gişelerinde
art,balesinden göl  kuğu gölüne ithafen çarpıcı sahne tasarımı kostümleriyle  mayısta büyüle
art,iksvnin kültür politikaları çalışmaları kapsamındaki  raporu kültürsanatta katılımcı yaklaşımlar yayımlandı
art,kültürsanatta katılımcı yaklaşımlar raporu yayımlandı
art,iksv kitaplık uygulamasını indirmek
art,iksvnin kültür politikaları çalışmaları kapsamındaki  raporu kültürsanatta katılımcı yaklaşımları iksv kitapl
art,biletler  iksv gişe gişelerinde
art,mayısta izleyiciyle buluşacak göl  kuğu gölüne ithafen çarpıcı sahne tasarımı kostümlerle büyüleyici
art,iksv raporu toplumun yüzde sinemaya yüzde konsere gitmiyor dergi okumayanlar yüzde
art,sivil anayasa teklifi kültür evrim altuğ yazdi
art,çaykovksinin başyapıtına yepyeni yaklaşım getiren göl  kuğu gölüne ithafen zorlu psm işbirliğiyle
art,ayrıntılı bilgi adresini ziyaret edebilirsiniz
art,kitapçığı iksv kitaplık uygulamasından indirilebilir
art,müzik festivali kitapçığı satış noktalarından edilebilir
art,müzik festivali biletleri  şubat saat satışta olacak
art,konservatuvarların müzik şan bölümü öğrencileri yıl konserlerini ücretsiz izleyecek
art,müzik festivali onur ödülü müzik yazarı evin ilyasoğluna takdim
art,özel konserle  müzik festivalinin konuğu olacak
art,festivalde yıl yakın yerli yabancı sanatçı istanbulun  mekânında ağırlanacak
art,müzik festivali yıl sıradışı temasıyla etkileyici sunacak
art,direktörü yeşim gürer oymak konuşmasında yılki festivalin teması programına bilgi veriyor
art,sponsoru eca presdöküm sanayii aş yönetim kurulu başkanı gaye akçen konuşmasını
art,festivalin yılki programı bugün iksv resmi konaklama sponsoru perada düzenlenen basın toplantısıyla aç
art,iksv yönetim kurulu başkanı bülent eczacıbaşı  müzik festivali basın toplantısında konuşmasını
art,eca sponsorluğunda düzenlenecek  müzik festivali  mayıs   haziran tarihl
art,iksv raporundan kültürsanat etkinliğine katılmadım diyenlerin oranı yüzde
art,şubat salı günü sinemaseverlerle buluşacak biletler  şubattan
art,düzenlediği nda xmen filmi gösterilecek
art,gösterimi öncesinde nda ayrıntılı bilgi
art,sanatsız milletin hayat damarlarından kopmuş demektir  yazdı
art,kültür sanat vakfı kültürsanatta katılımcı yaklaşımlar başlıklı rapor yayımladı
art,işbirliği modelleri yenilikçi yaklaşımları araya getiriyor raporu incelemek
art,kültürsanatta katılımcı yaklaşım uygulamaların yaygınlaştırılmasını hedefleyen rapor türkiye dünyadan uygulamalar
art,iksvnin kültür politikaları çalışmaları kapsamındaki altıncı raporu kültürsanatta katılımcı yaklaşımlar başlığı
art,etkinliklerinde kullanılabilecek  değerindeki iksv kültür sanat karta başvurular bugün sona eriyor
art,üniversiteliden bugün gün başvurmak
art,nefes kesici güncel yorum çarpıcı kostümlerle yepyeni kuğu gölü işbirliği    mayısta istanbulda
art,kuğu gölü balesi biletleri bugünden satışta biletler  iksv
art,likten dünya geçti  fotoğrafla iksvnin  yılı
art,başvurmak
