art,fazıl   viyana orkestrası
art,tengo konseri gün sayıyoruz heyecanlıyız kaplan röportajımızı okumayı ihmal etmeyin
art,stacey buyuleyici sesi kaciranlara yarin
art,seti başladı
art,kapsamında  kasımda garajistanbulda olacak courteenersın albümü
art,akşam garajistanbuldaki kapsamındaki konserini
art,fakepakt akşam garajistanbulda sahne nerdworking
art,akşam daki seti başlıyor akşam kimler geliyor
art,festivali gece başlıyor garajistanbulda shadowu kaçırmayın
art,konserinde shadowun güçlü baslar ritimlerle yüklü performansına
art,themagger kraliyet concertgebouw orkestrası konserini kaçırmayın diyor
art,uluslararası kitap fuarı  kasım tarihleri arasında tüyapta iksv  numaralı salonda  numaralı stantta
art,kapsamında  kasımda garajistanbulda gerçekleşecek tengo konserinden
art,cité artsın dönem başvuruları deavm
art,cité misafir sanatçı programı başvuruları  kasıma uzatıldı
art,themagger etkinliklerini kaçırmayın diyor
art,dünyanın iyisi kabul edilen  yıllık kraliyet concertgebouw orkestrası iksvnin  yıl
art,sonbaharında düzenlenecek nin kavramsal çerçevesi  ocakta açıklanacak
art,cité misafir sanatçı programının ocaknisan  dönemi başvurular uzatıldı
art,kasım tarihleri arasında ayrıntılı bilgi yazı bugunbugece sayfasında
art,alternatif elektronik müzik şehrin merkezine taşınıyor gecenin sesini açıyor
art,cité misafir sanatçı programı dönem başvuruları açıldı
art,hollanda türkiye arasındaki diplomatik ilişkilerin başlangıcının  yıldönümü kapsamında düzenlenen kültürel
art,kasım tarihleri arasında
art,kasım tarihleri arasında düzenlenecek mekanlarda düzenlenecek biletler
art,kapsamında konser verecek sanatçılara göz atmaya dersiniz
art,rica ederiz idil hanım desteğiniz ilginiz teşekkür ederiz
art,idil hanım sertifikanız  temmuzda gönderilmiş gözüküyor tekrar gönderiyoruz ilginiz teşekkür ederiz
art,kasım tarihleri arasında
art,tengo courteeners jacques bonomo fazlası millerda  kasımda
art,gecenin sesini açıyor tengo courteeners
art,iksv düzenlenen   aralıka devam tasarım bienalini gezmeyi unutmayın
art,idil hanım sertifikanızla süreci takip etmek adına isim soyisim eposta adresinizi iletebilir misiniz
art,sergileri bayramın günü  ekim perşembe  ekim pazartesi cumhuriyet bayramı açık olacaktır
art,şef lorin maazel yönetimindeki kraliyet concertgebouw orkestrası  kasımda haliç kongre merkezinde
art,hostingthe concertgebouw
art,oğuzhan sarı öğrenci öğretim görevlisi  yaş üstü izleyicilerimiz kişi geçerli üyeliktir
art,gecenin sesini açıyor tengo courteeners
art,kasım tarihleri arasında garajistanbul arkaodada
art,gecenin sesini açıyor
art,şef lorin maazel yönetimindeki kraliyet concertgebouw orkestrası  kasımda haliç kongre merkezinde
art,cité misafir sanatçı programının ocaknisan  dönemi başvurular başladı
art,imge hanım yazınız teşekkür ederiz tasarım bienalini hesabından takip edebilirsiniz
art,iksv yıl boyunca ihtiyaçlar çerçevesinde gönüllü staj fırsatları sunar staj başvurusu
art,iksv yıl boyunca ihtiyaçlar çerçevesinde gönüllü staj fırsatları sunar staj başvurusu
art,iksv tasarım mağazası parmağınızın ucunda
art,kasımda haliç kongre merkezinde olacak kraliyet concertgebouw orkestrasından mahlerin  numaralı
art,oturduğun yerden tasarım alışverişi
art,iksv tasarım mağazası artık ealışveriş imkanı sunuyor
art,iksv tasarım mağazası artık ealışveriş imkanı sunuyor
art,kasımda istanbulda olacak kraliyet concertgebouw orkestrası  yılını kutlayacak
art,iksvnin öncü sponsoru davet
art,zubin mehta yönetimindeki maggio orkestrası solistler güher süher pekinel  aralık haliç kongre merkezinde
art,istanbuls
art,tasarım bienali yarın kapılarını açıyor ayrıntılar anlık bildirimler hesabında
art,ipek hanım salondaki frahm olafur arnalds konseri biletler tükenmiştir
art,tasarım bienali  ekimde kapılarını açıyor mekanlar özel galata ilköğretim okulu
art,tasarım bienali hafta sonu başlıyor tasarım bienalini hesabından takip etmeyi unutmayın
art,tasarım bienalini facebookta takip musunuz
art,kültür sanat vakfı eren koray şirketler topluluğu vestel eş sponsorluğunda
art,uzun süre hafızalardan silinmeyecek kraliyet concertgebouw orkestrası konseri biletler biletix iksvde
art,muhteşem konser geri sayım başladı dünyanın senfoni orkestralarından kraliyet concertgebouw orkestrası  kasımda istanbulda
art,muhteşem konser geri sayım başladı dünyanın senfoni orkestralarından kraliyet concertgebouw
art,tasarım bienali  ekimde başlıyor tasarım bienalini hesaplarından takip edebilirsiniz
art,dün akşam etienne konseri sezon açılışını yapan nin programına göz atmayı unutmayın
art,hanım tasarım bienalini hesabından takip edebilirsiniz
art,hanım tasarım yürüyüşleri bilet almanız gerekmektedir
art,barış müzik inisiyatifinden gelen öğrenciler bitambiöğrenci projesi kapsamında filarmoni orkestrası
art,tasarım bienali  ekimde kapılarını açıyor tasarım bienalini adresinden takip edebilirsiniz
art,girişinde sorun çıkmaması izleyicilerimizin seanslara vaktinde yetişmek titizlik göstermesini rica ederiz
art,sinem hanım gösterimlerinin başlamasından salona izleyici alınmamaktadır
art,endüstrideki standartları müzikte bugün filarmoni konserini yazdım http
art,facebook filarmoni orkestrası
art,facebook iksv teşekkür gecesi
art,iksv resmi taşıyıcı sponsoru teşekkür plaketini alıyor
art,iksv resmi iletişim sponsoru teşekkür plaketini alıyor
art,iksv resmi havayolu sponsoru teşekkür plaketini alıyor
art,iksv öncü sponsoru teşekkür plaketini alıyor
art,kültür turizm bakanı ertuğrul günay iksv yönetim kurulu başkanı bülent eczacıbaşından teşekkür plaketi alıyor
art,iksv yönetim kurulu başkanı bülent eczacıbaşı  yılında vakfa destek veren resmi sponsorlara teşekkür
art,akşamki filarmoni orkestrası konserini tavsiye
art,akşamki filarmoni orkestrası konserinden özlem altunokun solistler efe baltacıgil
art,gece rattlelı filarmoniden  bitmemiş senfoni dinlenecek teşekkür
art,akşamki filarmoni orkestrası konserine gelmeden doğan hızlanın yazısına göz atmanızı tavsiye ederiz
art,akşamki filarmoni orkestrası konserinden provadan fotoğraflara göz atmaya dersiniz
art,facebook filarmoni orkestrası  prova
art,filarmoni orkestrası yarın akşam haliç kongre merkezinde evin ilyasoğlunun orkestra yazısı
art,leyla gencer şan yarışması sona erdi
art,leyla gencer şan yarışması finali aya irini müzesinde başladı
art,leyla gencer şan yarışması finali akşam aya irini müzesinde canlı yayında
art,duygu hanım cumartesi beyoğlu sinemalarında bilet satışı olacaktır citysteki satışlar  eylülde başlayacaktır
art,üyeleri ön satış  başlamıştır
art,facebook stevie
art,filarmoni orkestrası konseri biletleri tükenmiştir ilginiz teşekkür ederiz
art,kültür sanat vakfı kurum kimliği yayınlar bölümü bünyesinde görev grafiker aranmaktadır
art,stevie konserinden notlarına göz atmayı unutmayın
art,facebook stevie
art,smirnoffun stevie konserine özel hazırladığı caz yeşili kokteyli
art,lennonun şarkısı devam stevie
art,beklenen şarkı dans
art,stevie konseri devam
art,konser devam izleyenler stevie wondera eşlik
art,konser başladı stevie ekibi sahnede
art,stevie sahnede beklenen geldi
art,stevie konseri öncesinde sahnede
art,stevie konseri küçükçiftlik parkta kapılar açıldı izleyiciler gelmeye başladı
art,akşamki konsere hazırlanırken stevie özel programına verebilirsiniz
art,akşam stevie konserini kaçırmayın diyor
art,stevie konseri akşam küçükçiftlik parkta kapı açılış  konser
art,akşam stevie konseri öncesinde küçükçiftlik parkta
art,stevie akşam  öncesinde xte
art,akşam stevie konseri unutulmaz akşam istanbulluları bekliyor
art,stevie konseri küçükçiftlik parkta hazırlıklar hız devam sahne kuruluyor akşam konsere
art,stevie istanbulda konser akşam küçükçiftlik parkta
art,türkiyedeyim dedi  yıl geldi bekleyiş sona eriyor stevie akşam küçükçiftlik
art,stevie konseri öncesi ısınma turları stevie wonderın hayatını konu tünelimize göz atın
art,yarın akşamki konserden stevie yazısı
art,stevie konseri biletix satış kanallarından etkinlik saatine bilet satışına devam
art,stevie konseri satış kanallarından etkinlik saatine bilet satışına devam edilecektir
art,yarın akşamki stevie konserinden magın yazısını okumanızı tavsiye ediyoruz
art,stevie konseri özel ikinci sahne önü biletleri tükenmiştir birinci sahne önü genel biletleri acele edin
art,stevie wondera hazır mısınız
art,yarın akşamki stevie konserine hazırlanırken hafif müzikin hazırladığı playliste göz atmaya dersiniz
art,stevie wondera hazır mısınız konserden derlenmiş
art,tupac coolio sanatçı gruplar stevie şarkıları yorumlamışlardır
art,stevie wonderın kissin şarkılarından oluşan adlı albümde
art,stevie adlı şarkısında arie düet yapmıştır
art,yarın akşam küçükçiftlik parkta olacak stevie  yılında  yıl aradan adlı albümü yayınlamıştır
art,yarın akşam gerçek efsane stevie küçükçiftlik parkta konserini verecek hazır mısınız
art,jacksonın albümünde adlı şarkıda düet yapan
art,eylülde istanbulda olacak stevie wonderın  yılında leenin  filminin müziklerini biliyor muydunuz
art,yıl geleceğini söyleyen stevie cuma türkiyede
art,stevie wonderın iglesias albümündeki şarkısında düet biliyor muydunuz
art,bugün tweetine rtyi alana çift kişilik davetiyemiz
art,hilal hanım biletleri  eylülden beyoğlu sinemaları gişelerinde biletix satış kanallarında
art,eylülde konserini verecek stevie   yıllarında khanın yorumu
art,istanbula  tonluk sahne prodüksiyon malzemesi gelen stevie ekibi konser özelliği
art,idil hanım bilet satışları  eylülde siyah  eylülde beyazkırmızısarı lale üyeleri içindir
art,stevie konserinde fotoğraf çekilmesi kaydı yasaktır fotoğraf makinesi kameralar alana alınmayacaktır
art,eylülde istanbulda olacak stevie  yılında cosby showun adlı bölümünde rol almıştır
art,filmekimi  programı açıklandı filmekimi programı adresinde filmekimi güncel bilgileri hesabında
art,bitambiöğrenci projesine destek olun  genci sanatla buluşturun
art,stevie wonderın  yılında filminin soundtracki yazdığı
art,stevie  eylülde istanbuldaki konseri küçükçiftlik parkta
art,stevie albümü stüdyo albümü peacei yayınlamıştır
art,yıllardır stüdyo albümü yayımlamayan stevie wonderın konser vermesi hayranları konserlerinin
art,stevie wonderın  yılında  albümünden çıkan şarkısı  numara olmuştu
art,berfin hanım üyelerine yıl yıl kitapçık gönderimleri yapılacaktır
art,stevie adlı filmin enstrümantal şarkılardan oluşan throught
art,stevie çıkardığı albümüyle ödülünü aldı albümde
art,müzikseverlerin yıllardır gözle beklediği konser vermesiyle tanınan efsanevi müzisyen stevie
art,röportaj  geçen sabah ansızın stevie aradı
art,efsane müzisyen stevie  eylül cuma
art,stevie konseri geri sayım başladı cuma akşamı kimler konsere geliyor
art,stevie wonderın busta ryhmesın şarkısında konuk sanatçı biliyor muydunuz
art,stevie konserine davetiye kazanma şansı hoursda
art,stevie wonderın yayınlanan röportajını gördünüz
art,stevie müzisyenle konuştum gururluyum röportajım
art,cuma stevie konserine gelmeden barış akpolatın hürriyet gazetesinde yayınlanan stevie
art,cuma küçükçiftlik parkta hayranlarıyla buluşacak efsanevi müzisyen stevie wonderın bennett
art,eylülde istanbulda olacak stevie wonderın stingin şarkısında harmonika çaldığını biliyor muydunuz
art,eylülde istanbulda olacak efsanevi müzisyen stevie  yılında lerdeki işlerini toplayan stevie
art,dergisine dünyanın gelmiş geçmiş  şarkıcısı efsanevi müzisyen stevie  eylülde istanbulda
art,stevie wonderı canlı dinlemek  eylülde küçükçiftlik bekliyoruz
art,coolionun  yılında ödüllerinde ödülünü kazanan filmiyle
art,iksv genel müdürü stevie özel programı akşam caz yeşilinde
art,albümleri  milyondan fazla fazla şarkısı amerikan müzik listelerinde  numara stevie  eylülde istanbulda
art,kraliyet concertgebouw orkestrası  kasım cumartesi haliç kongre merkezinde
art,iksv hollanda türkiye arasındaki diplomatik ilişkilerin  yılı kutlamaları kapsamında  kasım cumartesi
art,eylülde konserini verecek efsanevi müzisyen stevie wonderın platinium albümü
art,stevie wonderın  yılında rhcp yorumlanan adlı şarkısında mutron
art,itrî dönemine disiplinlerarası bakışlar başlıklı sempozyum  aralıkta üniversitesi rektörlük binasında gerçekleştirilecek
art,iksv ölümünün  yılında unesconun itrî yılı ilan itrî üzerine uluslararası sempozyum düzenleyecek
art,caz müziğinin yaygınlaşmasına  yıldır destek veren garanti bankasının garanti caz yeşili markasıyla
art,stevie kazanan motown sanatçısı ödülü ikinci amerikalı olmuştur
art,peppersun  yılında stevie wonderın şarkısını yorumladığını biliyor muydunuz
art,eylülde türkiyedeki konserini verecek efsanevi müzisyen stevie wonderın şarkıları kariyeri boyunca
art,heyecanla beklediğiniz  eylül   ekim tarihleri arasında türkiyenin farklı kentlerinde sinemaseverlerle buluşuyor
art,stevie  eylül londra konserinin ardından  eylül cuma akşamı istanbuldaki konseri küçükçiftlik parkta
art,müzikseverlerin yıllardır gözle beklediği konser vermesiyle tanınan efsanevi müzisyen stevie
art,sehir  eylule hazir bilet almayan
art,stevie ozelde genel muduru konuk saat
art,iksv genel müdürü stevie özel programı pazar çarşamba caz yeşilinde
art,stevie  eylülde küçükçiftlik parkta biletler iksv gişede biletix satış kanallarında garanti
art,ağustosta türkiyedeki konserini küçükçiftlik parkta veren feistın röportajı
art,stevie geri sayım başladı
art,gecenin yağmur parçası stevie
art,geçtiğimiz cumartesi küçükçiftlik parkta gerçekleşen konserinin ardından zülal kalkandelenin izlenimleri
art,konseri hakkındaki yazım tatlı
art,eylülde küçükçiftlik parkta olacak stevie wonderdan şarkısıyla
art,facebook
art,konseri sona erdi  eylülde stevie konserinde görüşmek
art,konseri bitti devam
art,geldim
art,konser devam sahnede izleyenleri büyülüyor
art,sahnede konser başladı
art,konserinde standımıza uğramayı unutmayın
art,kapılar açıldı eş sponsorluğunda konserine kaldı müziğe başladı
art,sahne kuruldu kapıların açılmasına kaldı sahnede
art,konseri kapılar saat açılıyor konser konserden
art,akşam eş sponsorluğundaki konseri öncesinde sonrasında alanda olacak
art,konseri akşam  antipioneer
art,akşam küçükçiftlik parktaki konserini kaçırmayın diyor
art,iksv yönetim kurulu başkanı bülent eczacıbaşı yılın yönetim kurulu başkanı kategorisinde altın stevie ödülüne layık görüldü
art,ekibi istanbulda konser yarın akşam eş sponsorluğunda küçükçiftlik parkta
art,stevie konseri yaklaşıyor düzenlenen konser banneri yayında tıklayıp bilgi
art,yarın akşam eş sponsorluğunda küçükçiftlik parkta konser verecek magazinein kapağında
art,yarın akşam konserinden setinde ekim baykara kabinde olacak kapı açılışı konser
art,yarın akşam küçükçiftlik parkta konserden hakkında notlar weartbeatin yazısında
art,feistin pariste kaydettiği çıkardığı albümü caz türlerini araya getiriyor
art,feistin mushaboom şarkısının  filminde kullanıldığını biliyor muydunuz
art,konseri yarın akşam
art,yarın akşam konserini verecek feistin mushaboom şarkısının  filminde
art,setlist colognegermany
art,kulaklarınızı cezbedecek kadife ses geliyor  dipnottv
art,albümü downı  yılında yayımladı  yılında dünya
art,ağustosta istanbulda konseri izlenimleri direktörü
art,lardan indierock grubu çalışan feistin albümü çıkan
art,caz festivali direktörü pelin opcin  ağustosta konserini verecek feistı osloda izledi
art,yarın kullandığı tweetine rtyi alana çift kişilik davetiyemiz
art,müzik hayatına  yaşında kurduğu isimli grubuyla başlayan grubuyla ramonesun ön grubu
art,duru ipeksi sesiyle  ağustosta istanbulda
art,geri sayım başladı türkiyeye gelmeden almanya danimarka ingiltere isviçrede dizi
art,tiyatro festivali onur ödülü sahibi usta tiyatro oyuncusu müşfik kenteri kaybettik
art,turnesi kapsamında amerika kıtasındaki konserlerin ardından iskandinav ülkelerinde katıldığı festivaller
art,ağustosta istanbulda olacak feistin geçtiğimiz hafta festivalde verdiği konserin setlistine göz
art,esra hanım stevie konseri öğrenci kategorisi biletleri tükenmiştir kategorilerde vardır
art,ödüllü efsanevi sanatçı stevie  eylülde istanbulda
art,ağustosta konserine gelmeden tramvay durağının yazısıyla feistı tanımaya dersiniz
art,magda bugünün şarkısı feisttan antipioneer  ağustosta küçükçiftlik parkta
art,mehmet tezin sezon bitmeden gidilecek  konser seçkisinde  ağustostaki  eylüldeki stevie
art,sarı lale kişilik üyelik kartıdır kartınızla etkinlik  bilet alabilirsiniz
art,onlarca hitin yaratıcısı müziğin
art,ipeksi sesi güçlü gitarı şarkı yazarlığı dinleyenleri müzik piyasasını kendine hayran bırakan
art,konseri biletler tükeniyor ipeksi sesi güçlü gitarı şarkı yazarlığı dinleyenleri müzik
art,ağustosta küçükçiftlik parkta olacak feistin istanbulda yayınlanan röportajını gördünüz
art,ağustosta küçükçiftlik parkta türkiyeden hayranlarıyla buluşacak feistin önceki konserlerine
art,cité artsın eylülaralık  dönemindeki konuğu ferhat özgür
art,iksvdeki stajlar gönüllü çalışma kapsamına girmektedir ücret ödenmemektedir
art,bienali hazırlık süreci boyunca ekibine destek verecek uzun dönemli stajyerler aranıyor
art,bienali hazırlık süreci boyunca bienali ekibine destek verecek uzun dönemli stajyerler aranı
art,çiğdem hanım küçükçiftlik parkta tribün kurulacaktır biletiniz tribün geçerli olacaktır konsere bekliyoruz
art,stevie buluşmaya hazır mısınız  ağustosta stevie  eylülde maçka
art,türkiye çin arasındaki kültürel yakınlaşmayı politik ilişkilerin güçlendirilmesini amaçlayan
art,stevie woınder buluşmaya hazır mısınız  ağustosta stevie  eylülde maçka
art,ağustosta maçka küçükçiftlik parkta biletler iksv gişe biletix satış noktalarında tükenmek
art,küçükçiftlik parktaki  ağustos stevie  eylül konserlerinin biletleri iksv gişede
art,stevie konserlerinin biletleri iksv gişede satıştadır konserlere bekliyoruz
art,ağustosta konserine gidesiniz varsa hızlı hareket etmelisiniz
art,ağustostaki  eylüldeki stevie konserleri küçükçiftlik parkta gerçekleşecektir popüler
art,ağustostaki  eylüldeki stevie konserleri küçükçiftlik parkta gerçekleşecektir
art,iksv hollandatürkiye arasındaki diplomatik ilişkilerin başlangıcının  yılı kutlamaları kapsamında dünyaca
art,iksv  yılında başlattığı bitambiöğrenci projesinin kapsamını  yılından genişleterek
art,yılını özel projelerle kutlayan iksv haziran ayında dünya çapında tanınan gösteri topluluğu fura baus
art,yılımızı kutladığımız nin dönemindeki etkinliklerimiz sona erdi etkinliklere  binin üzerinde izleyici katıldı
art,kültür sanat vakfı iksvnın  yılını kutladığı nin döneminde gerçekleştirdiği etkinlikler
art,dün akşamki ustalarla buluşmalar morrissey konserleri sona erdi
art,biletleri tükenen morrissey konseri izleyicilerimizin yoğun ilgisi sınırlı sayıda ayakta biletle
art,akşamki ustalarla buluşmalar morrissey konserleri sona eriyor
art,caz festivali yaşam boyu başarı ödülü  sahibi besteci müzik eleştirmeni radyo programcısı
art,tasarım bienalinde görev alacak lojistik sorumlusu prodüksiyon elemanı aranmaktadır
art,ali kazma
art,fura baus gösterisi kaçıranla izlemek isteyenler  temmuz
art,fura baus gösterisi  temmuz cumartesi akşamı saat kanalında yayınlanacak kaçırmayın
art,sevgili arkadaşımız meriç soyluyu kaybetmenin derin üzüntüsünü yaşıyoruz ailesi dostları sanat ekibine başsağlığı dileriz
art,venedik bienali türkiye pavyonunun sanatçısı belirlendi ali kazma venedik bienalinde türkiyeyi temsil
art,yılında gerçekleştirilecek venedik bienali  uluslararası sanat sergisinde türkiyeyi ali kazma temsil
art,cité başvuruları uzatıldı  yılının başından yana başvuruları yıl boyunca kabul edilen
art,iksv binasında bulunan gişede bilet satış işlemlerinden sorumlu olacak gişe görevlisi aranmaktadır gişe
art,marcus iksvnin  yılında özel projeye imza atıyor dünya prömiyeri akşam
art,yarın akşam açık hava sahnesinde olacak marcus millerdan mesajınız
art,müzikseverlerin yıllardır gözle beklediği popüler müziğin büyük ismi stevie desteğinin
art,notları kanal   sanat takibi ntv  gece gündüz türk  ülke
art,caz festivali bugün başlıyor festivali hesabından takip edebilirsiniz
art,dünyanın saygın orkestralarından filarmoni orkestrası istanbulda orkestranın daimi şefi
art,iksv  yıl özel gösterisini hazırlayan fura baus  temmuzda gösterisiyle havre stadında
art,leslie şimdiye  ödüllerine gösterildi  yılında ödüllerinde yılın
art,caz festivalini twitterda takip musunuz
art,johnsons konserinde mekan değişikliği söz konusu değildir ilginiz teşekkür eder konsere bekleriz
art,aydın gün bursu haberi xistte
art,aydın gün bursu haberi grizinede
art,kültür sanat hayatinin bugünlere gelmesine büyük katkisi aydin adina genclere verecek
art,iksv  yılında aydın günü anıyor aydın gün bursu genç sanatçılar yetişecek kültür sanat
art,güne stevie wonderın klasikleşen şarkısı başladık stevie  eylülde
art,eylülde santralistanbuldaki konserinden stevie moda töre takıl blogunda
art,ağustosta istanbulda indiefolk müziğin dünyada sevilen isimlerinden kanadalı şarkıcı
art,esperanza   temmuz atlamayın
art,festivalinin siyahbeyaz anıları kitaba dönüştü
art,kültür sanat vakfı  yıl kutlamaları kapsamında türkiyenin önde gelen fotoğraf sanatçılarından ozan
art,kaçıranlar iksv  yıl özel gösterisi fura baus
art,iksvnin kadınları  hürriyet pazar
art,fura baustan ikinci gecesinde gösteri başladı
art,siteleri  altın örümcek ödüllerinin etkinlikkültür sanat kategorisinde ödül aldı
art,iksv  yıl özel gösterisi  fura baus haberi ispanyanın gazetesinde
art,dün akşamdan fotoğraflar facebookta fura baus akşam tekrar camialtı tersanesinde
art,facebook iksv  yıl özel gösterisi  fura baus istanb
art,fura baus kaçıranlar akşam tekrar camialtı tersanesinde
art,tasarım bienalinde çalışacak bütçe sorumlusu arıyoruz
art,camialtı tersanesinde devam
art,devam fura baus iksvnin  yılını kutluyoruz
art,fura baus başladı
art,fura baus başlıyor camialtı tersanesi akşamki sıradışı gösteri hazır
art,iksvnn  yılında düzenlediği festivali  haziranda başlamıştı bugün iksvnin  yılını fura baus kutluyoruz
art,fura baus gece yarın gece camialtı tersanesinde kaçırmayın
art,bugün ntv radyoda yayından fura baus gösterimine  haziran davetiye kazanma şansı yakalayabilirsiniz
art,iksv  yıl özel gösterisi  fura baus    haziran tarihlerinde camialtı tersanesinde
art,akşam yarın yılı sebebiyle izleyebileceğimiz nefis gösterilerden  htt
art,fura baus istanbulun prömiyeriyle akşam camialtı tersanesinde
art,istanbulun  haziran biletleri tükendi  haziran cuma akşamı izlemek isteyenler elinizi
art,fura bausun dünya prömiyerini yapacağı istanbula hazır mısınız
art,fura bausa hazır mısınız
art,sibel hanım  haziran biletler tükenmiştir  hazirandaki gösterime bekleriz
art,fura bausa hazır mısınız dünyanın çarpıcı gösteri sanatları topluluğu fura baus iksvnin
art,fura baus gösterisinde istanbulun güzellikleriyle beslenen iksvnin  yıllık
art,facebook fura baus
art,fotoğrafçı ali özün objektifinden fura baus gösteri hazırlıkları fotoğrafları
art,iksv  yıl özel gösterisi  fura baus  haziranda camialtı tersanesinde
art,hatırlatalım fura bausun gösterisine davetiyemiz olacak
art,fura baus  haziranda camialtı tersanesinde hazırlık görüntüleri youtubeda
art,yılı fura bausun istanbulu dün tanıtıldı gösteriler  haziranda
art,istanbulu türkiyeden  gönüllü dansçı oyuncu sahneleyecek dünyada açıkhavada
art,facebook fura baus basın toplantısı göster
art,haziranda camialtı tersanesinde olacak fura bausun dünya prömiyerini gerçekleştireceği
art,fura baus iksv  yıl özel gösterisi basın toplantısı başladı  hazirana kaldı
art,fura baus iksv  yıl özel gösterisi hazırlıkları camialtı tersanesinde devam
art,fura baus prova    camiialtı tersanesi
art,biliyorsunuz artık yakın ön hazırlık
art,kaciranlara  eylulde bagiracak ruhlarimiz arinacak
art,uluslararası basında gösterilerinden övgüyle bahsedilen fura baus ingilterenin
art,iksv dünyanın saygın orkestralarından filarmoni orkestrasını istanbulda ağırlıyor orkestranın daimi
art,devam yaklaşan twitterda takip musunuz
