art,fazıl   viyana orkestrası
art,cité konuğunu bekliyor misafir sanatçı programının türkiye atölyesi  yılı başv
art,sonbaharın rengi biletler bugünden hizmet bedelsiz  rexx sinemaların
art,ağın parçası dmain karar süreçlerinde söz sahibi etkin rol oynayacak
art,avrupadaki konser mekânlarını bünyesinde toplayan desteklemeyi amaçlayan dma ağ
art,süresince görev almak sergi rehberi aranıyor başvuru
art,türkiyedeki eğlence müzik sektörünü anlatan türkiye  başlıklı hakkında ayrıntılı bilgi
art,türkiye genel müdür yardımcısı karaoğlan taşçı birer konuşma yaptılar
art,türkiye panelinde direktörü pelin opcinin yanı sıra kurucularından
art,dün londrada düzenlenen türkiyenin aralarında farklı ülkeden  festivalin
art,iksv  yılında sonbahar haftası başlığı düzenlenmişti
art,hakkında ayrıntılı bilgi
art,sonbaharın rengi istanbulda  ekim tarihleri arasında sponsorluğunda düzenleniyor
art,biletleri sarı kırmızı lale üyeleri bugünden satışta
art,efsane yönetmen burtonın merakla beklenen filmi bayan peregrinein tuhaf çocukları akşam nda
art,biletleri siyah beyaz lale üyeleri bugünden satışta
art,cinemaximum citys nişantaşında gerçekleştirilecek gösterim biletler iksvde
art,ın şaheseri bayan peregrinenin tuhaf çocukları yarın akşam nda
art,dilek makinesine veriyor
art,bayan peregrinein tuhaf çocukları biletler bugünden iksvde
art,yazı açık havada güzel müzikle bitiriyoruz parklarda caz bugün fenerbahçe parkında
art,merhaba ilginiz teşekkür ederiz eylül ayı içerisinde geri dönüşlerimizi tamamlayacağız
art,lale üye sunumu başladı direktörü kerem ayan programı anlatıyor
art,eylül salı akşamı cinemaximum citys nişantaşında gösterilecek biletler  eylül cumartesi gününden
art,doğaüstü yetenekleri çocukların devam özel okulu konu muhteşem oyuncu kadrolu
art,ın şaheseri bayan peregrinein tuhaf çocukları nda
art,abdli efsanevi trompetçi grubu iksvnin düzenlediği özel etkinlikte konser
art,programı hakkında ayrıntılı bilgi
art,yıl  ekimde ankaraya  ekimde izmire  ekim tarihlerinde bursaya eskiş
art,filmekimi ekim ayı boyunca türkiyenin farklı kentlerindeki sinemaseverlere yılın güncel filmlerini sunma
art,sponsorluğunda düzenlenen  ekim tarihlerinde istanbulda  gün sürecek sinema maratonu
art,sonbaharın rengi filmekimi  ekimde başlıyor
art,pazarlama geliştirme departmanında görev almak gişe görevlisi aranıyor
art,italia ayın popüler enstalasyonları arasında dilek makinesine veriyor
art,dilek makinesi görülmesi gereken sergiler listesinde alıyor
art,amerikalı müzisyen patti  caz festivalinde  açık havada konser vermişti
art,öne çıkanlar listesinde dilek makinesine veriyor
art,darzanà kaçırılmaması gereken  projesi arasında
art,türkiye sergisinde dilek makinesi mutlaka görülmesi gerekenler listesinde
art,olkan özyurt dilek makinesini yazdı dilek makinesi londrayı umutlandırdı
art,jale özgentürk türkiye sergisindeki dilek makinesini yazdı
art,sınır ihlalleri melezlik üzerine proje darzanà projesinin kitabı hakkında ayrıntılı bilgi
art,venedik bienali  uluslararası mimarlık sergisi türkiye pavyonunda sergilenen darzanànın kitabı yayınlandı
art,güher süher pekinel piyano ikilisi  festivalinde  akmde konser vermişti
art,autoban
art,dilek makinesi ın hazırladığı nın kaçırılmayacak sergileri arasında
art,dilek makinesi tasarım dünyasına tanıtıldı
art,sponsorluğunda gerçekleştirilen sergi  eylüle olacak
art,dilek makinesi anadolu inanışında derin sahip dilek ağacından ilham alıyor
art,türkiye sergisinde nin hazırladığı dilek makinesi adlı proje alıyor
art,londra tasarım bienali türkiye sergisi bugün açıldı
art,iksvnin koordinasyonunu üstlendiği dilek makinesi hazırlandı
art,türkiye sergisinde bugün ön izleme tasarım dünyasına tanıtıldı
art,ekim arasında görev almak etkinlik görevlileri aranıyor
art,direktörü turnerı heyecanlandıran projelerden dilek makinesi
art,firstever
art,harika prodüksiyon ekibine emekleri teşekkür ederiz
art,türkiye sergisinde alacak dilek makinesi projesinin kurulumu devam
art,türkiye sergisinde alacak dilek makinesi projesinin kurulumu akşam başladı
art,bugünden iksvden edilebilir
art,eylülde sinemasında gerçekleşecek iksv galaları özel gösterimi biletler
art,direktörü turnerın dilek makinesi projesinden bahsettiği röportajı
art,istanbuls
art,dünyaca ünlü flamenko gitaristi peña  festivalinde  akmde konser vermişti
art,seedsin albümünün hikayesi dünyayla aynı istanbulda http
art,iksv galaları devam
art,özel gösterimi hakkında ayrıntılı bilgi
art,albümünün yayımlanmasından gün gerçekleştirilecek özel gösterimin biletleri  eylülden
art,albümü treenin yaratım sürecini belgeleyen  eylülde sinemasında olacak
art,hariçten sanatta dinleyebilirsiniz
art,direktörü deniz ovanın çelenk bafra üzerine sohbetini akşam
art,türkiye sergisinde alacak dilek makinesi projesine veriyor
art,efsanevi gitaristi  festivali kapsamında konser vermişti
art,özlediğimiz konserlere kaldı sezon biletleri bugünden iksvde
art,özlediğimiz konserlere geri sayım başladı dopdolu programla sezona hazır
art,merhaba programımız gönüllü staj programı dahilindedir stajyerlerimize yemek desteği sağlanmaktadır ilginize teşekkürler
art,nde görev almak sergi rehberi aranıyor
art,nde görev almak sergi kurulum asistanları aranıyor
art,nde görev almak sergi görevlisi aranıyor
art,medya ilişkilerinde görev almak uluslararası medya ilişkileri stajyeri aranıyor
art,iksv staj başvuruları devam başvuru
art,talât sait halman çeviri ödülü  başvurular bugün başladı ayrıntılı bilgi
art,talât sait halman çeviri ödülü başvuruları
art,talât sait halman çeviri ödülünün  yılı değerlendirme başvuruları  ağustos pazartesi günü açılıyor
art,festivalinden yönetimindeki filarmoni orkestrası konseri
art,nde görev almak sergi görevlisi aranıyor başvuru
art,nde görev almak sergi rehberi aranıyor başvuru
art,nde görev almak sergi kurulum asistanları aranıyor başvuru
art,merhaba sergi mekanı resim heykel müzesi bahçesidir ilginiz teşekkür ederiz
art,günümüz sanatçıları sergisi  konservatuar öğrencilerinin dans gösterisiyle açılmıştı
art,proje sponsorluğunda tekno  barrisol desteğiyle batı kanadında sergilenecek
art,bienal türkiyenin aralarında üzerinde ülkeden projeyi  eylül tarihleri arasında araya getirecek
art,sergide iksvnin koordinasyonunu üstlendiği nin hazırladığı dilek makinesi adlı proje alıyor
art,yıl düzenlenecek londra tasarım bienalideki türkiye sergisi  eylülde açılıyor
art,societynin türkiye prömiyerine gösterdiğiniz ilgi teşekkür ederiz gösterimin biletleri tükenmiştir
art,yoğun ilgiden iksv galaları café aynı seansta  rexxte salonda gösterilecektir
art,rexxte salonda café gösterilecek bilet satışları takipte kalın
art,iksv galalarına gösterdiğiniz ilgi teşekkür ederiz yoğun ilgiden aynı seansta
art,kadıköy rexx sinemasında gerçekleşecek gösterim hakkında ayrıntılı bilgi
art,ağustostaki iksv galaları café özel gösterimi biletler bugünden iksvde
art,gösterim günü    arası arasında rexx sinemasından edilebilir ayrıntılı bilgi
art,café societynin özel gösteriminin biletleri  ağustos çarşamba  gişe iksv
art,adını dönemin renkli kişiliklerine verilen lakaptan hareketli duygusal göz alıcı
art,café ların hollywoodunun panoramik hikâyesini anlatıyor
art,café societynin kadrosunda  kristen  isimler alıyor
art,ağustosta festivali işbirliğiyle rexx sinemasında gösterilecek
art,iksv galaları allenın filmi café societynin türkiye prömiyeri başlıyor
art,iksv ebültenlerine abone olun festivallerden etkinliklerden habersiz kalmayın
art,festivalinde münir nurettin selçuk idaresinde türk musikisi konseri düzenlenmişti
art,hatirlatma konseri mekan değişikliği akşam gerçekleştirilecektir htt
art,önemli duyuru konseri mekan değişikliği sonrasında akşam gerçekleştirilecektir
art,ingilterenin çıkardığı güçlü seslerden akşam olacak
art,bilet iadesi isteyen izleyicilerimiz bilet aldıkları gişeye başvurabilirler
art,ağustosta gerçekleştirileceği duyurulan baez konseri sanatçının isteği üzerine iptal olmuştur
art,caz festivali değişiklikleri hakkında önemli duyuru
art,caz festivali programı hakkında önemli duyuru
art,konserde pekkana grup çağdaş devlet senfoni orkestrasından sanatçılar onno tunç mfö eşlik etmişti
art,ajda pekkan  yılında iksvnin düzenlediği  festivalinde sahneye çıkmıştı
art,başvuru
art,pazarlama geliştirme departmanında temmuzağustos  tarihleri arasında yarı zamanlı görev alacak üye ilişkileri asistanı aranıyor
art,özverili çalışmalarıyla iksvye büyük emek veren manizadeyi sevgi saygıyla hatırlayacağız
art,yardımcılığını üstlenen sanatçısı atilla manizadeyi kaybetmenin derin üzüntüsünü yaşıyoruz
art,yılları arasında iksvnin yönetim kurulunda  yılları arasında vakfın genel müdür
art,iksv işbirliği nın desteği gerçekleşecek konser hakkında ayrıntılı bilgi
art,aktivist kimliğiyle popüler müziğin önemli seslerinden   ağustosta izmir kültürparkta olacak
art,nde görev almak sergi görevlisi aranıyor başvuru
art,nde görev almak sergi rehberi aranıyor başvuru
art,nde görev almak sergi kurulum asistanları aranıyor başvuru
art,ağustos cuma günü izmir kültürpark açıkhava tiyatrosunda gerçekleşecek unutulmaz konseri kaçırmayın
art,iksv işbirliği nındesteği efsanevi sanatçı izmirde
art,uluslararası sinema günleri festivalinden ayrı gerçekleştirilmişti
art,iksv işbirliği nın desteği düzenlenen konser hakkında ayrıntılı bilgi
art,kuşağının etkileyici isimlerinden baez  ağustos akşamı izmir kültürparkta olacak
art,haziranda istanbulda yaşanan saldırıda hayatını kaybedenlerin ailelerine yakınlarına başsağlığı yaralılara acil şifalar diliyoruz
art,dilek makinesinin detayları bugün taksimde gerçekleştirilen basın toplantısıyla tanıtıldı
art,iksvnin koordinasyonunu üstlendiği nin hazırladığı dilek makinesi projesi sergilenecek
art,yıl  eylül tarihlerinde düzenlenecek londra tasarım bienaline türkiyeden katılacak proje tanıtıldı
art,iksv gişeden edilebilir ayrıntılı bilgi
art,ağustosta izmir kültürparkta gerçekleşecek konseri biletler bugünden
art,temmuza devam festivalin programı hakkında ayrıntılı bilgi
art,akşam suriyeli müzisyenler orkestrası konseri başlıyor
art,ağustos akşamı izmir kültürpark açıkhava tiyatrosunda gerçekleşecek konserle ayrıntılı bilgi
art,konseri biletler lale üyeleri bugünden iksvde
art,pazarlama geliştirme departmanında zamanlı görev alacak satış geliştirme sorumlusu aranıyor
art,konserin biletleri  haziran salı gününden edilebilir ayrıntılı bilgi
art,kuşağının etkileyici isimlerinden baez  ağustosta açıkhava tiyatrosunda olacak
art,iksv işbirliği nın desteğiyle müziğin efsane sesi izmirde
art,iksvnin  yılında düzenlediği  festivalinde konser vermişti
art,haziran akşamı  suriyeli müzisyenler konukları konseri başlıyor http
art,kurum kimliği yayınlar departmanında zamanlı görev almak grafiker aranıyor
art,hazirandaki konserle ayrıntılı bilgi
art,suriyeli müzisyenler konserinin konuklarına özel hazırladığımız listemiz yayında
art,performanslarını izleyeceğimiz issam rafeanın röportajı
art,nın açılış konseri projesini kaçırmayın ayrıntılı bilgi
art,direktörü pelin opcin  haziranda ın sahne alacağı özel projeyi anlattı
art,festivali kapsamında arkeoloji müzeleri açık hava sergisi düzenlenmişti
art,hazirandaki suriyeli müzisyenler konserinin sürpriz isimleri
art,venedik mimarlık bienalinde öne çıkan ulusal pavyonları incelediği haberinde veriyor
art,arsenale
art,suriyeli müzisyenlerle aynı sahneyi paylaşacak konuştu
art,konser hakkında ayrıntılı bilgi
art,gorillazın solisti  caz festivali kapsamında suriyeli müzisyenler istanbulda
art,bugün venedik mimarlık bienali özel bölümünde darzananın hikayesi ekrana geliyor
art,venedik mimarlık bienali projesi izlenimlerini kaçırmayın
art,bugün venedik mimarlik bienali türkiye pavyonu hazırlanan programı izleyebilirsiniz
art,darzanànın küratörlerinden feride çiçekoğlunun röportajını dinleyebilirsiniz
art,ün hazırladığı venedik mimarlık bienali haberi
art,sanat dünyasına ailesine başsağlığı dileriz
art,türkiye atölyesi seçici kurul üyesi banu dicleyi kaybetmenin derin üzüntüsünü yaşıyoruz
art,türkiye pavyonu darzana venedik mimarlık bienalindeki  pavyondan
art,darzana vassel scopri padiglione turchia
art,turchia darzanà
art,iksv ebültenlerine abone olun festivallerden etkinliklerden habersiz kalmayın
art,başvuru
art,pazarlama geliştirme departmanında zamanlı görev alacak satış geliştirme sorumlusu aranıyor
art,başvuru
art,pazarlama geliştirme departmanında hazirantemmuz  tarihleri arasında yarı zamanlı görev alacak üye ilişkileri asistanı aranıyor
art,mustsee  architettura venezia ecco
art,venedik bienali  uluslararası mimarlık sergisi türkiye pavyonunda sergilenen darzanànın proje ekibi
art,merhaba hızlı yardımcı olabilmemiz adına konuyla detaylı bilgi iletebilir misiniz ilginiz teşekkür ederiz
art,venedik mimarlık bienali darzana projesi
art,renzo bülent eczacıbaşı görgün taner türkiye pavyonunda darzanàyı ziyaret
art,dünyaca ünlü mimar chipperfield türkiye pavyonunda darzanàyı gezdi
art,darzanà tersane vasıta hakkında ayrıntılı bilgi
art,darzanà tersane vasıta projesi alıyor
art,iksvnin koordinasyonunu yürüttüğü schüco türkiye nin eş sponsorluğunda gerçekleştirilen türkiye pavyonunda
art,venedik bienali  uluslararası mimarlık sergisi türkiye pavyonu bugün açıldı
art,elore
art,ayrıntılı bilgi başvuru
art,medya ilişkileri departmanında temmuz  aralık  arasında zamanlı görev almak medya ilişkileri koordinatörü arıyoruz
art,biletler satış noktalarında etkinlik gişelerinde satıştadır ilginiz teşekkür ederiz
art,etkinlik öncesi mekâna kurulacak gişeden edebilir seyirler dileriz
art,akşam sahnelenecek kuruşluk biletler satış noktalarından
art,wilsonın yönettiği ensembleın sahnelediği kuruşluk ayrıntılı bilgi
art,bertolt efsanesi kuruşluk bugün ikinci izleyicisiyle buluşuyor
art,ödülü topluluğun artistik direktörü peymann dün akşamki oyun sonrasında iksv yönetim kurulu başkanı bülent eczacıbaşından aldı
art,tiyatro festivalinin üçüncü onur ödülü dünyaca ünlü tiyatro topluluğu ensemblea verildi
art,etkinlik ayrıntılı bilgi
art,bertolt efsanesi kuruşluk akşam yarın akşam izleyicisiyle buluşuyor
art,etkinlik akşam saat lütfi kırdar anadolu auditoriumunda gerçekleşecek
art,leyla gencer anısına düzenlenen konser serisinde yıl operası
art,buluşma noktalarından yıl boyu süren  etkinliklerinden lale kartlıların ayrıcalıklı dünyasından haberdar
art,lale artık
art,özel haftalık listeler  konuklarından seçkiler hesabımız dopdolu
art,kültür sanat vakfının listelerini takip musunuz
art,efsanesi kuruşluk istanbulda biletler iksvde
art,darzanà tersane vasıta projesi hakkında ayrıntılı bilgi
art,venedik bienali  uluslararası mimarlık sergisi türkiye pavyonunda darzanànın kurulumu başladı
art,cevdet erek
art,cevdet erek
art,mayıs kasım  tarihlerinde gerçekleştirilecek ayrıntılı bilgi
art,koordinasyonunu iksvnin yürüttüğü sergide cevdet erekin çalışacağı proje ekibi önümüzdeki aylarda açıklanacak
art,venedik bienali  uluslararası sanat sergisinin türkiye pavyonunda alacak isim açıklandı cevdet erek
art,efsanesi kuruşluk istanbulda biletler iksvde
art,kültür sanatla dolu hayatı yakıştırırız istanbula gelsenize
art,iksv ebültenlerine abone olun festivallerden etkinliklerden habersiz kalmayın
art,filmler hayatında iz bırakır gir filmleri tahmin sende iz bırakanları öğren
art,hizmet bedelsiz iksv gişeden edebilirsiniz ayrıntılı bilgi
art,yıldır bankası sponsorluğunda düzenlenen caz festivali biletlerini
art,caz festivali biletleri bugünden satışta
art,merhaba etkinliğin videosu iksv youtube hesabına yüklenmiştir seyirler dileriz
art,darzanà  nisanda salonda gerçekleştirilen etkinliğin videosunu izleyebilirsiniz
art,türkiye pavyonunda darzanà tersane vasıta başlıklı proje alacak
art,yıl  mayıs kasım tarihleri arasında gerçekleştirilecek venedik bienali  uluslararası mimarlık sergisi
art,ilginiz teşekkür ederiz
art,merhaba videoyu kısa zamanda yayınlayacağız youtube hesabımızı takip edebilirsiniz
art,bienalinin küratörlüğünü elmgreen ingar dragset ikilisi üstlenecek ayrıntılı bilgi http
art,sponsorluğunda düzenlenen bienali  eylül kasım  tarihleri
art,bienalinin küratörleri
art,filmler hayatında iz bırakır gir filmleri tahmin  davetiye kazan
art,iksvnin desteklediği  vakfının orkestraları adını avrupada yavaş yavaş duyuruyor
art,festivali sponsorlarına teşekkür daveti gerçekleştirildi  http
art,sinema tarihinin ini tahmin  davetiye kazanma şansı yakala
art,efsanesi kuruşluk istanbulda biletler iksvde
art,sinema tarihinin ini tahmin  davetiye kazanma şansı yakala
art,filmine davetiye kazanmanın yolu iz bırakan filmlerden geçer
art,bugün başladı sponsorluğunda  nisana devam
art,darzanànın küratörlerinden feride çiçekoğlu proje küratöryel işbirliği yapan namık erkal projeyi konuşuyor
art,darzanà projesiyle akşam etkinlik gerçekleştirilecek
art,koordinasyonunu yürüttüğü darzanà başlıklı proje alacak
art,mayıs kasım  tarihleri arasında gerçekleştirilecek venedik bienali  uluslararası mimarlık sergisi türkiye pavyonunda iksvnin
art,efsanesi kuruşluk istanbulda biletler iksvde
art,festivali  tarihleri arasında sponsorluğunda gerçekleştirilecek
art,darzanà  salı akşamı saat etkinlik gerçekleştirilecek
art,türkiye pavyonunda iksvnin koordinasyonunu yürüttüğü darzanà başlıklı proje alacak
art,yıl  mayıs kasım  tarihleri arasında venedik bienali  uluslararası mimarlık sergisi gerçekleştirilecek
art,efsanesi kuruşluk istanbulda biletler iksvde
art,iksv ebültenlerine abone olun festivallerden etkinliklerden habersiz kalmayın
art,iksv staj başvuruları başladı başvuru
art,ortak yapım marketi kapsamında görev almak stajyer aranıyor başvuru
art,caz festivali kapsamında çalışmak  hostes aranıyor başvuru
art,caz festivali kapsamında çalışmak sanatçı asistanı aranıyor başvuru
art,tiyatro festivali kapsamında çalışmak sanatçı asistanı aranıyor başvuru
art,müzik festivali kapsamında çalışmak sanatçı asistanı aranıyor başvuru
art,nisantemmuz eylülkasım  tarihleri arasında zamanlı görev alacak danışma görevlisi aranıyor başvuru
art,temmuz  tarihleri arasında zamanlı görev alacak fotoğraf asistanı aranıyor başvuru
art,caz festivalinin programı açıklandı
art,efsanesi kuruşluk mayıs ayında istanbulda
art,bugünden hizmet bedelsiz satış kanalları rexx sinemalarında satışta
art,tarihleri arasında sponsorluğunda gerçekleştirilecek  festivali biletleri
art,festivali  tarihleri arasında sponsorluğunda gerçekleştirilecek
art,nisantemmuz  tarihleri arasında zamanlı görev alacak fotoğraf asistanı aranıyor başvuru
art,nisantemmuz eylülkasım  tarihleri arasında zamanlı görev alacak danışma görevlisi aranıyor başvuru
art,iksv
art,cité türkiye atölyesine katılacak sanatçılar belirlendi
art,festivali programı açıklandı
art,yerel yönetimler kültürel planlama raporu üzerine
art,iksv genel müdürü kültür politikaları çalışmaları direktörü
art,tiyatro festivali biletleri bugünden biletix iksvde
art,dünyaca ünlü ingiliz tasarım dergisi darzanà projesi haberi
art,venedik bienali  uluslararası mimarlık sergisi türkiye pavyonunda alacak darzanàyı küratörleri anlatıyor
art,darzanà
art,venedik istanbuldan esinleniyor ayrıntılı bilgi
art,darzanà tersane vasıta projesi zamanlar akdenizin ikiz limanları tersane şehri
art,ortak yapım marketi görev almak isteyen stajyerlerini arıyor başvuru
art,venedik bienali  uluslararası mimarlık sergisi türkiye pavyonu projesi basın toplantısıyla açıklandı
art,darzanà ayrıntılı bilgi ziyaret edebilirsiniz
art,darzanà projesiyle  nisanda ön etkinlik gerçekleştirilecek
art,kentin ortak kültürel mirasını vurgulayarak mimarideki izlerini gelecek hayallerine yansıtmak biçimleniyor
art,darzanà zamanlar akdenizin ikiz limanları tersane kentleri venedik arasında köprü kurmak
art,darzanà türkçede tersane italyancada aynı anlama gelen arsenale sözcükleriyle ortak kökenden geliyor
art,cemal namık erkalın küratöryel işbirliğiyle şekillendirilecek
art,darzanà tersane vasıta adlı proje küratörler feride çiçekoğlu mehmet kütükçüoğlu ertuğ uçar önderliğindeki proje ekibinin
art,eş sponsorlarımızdan adına eczacıbaşı yapı ürünleri grubu başkanı atalay gümrah konuşmasını
art,eş sponsorlarmızdan schüco türkiye adına genel müdür eren konuşmasını
art,iksv genel müdürü görgün taner konuşmasını
art,venedik bienali  uluslararası mimarlık sergisi türkiye pavyonu schüco türkiye nin eş sponsorluğunda gerçekleştirilecek
art,basın toplantısını iksvnin hesabından canlı izleyebilirsiniz
art,bienalin mekânlarından arsenaledeki darmi binasında alacak
art,iksvnin koordinasyonunu yürüttüğü türkiye pavyonu  mayıs kasım  tarihleri arasında düzenlenen
art,venedik bienali  uluslarası mimarlık sergisinin türkiye pavyonu basın toplantısı
art,venedik bienali  uluslararası mimarlık sergisinin türkiye pavyonu projesinin basın toplantısı deniz müzesinde gerçekleşiyor
art,efsanesi kuruşluk mayıs ayında istanbulda
art,iksv cittadellartefondazione pistoletto ortaklığıyla düzenlenecek sergi  marta ücretsiz gezilebilir
art,osmanlılar avrupalılar geçmiş zamanlar olasılıklar sergisi  martta tophanei amirede açılıyor
art,efsanesi kuruşluk mayısta istanbulda biletler iksvde
art,yurtdışı projeler yöneticimiz ortaylı kazıcı  martta cité üzerine konuşacak
art,tiyatro festivali programı açıklandı
art,kurulan tasarım ofisi autoban gerçekleştirecek ayrıntılı bilgi
art,kültür sanat vakfı üstleniyor türkiye sergisinde alacak proje seyhan özdemir sefer çağlar
art,türkiye alacakyaklaşık ülkeden tasarımcıların araya geleceği bienalin türkiye sergisinin koordinasyonunu
art,yıl  eylül tarihleri arasında tasarımla ütopya teması altında düzenlenecek londra tasarım bienalinde
art,efsanesi kuruşluk istanbulda
art,anketin sonuçlarına veriyor raporu indirmek
art,rapor belediyeler alanda rehber özelliği taşırken kültürel planlama konusunda farklı kıtadan yürütülen
art,iksvden rapor iksvnin kültür politikaları çalışmaları kapsamında hazırlanan yerel yönetimler kültürel planlama başlıklı
art,stüdyo departmanında zamanlı görev alacak stüdyo asistanı aranıyor başvuru
art,biletix iksvde
art,müzik festivali biletleri satışta köşesine ruhu sinecek festivalin biletleri bugünden itib
art,ilhamını shakespearein müzik aşkın gıdasıysa durmadan çalınız dizelerinden
art,şubat akşamı fransız lisesindeyiz
art,uzak doğu restoranı listesinde aldı
art,hürriyet gazetesinde yayımlanan yemek bloggerları yemek gazetecilerinden oluşan jürinin belirlediği
art,nejat eczacıbaşı binasının üst katında kapılarını açtı asya akdeniz mutfaklarını araya getiren
art,istanbuldaki meditasian konseptli restoran olma özelliğini taşıyan geçtiğimiz ekim ayında
art,konuk asistanı akreditasyon prodüksiyon gönüllüleri aranıyor başvuru
art,festivali kapsamında görev alacak
art,festivali kapsamında görev alacak kapı kontrol görevlileri aranıyor başvuru
art,festivali kapsamında görev alacak etkinlik görevlileri aranıyor başvuru
art,festivali kapsamında görev alacak üyelik programı temsilcileri aranıyor başvuru
art,ayrıntılı bilgi
art,kültür sanat vakfı cittadellartepistoletto ortaklığıyla düzenlenecek sergi ücretsiz gezilebilecek
art,osmanlılar avrupalılar geçmiş zamanlar olasılıklar sergisi açılıyor
art,tarihleri arasında msgsü tophanei kültür sanat merkezi kubbe salonunda
art,belçikanın önde gelen sanat kurumlarından bozarın liderliğinde sanat kurumunun ortaklığıyla
art,efsanesi kuruşluk mayıs ayında istanbulda
art,tiyatro festivali kapsamında görev alacak sanatçı asistanı aranıyor başvuru
art,dünya müziğinin kalbi  haziran tarihleri arasında istanbulda atıyor
art,müzik festivali ilhamını shakespearein müzik aşkın gıdasıysa durmadan çalınız dizelerinden alıyo
art,ayrıntılı bilgi
art,barışın sesini müzikle duyurmayı hedefleyen barış müzik vakfı kadıköy konserlerine yenisini eklemeye hazırlanıyor
art,biletler biletix iksvde
art,sahnelendiği ülkelerde kapalı gişe oynayan kuruşluk enka vakfı sponsorluğunda  mayısta tiyatroda olacak
art,ölümünün altıncı yıldönümünde saygıyla anıyoruz
