art,fazıl   viyana orkestrası
art,kaçırırsanız üzülürsünüz
art,vakfına destek vermek amacıyla  mayısta
art,destek tekrar sahnede mayıs cuma saat davetlisiniz http
art,uluslararası basında venedik bienali  uluslararası sanat sergisi türkiye pavyonu haberleri
art,cité iksv
art,ayrıntılı bilgi
art,cité misafir sanatçı programının türkiye atölyesi temmuzeylül dönemi başvuruları kabul edilmeye başladı
art,bienali ekibinde alacak nakliye asistanı aranıyor başvuru
art,venedik bienali türkiye pavyonunun  mayısta gerçekleştirilen açılışından fotoğraflar
art,venedik bienali türkiye pavyonu açıldı
art,artreview
art,mayıs arasında kanyonun yerinde müzik
art,bienali ekibinde alacak sergi kurulum gönüllüleri aranıyor başvuru
art,bienali ekibinde alacak nakliye asistanı aranıyor başvuru
art,kültür politikaları çalışmaları direktörü özlem ece sanat eğitimi sorunlarını konuştuk
art,demiş sanatı takip etmek zor
art,sarkis
art,sarkis
art,caz festivali ekibi içinde alacak kulis sorumlusu aranıyor başvuru
art,müzik festivali kapsamında görev alacak sanatçı asistanı aranıyor başvuru
art,bienali ekibinde alacak prodüksiyonu asistanı aranıyor başvuru
art,venedik bienali  uluslararası sanat sergisi türkiye pavyonunda kurulum bitti açılışa geri sayım başladı
art,venedik bienali türkiye pavyonu sergisinin açılışına geri sayım başladı
art,bienali ekibinde alacak prodüksiyonu asistanı aranıyor başvuru
art,temmuzda şehir caz ışıklarıyla parlayacak
art,bienalinde görev alacak sanatçı asistanı sergi rehberi sergi görevlisi aranıyor başvuru
art,festivali yönetmeliği uyarınca festivale başvuran filmlerden belge talep edilmiyor
art,yazıda festivalde türkiyede üretilen kayıt tescil belgesi filmlerin gösterilmesi halinde yaptırım uygulanac
art,kültür turizm bakanlığı sinema genel müdürlüğünden  cumartesi günü iksvye yazı gönderildi
art,yönetmelik gereği türkiyede üretilen filmlerin festivallerde gösterilebilmesi kayıt tescil belgesine sahip olmalar
art,sinema filmlerinin değerlendirilmesi sınıflandırılmasına ilişkin usul esaslar hakkında yönetmelik  yılından
art,toplantıda sözü festivali direktörü azize aldı
art,festivalinin dün gerçekleşen gösterim iptallerini takiben düzenlediği basın toplantısı başladı
art,festivalinden duyuru
art,türkiye sinema tarihine damgasını vuran sinematekin  yılı anılıyor
art,uluslararası genç yetenekler müzik yarışması başlıyor ayrıntılı bilgi
art,müzik festivali kapsamında görev alacak sanatçı asistanı aranıyor başvuru
art,caz festivali kapsamında görev alacak hosthostes sanatçı asistanı aranıyor başvuru
art,venedik bienalinde sarkisin respiro yerleştirmesi alacak röportajı htt
art,temmuzda şehir caz ışıklarıyla parlayacak
art,iletişim bilgilerinizi infoorg adresine iletebilirseniz konuyla görüşmek isteriz
art,leyla gencer şan yarışması başvuruları açıldı ayrıntılı bilgi
art,cité artsın nisanhaziran dönemindeki konuğu sümer belirlendi ayrıntılı bilgi
art,işler departmannda zamanlı görev alacak muhasebe memuru aranıyor başvuru
art,şehrin gözü festivalde
art,bienali ekibinde alacak editör yardımcısı aranıyor başvuru
art,nin desteğiyle basın toplantısını yarın sabah adresinden canlı iz
art,festivalinin programı  salı günü yarın gerçekleştirilecek basın toplantısıyla açıklanıyor
art,fazla sponsorluğunda  arasında festivalinde şehrin gözü festivalde htt
art,venedik bienalinde sarkisin respiro yerleştirmesi alacak röportajı htt
art,venedik bienalinde sarkisin respiro yerleştirmesi alacak küratör röportajımız htt
art,seçim bildirgeleri siyasi partilere kültür politikaları öncelikleri öneriler metninin tamamı
art,çocuğun sanat eğitiminden yararlanması hayal
art,barış müzik orkestrasının sanat yönetmenliğini  şubat ayından şef sascha goetzel üstlenecek
art,teki iksv standına uğramayı unutmayın alldesign  şubat tarihleri arasında lütfi kırdar kongre sergi sarayında
art,sarkis  venedik bienali uluslararası sanat sergisi türkiye pavyonunda alacak respiro eserini anlatıyor
art,sarkis babam sustu annesinin adını anmadan gitti
art,müzik festivali biletleri bugünden  iksvde
art,cité başvurusu uzatıldı ayrıntılı bilgi
art,bienali ekibinde alacak sergi koordinatörü asistanı aranıyor
art,müzik festivali programı açıklandı biletler  şubattan iksvde
art,sarkis  venedik bienali uluslararası sanat sergisi türkiye pavyonunu anlatıyor
art,sarkis türkiye pavyonunda nefes aldıracak
art,sarkis türkiye pavyonunda nefes aldıracak aracılığıyla
art,venedik bienali türkiye pavyonu basın toplantısından ali gülerin objektifinden fotoğraflar
art,venedik bienali türkiye pavyonu  mayıs kasım  tarihleri arasında arsenaledeki darmi binasında gerçekleşecek
art,sanatçı sarkis küratör defne ayas bienalin hatlarını anlatıyor
art,venedik bienali türkiye pavyonunda önemli kavramsal sanatçılardan sarkisin eserleri sergilenecek
art,venedik bienali türkiye pavyonu defne ayaş küratörlüğünde iksv koordinasyonuyla gerçekleştirilecek
art,bienal sponsoru adına tofaş kurumsal iletişim direktörü arzu çolakoğlu konuşmasını
art,iksv genel müdürü görgün taner açılış konuşmasını
art,venedik bienali uluslararası sanat sergisi türkiye pavyonu basın toplantısı başladı
art,türkiyede sanat eğitimini düşünmek raporunu adresinden indirebilirsiniz
art,iksvnin kültür politikaları çalışmaları kapsamında hazırlanan türkiyede sanat eğitimini düşünmek raporu yayımlandı
art,müzik festivali broşürünü iksv kitaplıktan adresinden indirebilirsiniz
art,pazarlama ekibinde alacak etkinlik görevlileri aranıyor başvuru
art,pazarlama ekibinde alacak üyelik programı temsilcileri aranıyor başvuru
art,festivali ekibinde alacak gönüllüler aranıyor başvuru
art,müzik festivalinin programı açıklandı hakkında ayrıntılı bilgi http
art,cité konuğunu bekliyor ayrıntılı bilgi
art,yıl boyunca iksvnin yönetim kurulu başkanlığını üstlenen şakir eczacıbaşını ölümünün  yıldönümünde saygıyla anıyoruz
art,medya ilişkileri koordinatörü aranıyor başvuru
art,mekân kapasitesi sınırlı olduğundan katılım durumunuzu bildirmenizi önemle rica ederiz ayrıntılı bilgi
art,iksv hakkındaki fikirlerinizi merak ediyoruz uygulamayı geliştirmek adına  ocakta iksv binasına bekliyoruz
art,festivalinin kurucularından onat kutlar  ocak hayatını kaybetti saygıyla anıyoruz
art,iksvye dokunun sanata kolayca ulaşın iksv uygulamasıyla etkinlikler elinizin altında
art,aydın gün teşvik ödülü genç kontrbasçı emre erşahine sunuldu
art,kültür sanat vakfı kültür sanatla dolu sağlıklı mutlu yıl diler
art,sevdiklerinize kültür sanat dolu yıl hediye edin
art,yılbaşında sevdiklerinize kültür sanat dolu yıl hediye edin
art,tsmd mimarlık ödülleri sahiplerini buldu kültür sanat vakfı tsmd jüri özel ödülünü aldı
art,orkestrası akşam  aralıkta lütfi kırdarda aynı sahnede buluşacak
art,brun biletleri tükenen konserinde izleyicilere müzik ziyafeti yaşatıyor
art,brunden boman küçükçiftlik parkta
art,istanbulda konser akşam
art,heyecanla beklediğimiz konsere saatler tanıyalım
art,beklenen geldi brun karanlığım sanırım
art,müzik yılda salonda ayrıntılı bilgi
art,aralıkta akustik konserle olacak ün istanbullu izleyicilerine mesajı
art,sevgili organizasyonu vereceği konser öncesi yaptığımız söyleşi http
art,iksv mütevelliler kurulu başkanı değerli kültürsanat insanı talât halmanı saygı sevgiyle hatırlayacağız
art,cité artsın ocakmart  dönemindeki konuğu gökçen dilek acay
art,tasarım bienali  aralıka galata özel ilköğretim okulunda
art,brun http
art,tasarım bienali  aralıka galata özel ilköğretim okulunda
art,brun akustik konserle  aralıkta küçükçiftlik parkta sınırlı sayıdaki ön satış biletleri bugün gün
art,sanatçının  albümü adresinden bugünden dinlenebilir
art,brun  aralıkta küçükçiftlik parkta istanbullu seyircileriyle buluşuyor
art,hediyeler sürprizler devam brun organizasyonuyla  aralıkta istanbulda yarışm
art,müzikseverlerin aklını başından almak  aralıkta biletler iksvde
art,norveçli müzisyen brun akustik konserle  aralıkta
art,iksv kalkınma ajansının desteğiyle yenilikçilik merkezi kuruyor ayrıntılı bilgi
art,tasarım bienali  aralıka galata özel ilköğretim okulunda
art,norveçli müzisyen  akustik konserle  aralıkta
art,müzikseverlerin aklını başından almak  aralıkta biletler iksvde
art,norveçli müzisyen  akustik konserle  aralıkta
art,müzikseverlerin aklını başından almak  aralıkta biletler iksvde
art,moderatör deniz  tasarım bienali direktörü konuşmacılar cenk dereli  yüksek mimar yelta köm  mimar
art,tasarım bienali kapsamında yarının tasarım mimarisi paneli yarın
art,bugün yarın standa uğrayıp iletişim bilgilerini bizlerle paylaşan onuncu ziyaretçimiz anahtarlık kazanıyor
art,daki standımızda gelecek artık eskisi anahtarlığı üretmek bekliyor
art,kasımda yararına destek toplama barış müzik koşusu düzenleniyor
art,fuarda bugün standı ziyaret iletişim bilgilerini görevlilerle paylaşan onuncu kişi rehberli kazanıyor
art,güncel sanat fuarı başladı iksv fuarda alıyor
art,brun müzikseverlerin aklını başından almak  aralıkta parktabiletler iksvde
art,tasarım bienalinde rehberli kazanıyor
art,fuarda bugün yarın iksv standını ziyaret iletişim bilgilerini görevlileriyle paylaşan onuncu kişi
art,güncel sanat fuarı bugün önizlemeyle başlıyor iksv fuarda alıyor
art,norveçli müzisyen brun akustik konserle  aralıkta
art,kısmı videoda gerisi sokaklarda
art,festivaline başvurular başladı ayrıntılı bilgi
art,etkinlik ısıtmalı konser çadırında oturma düzeniyle gerçekleştirilecektir
art,norveçli müzisyen  akustik konserle  aralıkta biletler iksvde
art,aralık cuma akşamı küçükçiftlik sahnesinde
art,iksvye dokunun sanata kolayca ulaşın iksv uygulamasıyla etkinlikler elinizin altında
art,müzikseverlerin aklını başından almak  aralıkta biletler iksvde
art,norveçli müzisyen akustik konserle  aralıkta küçükçiftlik parkta
art,brun hayat dolu akustik sinematik şarkılarını norveçten istanbula taşıyor
art,brun hayat dolu akustik sinematik şarkılarını norveçten istanbula taşıyor
art,brun müzikseverlerin aklını başından almak  aralıkta biletler iksvde
art,tasarım bienali  kasım   aralık tarihleri arasında galata özel ilköğretim
art,zoe ryan
art,zoe ryan
art,monditalia
art,björk şarkılarının akustik coverlarıyla  aralıkta
art,ücretsiz izlenebilecek bienal sergisinde rehberli turlar düzenlenecek bilgi htt
art,tasarım bienali gelecek artık eskisi başlığı altında  kasım   aralık  tarihlerinde
art,önceki konserlerinde tıklım tıklım dolduran brun  aralıkta
art,brun hayatın anlamı hayatınızda şeyin yolunda düşündüğünüz saniyelerde gizli
art,müzikseverlerin aklını başından almak  aralıkta biletler iksvde
art,önceki konserlerinde tıklım tıklım dolduran   aralıkta
art,düzenlediği brun konser biletleri bugün satışa çıktı konserde görüşmek
art,brun  aralık cuma gecesi biletler bugünden iksvde
art,aralıkta küçükçiftlik parkta biletler  ekimden
art,bienal sergisini rehberli turla izleyin
art,föyünüzü kasım ayı boyunca etiketiyle instagramda paylaşın beğenilen  kişiden
art,bienalin föyü gömlek ev uçağa dönüştürebileceğiniz şekilde origamik tasarlandı
art,tasarım bienali  kasım   aralık arasında gerçekleştiriliyor
art,müzikseverlerin aklını başından almak  aralıkta biletler  ekimden iksvde
art,likeı  kişiden olun  tasarım bienali rehberli turunu kazanın
art,simitçide büfede kasapta manavda karşılaştığınız ürünleri kasım ayı boyunca hashtagi instag
art,bienalin hazırlıkları galata özel ilköğretim okulunda devam ederken ürünleri sokaklara yayıldı
art,tasarım bienali  kasım   aralık arasında gerçekleştiriliyor
art,iksvye dokunun sanata kolayca ulaşın iksv uygulamasıyla etkinlikler elinizin altında
art,likeı  kişiden olun  tasarım bienali rehberli turunu kazanın
art,simitçide büfede kasapta manavda karşılaştığınız ürünleri kasım ayı boyunca hashtagi instag
art,bienalin hazırlıkları galata özel ilköğretim okulunda devam ederken ürünleri sokaklara yayıldı
art,tasarım bienali  kasım   aralık arasında gerçekleştiriliyor
art,tasarım bienali yaklaşıyor
art,akşamki filmekimi  partisine hazır
art,tasarım bienali kapsamında düzenlenen tasarım rotaları başlıyor
art,tasarım bienali etkinlikleriyle şehrin köşesine yayılıyor
art,kasım   aralık  tarihleri arasında gerçekleştirilecek  tasarım bienali yaklaşıyor
art,yarın düzenlenecek filmekimi  sinefillere muhabbet müzik dans sürprizler vaat http
art,filmekimi göz alıcı filmleriyle eğlenceli partisiyle devam
art,cité türkiye atölyesi ocakmart dönemi başvuruları kabul edilmeye başladı
art,tasarım bienali  kasım aralık  tarihleri arasında galata özel ilköğretim okulunda
art,insan kaynakları uzmanı aranıyor başvuru
art,insan kaynakları uzmanı aranıyor başvuru
art,sahiplerini bekliyor
art,filmekimi gösterimleri biletler bugün satışta çizelge adresinde
art,merhaba işlem bedeli iadeleri gerçekleştirilmiştir isim bilginizi infoorg iletebilirseniz kontrol etmek isteriz
art,iksvye dokunun sanata kolayca ulaşın iksv uygulamasıyla etkinlikler elinizin altında
art,destek vermek amacıyla akşam sahnesinde teşekkür ederiz
art,bugün bekliyoruz yararına konserimizde yepyeni parçalar sürprizle
art,bedeli alınmıştır yaşanan aksaklıktan ötürü üyelerimizden özür diler alınan fazla işlem bedelinin gün içinde iade edileceğini hatırlatırız
art,bedeli alınmıştıryaşanan aksaklıktan ötürü üyelerimizden özür diler alınan fazla işlem bedelinin gün içinde iade edileceğini hatırlatırız
art,yaşanan teknik aksaklık filmekimi ön satışlarında üyelerimizden fazla işlem
art,bedeli alınmıştıryaşanan aksaklıktan ötürü üyelerimizden özür diler alınan fazla işlem bedelinin gün içinde iade edileceğini hatırlatırız
art,yaşanan teknik aksaklık filmekimi ön satışlarında üyelerimizden fazla işlem
art,pazarlama departmanında görev alacak kurumsal satış sorumlusu aranıyor başvuru
art,sezonda gözler kulaklar salonda biletler iksvde
art,cité artsın ekimaralık dönemindeki konuğu iz öztat ayrıntılı bilgi
art,filmekimi broşürlerini sinemalarından edinebilir iksv kitaplık uygulamasından tabletinize indirebilirs
art,filmekimi gösterimleri biletler  eylülden rexx gişelerinde
art,kültür sanat vakfını instagramdan takip edin
art,biletler biletix iksvde satışta sezonda salonda
art,yararına  eylülde sahnesindeyiz biletler gişe biletixde
art,merhaba iletişim bilgilerinizi infoorg adresine yollayabilirseniz konuyla sizinle iletişime geçmek isteriz
art,pazarlama departmanında görev alacak gişe görevlisi aranıyor başvuru
art,pazarlama departmanında görev alacak kurumsal satış sorumlusu aranıyor başvuru
art,kişilik sistema europetan barışa şarkı
art,sistema orkestrası dün akşamki unutulmaz konserlerinin ardından boğazın keyfini çıkarıyor
art,kültür sanat vakfının instagram hesabını takip musunuz
art,orkestrası  ülkeden toplam  çocuk akşam ücretsiz konser veriyor
art,sistema gençlik orkestrasıbu akşam bakırköy belediyesi leyla gencer sanat merkezinde
art,merhaba iletişim bilgilerinizi infoorg adresine iletebilirseniz konuyla iletişime geçmek isteriz
art,merhaba iletişim bilgilerinizi infoorg adresine iletebilirseniz konuyla iletişime geçmek isteriz
art,merhaba iletişim bilgilerinizi infoorg adresine iletebilirseniz konuyla iletişime geçmek isteriz
art,sistema gençlik orkestrası  ağustosta bakırköy belediyesi leyla gencer sanat merkezinde
art,sistema orkestra kampından ergün çolakoğlunun objektifinden fotoğraflar
art,sergi görevlisi başvuruları başvuru tarihi  eylül
art,nde görev alacak sergi rehberleri sergi kurum gönüllüleri başvuru süresi  eylül  sona eriyor
art,iksvye dokunun sanata kolayca ulaşın iksv uygulamasıyla etkinlikler elinizin altında
art,barış müzik instagram hesabını takip musunuz
art,ekibi kampın açılışını
art,ülkeden ün üzerinde çocuk eğitmen sistema orkestra kampı istanbulda
art,desteğiyle  ülkeden  genç yeteneği konser istanbulda buluşturuyor http
art,sistema gençlik orkestrası konseri  ağustosta bakırköy belediyesi leyla gencer kültür merkezindeht
art,istanbulda barış müzik günleri başlıyor aracılığıyla
art,ülkeden ün üzerinde çocuk eğitmen sistema orkestra kampı istanbulda http
art,ülkeden ün üzerinde çocuk eğitmen sistema orkestra kampı istanbulda
art,kültür sanat vakfının instagram hesabını takip musunuz
art,venedik bienali türkiye pavyonunda sergilenen projesinin kitabı yayınlandı
art,sarkis
art,zoe ryan
art,adaylara geç eylül ayında geri dönüş yapılacaktır ilginize teşekkür ederiz
art,dijital medya sorumlusu pozisyonu sürecimiz devam etmektedir
art,adaylara geç ağustos ayının sonuna geri dönüş yapmayı planlamaktayız
art,merhaba ilginize teşekkür ederiz görsel iletişim sorumlusu pozisyonu sürecimiz devam etmektedir
art,medya ilişkileri departmanında görev alacak görsel içerik sorumlusu aranıyor başvuru
art,venedik sanat bienali türkiye pavyonunda sarkisin eseri alacak
art,cité başvurusu uzatıldı ayrıntılı bilgi
art,iksvye dokunun sanata kolayca ulaşın iksv uygulamasıyla etkinlikler elinizin altında
art,iksvye ayda  izleyici
art,iksv kitaplık uygulamasıyla bienal yayınları tabletinizde
art,iksv kitaplık uygulamasıyla bienal yayınları tabletinizde
art,rakamlarla iksv
art,demiş sanatı takip etmek zor iksv uygulamasıyla etkinlikler elinizin altında
art,temmuzdaki konserinden  nden barış akpolatla konuştu
art,kurum kimliği yayınlar departmanında görev alacak grafiker aranıyor başvuru
art,iksv kitaplık uygulamasıyla bienal yayınları artık tabletinizde
art,dün gece sahnede kuliste neil
art,pazarlama departmanı bünyesinde görev alacak bilet satış sorumlusu aranıyor başvuru
art,merhaba akşam adresinden bilet satın alabilirsiniz
art,neil konserinden emre mollaoğlu mahmut ceylanın objektifinden fotoğraflar
art,midlake konserinden emre mollaoğlu mahmut ceylanın objektifinden fotoğraflar
art,büyük ev ablukada konserinden emre mollaoğlu mahmut ceylanın objektifinden fotoğraflar
art,teksaslı topluluk midlake neil youngdan sahnede
art,bilet satışı yapılmaktadır
art,akşam büyük ev ablukada küçükçiftlik parkta başladı
art,istanbulda soruları yanıtladı ses kalitesi lerden kötü
art,küçükçiftlik ı ağırlamaya hazır kapılarımız müzikseverler açıldı
art,öğrenci bileti satın alacak izleyicilerimizin yanlarında öğrenci kimliklerini bulundurmaları zorunludur
art,neil konseri kapıda sınırlı sayıda öğrenci bileti satışı yapılacaktır
art,akşam gerçekleştirilecek neil konseri bilet satışı satış kanallarında devam
art,neil konserinde bilet kategorilerine alanlara yönlendirilecekler
art,sahne önünden izleyebilecek şanslı müzikseverler saat özel sahne önü bilekliklerini alabilecekler
art,akşam gelen  kişi bilet kategorilerine bakılmaksızın konserlerini
art,geceyi unutamayacak
art,akşam teki neil konserine saatler kaldı
art,vuslat geldi çattı
art,beklenen gün geldi neil akşam
art,tmrw
art,yarınki büyük buluşmayı sabırsızlıkla bekleyenler anlatıyor http
art,merve hanım merhaba medyaorg adresi iletişime geçebilirsiniz
art,neil konserinde bilet kategorilerine alanlara yönlendirilecekler
art,sahne önünden izleyebilecek şanslı müzikseverler saat özel sahne önü bilekliklerini alabilecekler
art,yarın gelen  kişi bilet kategorilerine bakılmaksızın konserlerini
art,akşama hazır mısınız yarın akşam
art,yagmursuz konseri keyfi neil sahnede haftaya istanbulda
art,neil youngdan şarkı
art,neil  temmuz salı günü
art,neil konserine sayılı günler kaldı
art,yarın yayınlanacak köşe bucak programında tolga akyıldızla ı konuşuyor
art,bienal yayınları tabletinizde iksv kitaplık uygulamasını indirebilirsiniz
art,neil konseri desteğiyle satışa açılan  tllik öğrenci biletleri tükenmiştir ilginize teşekkür ederiz
art,gönüllerin yanık sesli fatihi neil istanbula geliyor
art,neil konserinde neler bekliyor http
art,neil konserine  hafta kaldı yahu yılların özlemi bitiyor vuslat hasıl acayip
art,neil konserine sayılı günler kaldı  temmuz gecesi neil
art,kültür sanat vakfının instagram hesabını takip musunuz
art,ece hanım merhaba adresinden programına ulaşabilirsiniz
art,neil konserine gitmeden bilmemiz gerekenler
art,ismail iletişim bilgilerinizi infoorg adresine gönderebilirseniz konuyla sizinle iletişime geçelim
art,neil konseri  ın hazırladığı posterleri gördünüz
art,mert merhaba öğrenci biletleri üyelerine öğrencilere açıktır
art,merhaba bilet satışı satış kanallarından iksv gişesinden yapılabilir
art,öğrenci bileti almış izleyiciler bilet değişimi ücret farkını almak biletlerini aldıkları gişeye başvurabilirler
art,tllik genel biletlerinden  kaldı almak acele edin
art,desteğiyle öğrenciler sınırlı sayıda  tllik biletler  temmuz cuma günü saat satışa çıkıyor
art,efsanesi ın grubu horsela istanbulda vereceği konser sınırlı sayıda öğrenci bileti
art,türkiye  ermenistan programı başlıyor
art,temmuz gecesi
art,temmuz gecesi
art,yıldır düzenlenen festivallerin destekçisiyizbu coşkuya katılmak
art,kurum kimliği yayınlar departmanında görev alacak grafiker aranıyor başvuru
art,temmuz gecesi
art,ekranlarında hafta sonu caz zamanı hafta sonu
art,medya ilişkileri departmanında görev alacak görsel içerik sorumlusu aranıyor başvuru
art,yarın burgazadada ertesi gün dünya prömiyeri yapılacak sait faikin provasından htt
art,temmuz gecesi neil
art,cité artsın temmuzeylül dönemindeki konuğu merve şendil ayrıntılı bilgi
art,müzik festivalinin şiparişi fazıl eseri sait faik hazırlıklar sürüyor
art,biletinizi aldınız rockn rollun efsane müzisyeni  temmuzda
art,temmuzda neil youngdan midlake büyük ev ablukada dinleyeceğiz festivale dönüşen konser kaçmaz
art,temmuz gecesi
art,merhabakonser programda belirtildiği şekilde gerçekleştirilecektir bilet bilgisine adresinden ulaşılabilir
art,barış müzik yarın ekşifest sahnesinde süprizleriyle
art,demiş sanatı takip etmek zor iksv uygulamasıyla etkinlikler elinizin altında
art,temmuzda sahnede olacak istanbullu hayranlarına mesajı
art,geçtiğimiz yıllarda konuk   temmuzda sahnede olacak
art,iksv kitaplık uygulamasıyla bienal yayınları artık tabletinizde
art,temmuzda gerçekleşecek konseri kaçmaz diyor
art,nde görev alacak sergi görevlisi sergi rehberi sergi kurulum gönüllüsü aranıyor başvuru
art,temmuz konserinden sahnede olacak
art,bugün yayınlanacak aktüelitede venedik bienali  uluslararası mimarlık sergisindeki türkiye pavyonu konuşulacak
art,temmuz gecesi
art,temmuz gecesi
art,iksv tasarım mağazasında görev alacak mağaza sorumlusu aranıyor başvuru
art,temmuzdaki konserine müzikseverleri hazırlayacak
art,pazarlama departmanında görev alacak pazarlama sorumlusu dijital medya sorumlusu aranıyor başvuru
art,günlük vaat gecenin biletleri iksvde
art,büyük ev ablukadanın ardından arda kapalıgişe konser gerçekleştiren teksaslı grup midlake sahnede olacak
art,temmuz salı akşamı canlı performanslarıyla ses getiren büyük ev ablukada izleyicileri karşılayacak
art,efsanevi müzisyeni neil youngın istanbulda vereceği konserin ön grupları midlake büyük ev ablukada olacak
art,temmuz gecesi  büyük ev ablukada
art,neil youngın albümü dalında adayı albümü pillden aynı adlı şarkıyı dinlediniz
art,iksv kitaplık uygulamasıyla bienal yayınları artık tabletinizde
art,müzik festivali devam müzik festivalini instagramdan takip edebilirsiniz
art,müzik efsanesi  grubuyla  temmuzda istanbula geliyor
art,architettura    tramite
art,neil hafta sonu coşkusuyla başladı
art,hafta sonunun haftaki konuğu albümü
art,ataturk
art,neil konserine sayılı günler kaldı şarkınız
art,demiş sanatı takip etmek zor iksv uygulamasıyla etkinlikler elinizin altında
art,venedik bienali  uluslararası mimarlık sergisindeki türkiye pavyonu açıldı
art,türkiye pavyonu venedik mimarlık bienalinde görülmesi gereken  sergiden
art,konserine sayılı günler kaldı
art,müzik efsanesi  grubuyla  temmuzda istanbulda
art,curated murat tabanlıoğlu http
art,biletlerini alanlar biletixe iksvden alanlar iksvye başvurabilirler
art,biletlerini iade etmek isteyen izleyicilerimiz biletlerini aldıkları gişeye başvurabilirler
art,akşam  tiyatro festivali kapsamında sahneleneceği duyurulan oyunlar planlandığı gerçekleştirilecektir
art,serkan merhaba iletişim bilgilerinizi infoorg adresine iletebilirseniz konuyla iletişime geçmek isteriz
