society,kızılayfest gönüllülerimizin eğitimi başladı yusuf adıgüzel hocamız gönüllülüğe ilişkin bilgilendirme http
society,eğitimin  kısmına başladık özden karakaya türk kızılayının faaliyetlerini çalışma yöntemlerini anlatıyor
society,navisalvia kabaağaçı anma toplantısı metamorphosesbaşkalaşımlar başlığıyla  çarşamba günü gerçekleş
society,kaçırdık üzülmeyin başvuru perşembe  eğitim cuma günü başvuru
society,bağışı yapılır kimler yapabilir acil durumda müdahale edilir özden karakaya anlatıyor
society,üniversitesi yayınevi kuruluyor
society,bugün kızılay hayat kurtar kampanyasında görev alacak gönüllülerimize seminerimiz olacak kayıtla
society,göksel gürselle uygulamalı şekilde empati haritası tuvali yapıyoruz projenin tasarımı yapılır
society,ajandalara düşelim
society,mekan sosyolojisi dersini arkadaşları özellikle bekliyoruz
society,sosyoloji ekoloji mekan tüketim planlama anahtar kelimeyi bünyesinde barındıran etkinlik
society,nisanda buluşmaya dersiniz
society,mekan sosyolojisini almayanlar kaçırmasa
society,doç bekir gür bugün iü edebiyat fakültesinde edebiyat fakültesi konferanslarında idi dolu dolu konuşma idi tebrik tşk
society,kütüphane nedir kütüphane meselesi memleket meselesi girizgah
society,tanpınar arşivi dijitalleştirildi bilgi belge yönetimi bölümünden tûba karatepe anlatıyor
society,türkiyede üniversite sistemi merkezi merkezi kütüphane kurma noktasında yeterli destek sağlanmasında eksi
society,türkiyede üniversite sistemi merkezi merkezi kütüphane kurma noktasında yeterli destek sağlanmasında
society,sorucevap kısmıyla devam
society,efkon katılımcıların soru katkılarıyla devam
society,amerikan yükseköğretiminde üniversiteler itici güç rekabettir
society,amerikan yükseköğretiminde üniversiteler itici güç rekabettir
society,göksel gürsel sosyal girişimciliksosyal işletmeler sosyal girişimci girişimci arasındaki farklardan bahsediyor
society,amerikan modeline mercek bakış
society,bizde tübitak nsf frontieri almıştır
society,efkon doç bekir gür konuşuyor
society,fotoğraf belleği üzerinden kentleşme kentlileşme sempozyumu  nisanda gerçekleşiyor
society,türkiyede üniversite alman modelinden ilham aldığı ünvanları kullanmayı sürdürmekle beraber  sonrası
society,edebiyat fakültesi konferanslarının beşincisi başladı doç bekir gür ü dinliyoruz
society,durmak akademide bugün göksel gürselle sosyal girişimciliki konuşuyoruz
society,tarımsal üretimimiz ülke nüfusunu beslemede yeterlidir
society,gönüllü bekliyor haydi cemil birsel
society,seda topgülün çalışma yaşamında yaşlı ayrımcılığı yaş ayrımcılığı başlıklı metni
society,edebiyat fakültesi konferanslarında doç bekir gür üniversite modeli üzerine konuşuyor
society,gönül  ekibi kızılayfestte bizlere destek verecek eğitimden başvurular
society,ev sahibi ekonometri kulübü stantta bırakmıyor haydi gönüllü olun
society,programda yerimizi alalım
society,sosyoloji türkiyede uygulamaları yüksek lisans dersimize hafta yeryüzü doktorları genel müdürü ali
society,teşekkürler  sağolun
society,sayılı günler kaldı heyecanla
society,programa saatler kaldı tekrar hatırlatıyoruz bugün
society,gözden kaçmasın  bugün amfide
society,fakültemiz heyecanla beklemekte
society,sahaflar çarşısı
society,öğrenci kongresi programı
society,bugün edebiyat fakültesi konferansları doç bekir gür hocayı dinliyoruz saat  amfi
society,temsilciliğimizin gururu değerli projemiz  nisanda fakülte sinema toplum kongresinde
society,fakültede yarın
society,trab geri kabul anlaşması sonrası yunanistandan mülteci geçişleri azaldı    ek
society,yılından gelenlerin suriyeli oran  idi ülkeler  afganistan  nijer
society,mülteci avrupaya gitti yıl  nisana sayı  yaklaştı ölenlerin sayısı  http
society,bekir gür yarın edebiyat fakültesinde olacak saat amfi akademide amerikan modeli üzerine konu
society,akademide tahakküm kaynağı amerikan modeli
society,edebiyat fakültesi öğrencileri güzel işler yapıyorlar gurur duyuyoruz alkışlıyoruz
society,yarın cemil birsel konferans salonunda kariyer günlerinde stantta olacağız bizimle tanışmak isteyenleri bekleriz http
society,üniversitemde üniversitenin geleceği üzerine güzel toplantılar düzenleniyor vakti kaçırmasın umarım konuşmal
society,üniversitesi kızılay işbirliğiyle düzenlenecek kızılay hazırlıkları sürüyor bugün gönüllü dav
society,koşun koşun gelin
society,sırf güzelim programlar istanbulda yaşamak isterdim kalabalığına koşturmacasına
society,yarın saat üniversitesi edebiyat fakültesinde amerikan yükseköğretim sistemini konuşacağız arkadaşl
society,kitapsız göndermeyiz
society,gelin çay kahve kitap atölye
society,hakikatten kalkıp abdye geldik bekleriz yarın efkonda
society,gidebilen sevabına notlar alsa
society,olacağız
society,kitabımı aldım çayı başka içerim artık
society,salı geliyoruzzzz kaçıran üzülecektir arkadaşlar kendinizi üzmeyin
society,konferans kaçmaz
society,dışındaki türklere desteği
society,işgücü istatistikleri ocak  işsizlik oranı  seviyesinde gerçekleşti
society,seragazı emisyon istatistikleri  toplam seragazı emisyonu  yılında  eşdeğeri
society,yarın efkon günü saat ü dinliyoruz
society,kulüp yanayız
society,yarın edebiyat fakültesi konferansları günü akademi üzerine konuşmaların bekir gür amerikan üniversite
society,odalarda ışıksızım
society,okumalarıde emin balcı moderatörlüğünde filmini yorumluyoruz  günü sizleri bek
society,ortaöğretimde okullar kapalı bekliyoruz
society,yarın pazartesi ertesi gün salı edebiyat fakültesi konferansları günü
society,milyonu aşkın çocuktan sinin devlet okullarında okuyabildiği türkiyenin suriyeli çocukları
society,gönüllü güzel vesile
society,annesi babası hayatta sınıf öğrencileri sınavımız  mayısta başvuru
society,gelin kızılayfestde hayatlarn kurtulmasına aracı olalmtüm bilgilerinizi doldurduğunuzdn emin olun http
society,suriyenin vatansız bebekleri türkiyede vatansız nitelenen   suriyeli bebek doğdu
society,üniversitesi gönüllüleri sahaya iniyor hedef  ünite bağışı    kişiye
society,gelin köprü olalım canların kurtarılmasına kanların toplanmasına stanttasahada vesile olalm http
society,gönüllü üniversitesi gözden kaçmasın uzantımız
society,selçuk sosyoloji söyleşilerinde kurtuluş kayalı edebiyat sosyoloji metinlerinde türkiye fotoğrafı üzerine konuşa
society,kesinlikle akıllı
society,selçuk sosyoloji söyleşilerinde kurtuluş kayalı konuşacak edebiyat sosyoloj metinlerinde türkiye fotoğ
society,ayki toplantısında doç bekir gürü dinliyoruz egemen üniversite  yüzyılda akademide modeli
society,ingilterenin şehirlerinde antidepresan kullanıldığını gösteren haritaya yoksul bölgeler önde
society,büyüyenay güzel işlere imza atıyor siyasetname dizisi başlıbaşına büyük teşebbüs
society,navisalvia  konu başkalaşımlar  çarşamba  iü edebiyat fakültesi dili edebiyatı htt
society,gönüllü akademisi alıcısı arasında kanal isteyenleri kızılayfest projesine davet
society,egemen üniversite kitabının yazarı  nisanda konferansları kapsamında abddeki üniversite modelini
society,gramer deyip geçmeyin kitap
society,üniversitesi öğrencilerini kızılay festivali organizasyonunda gönüllü olmaya çağırıyoruz
society,bekliyoruz
society,sefer birleştik sürdürülebilir kenti konuşacağız
society,kitap okumak uzun süre kütüphane hizmeti
society,hocam gelmeden izlesek ça
society,sosyoloji ekoloji şehiri birleştirelim deyince ortaya mamül çıktı taze çıktı temiz çıktı ü tadından
society,arkadaşlar işler çıkarıyor takipeden paylaşan omuz veren kazanır seviyoruz
society,arkadaşlar hareketlikten atlamayalım haftaya salı edebiyat fakültesi konferansları günü
society,nisanı kaçırmayın
society,taktik yumruk tak tak tak harika değiller
society,güzel etkinlikte gönüllü lazım portala üye stantsaha http
society,güzel etkinliğe gönüllü desteği gönüllü akademisinden haydi gönüllü http
society,gönüllü kaldı haydi gönüllü olalım adım adım kızılayfest
society,sinema toplum kongresi öncesi ön görüşme toplantısı yapıyoruz
society,aydır kullanmadığım interneti kapatmaya çalışıyorum ellerinden gelen çirkefliği yaptılar kullanmayın sakın superonline
society,üniversitesi seraskeriye kapısı
society,beyazıt devlet kütüphanemiz  nisandan  hizmet verecek
society,bugünün mahsulleri umutlu çalışmaya devam
society,seferinde kendine okuyorum
society,sosyolojide bugün ünvanını mehmet ali akyurtu gönülden tebrik ediyorum hayırlı
society,eğlencesi kahkahasi etkinlik yaptık gelmeyenler üzülsün
society,mutlu binark doç günseli bayraktutan hoca medya araştırmaları atölyesi teşekkürler
society,bugün yaptığımız atölyeden keyifli etkinlikten kalanlar güzelliklere
society,oryantalizm çalışırken aklıma haramiler geliyor asmak kesmek kelle uçurmak hırsızlıktan altın vurmak
society,tebrik ediyoruz
society,mehmet emin balcı bugün  ilişkisel sosyal bilimler kongresinde teleterapi iletişim çağında sağlık
society,mehmet ali akyurt bugün alman sosyolojisinde yöntem tartışmaları  başlıklı tezini savunarak unvan
society,bugünkü ziyaretimiz çoçuk eğitim vakfına açev meltem cantürk bizlere vakfın çalışmalarını anlatıyor
society,avrupada biyoloji ırkın geri dönüşü
society,uğur tanyelinin yıkarak yapmakanarşist mimarlık kuramı altlık kitabı yayınlandı htt
society,bugünki etkinliğimize herkesi bekliyoruz görüşmek
society,yarıyılı vize mazeret sınav programı açıklanmıştır
society,hollanda istatistik merkez bürosu hollandalıların yüzde göçmen kökenliler hollandalılar arasında gerginliklerin
society,üniversitesi  yılının ayında basında haberi üniversiteler arasında sırada
society,hepimiz sosyoloji mezunuyuz diyorsa kurtuluş hoca hepimiz ordan hocam
society,çay kahve içmeye gelen mezunlarımıza ahval şeraitte diş kiramız vardır bekliyoruz
society,araştırma paylaşım odaklı güzel gün hocalarımıza teşekkür ederiz
society,iüef konferanslarının beşincisi yaklaşıyor haftaya salı saat  yüzyılda akademide modelini konuşaca
society,şimdi gönüllü olma vakti
society,konuşmacımız olağanüstü idiler güçlü besleyici tşk ediyoruz ortak çalışmalarda
society,araştırma deneyimleri dinleyicilerin soru katkılarıyla devam
society,araştırma deneyimleri dinleyicilerin soru katkılarıyla devam
society,gönüllü ekibi gönüllülük ekibi sıkı çalışma takımı işe omuz
society,mutlu binark hocamızdan tübitak sobag araştırma projesinin hikayesini dinliyoruz
society,mezun gitmek bölüme uğrayın çay kahve kitabı takdim edelim
society,kitapsız okumadan çalışmadan
society,bizde kitapsız
society,araştırma deneyimlerinde doç günseli bayraktutan hocamızı dinliyoruz
society,araştırma deneyimleri yrddoçdr murat şentürkün açış konuşmasıyla başladı
society,sosyoloji araştırma merkezi konuşmalarında bugün mutlu binark günseli bayraktutanı dinliyoruz murat şen
society,mahmut özer hoca yazmış
society,yıl bugün şair gazeteci araştırmacı muallim naci  yaşında hayatını kaybetti yazar başına mecmuai mualli
society,freudun arkeoloji ilgisi hastalarını kütüphane antika müzesi karışımı odalarda tedavi bilgisi
society,güzel gün
society,trollukten gocmenler nefret soylemine medya cesitli konularda sorular sormak elde etmek gercekten
society,gönüllüysen şimdi zamanı
society,türkiyede uygulamaları yüksek lisans dersimize hafta tüsiad genel sekreter yardımcısı nurşen numanoğlu konuk
society,doktora tezi planının taslağını sunan malgorzata türkiye polonya birleşik krallığı karşılaştırmalı
society,malgorzata rabenda dermanın sunumu medya ortamında göçmenlere karşı nefret korku söylemi başlığını taşı
society,kadın bloggerlar araştırma tasarımı üzerine tartışma devam
society,çay kahve ikram mühimi kitap
society,tırmada önemli etkinliği gerçekleştiriyor yüksek sıkı ekip üretken
society,cidden harika proje aradığınız güzellik ayağınıza gelmiş güzel olmuş
society,iletişimde gülümsemenin önemi etkili iletişim yöntemleri nelerdir yusuf adıgüzelle konuşuyoruz
society,gerçekten derdin varsa bizdensin
society,resmî yazı olmadan sizinle telde görüşemem diyenden resmi yazıya bilimsel çalışmanıza yardıma hazırız diyen gerç
society,vitruvius kitabı üzerine kısa inceleme
society,ilişkisel sosyal bilimler kongresi   yeditepe üniversitesi linki
society,bülent ecevit üniversitesi teoman duralı fahri doktora takdim töreni
society,arkadaşlar hareketlikten atlamayalım haftaya salı edebiyat fakültesi konferansları günü
society,emek proje yaratıcılığını koymuş süper
society,yarın önemli etkinliğe ev sahipliği bekliyoruz
society,yrddoçdrmurat şentürkün metropol hayatında yaşlılık başlıklı röportajı yayınlandı
society,akademide bugün seminer günü yusuf adıgüzel etkili iletişim insan ilişkilerini konuşuyoruz
society,kızılay gönüllüleri çağırıyor kar bağışı kampanyasında gönüllü olun bağışçı olun hesabını
society,kaynakların tüketimi olumsuz sonuçları atölyesine herkesi bekliyoruz
society,kızılay iü öğrencilerinden gönüllü desteği bekliyor haydi katılın
society,hafta cengiz bektaşın mimari yaşama kültürü dersinde süleymaniye nuruosmaniye camii kapalıçarşı mısır çarş
society,antik roma mimarisinin ilkelerini ortaya vitruvius aynı zamanda vinciye
society,kitap latince aslından çeviren mimarlarmimarlık talebeleri sanat
society,cbektaş osmanlı mimarisinde ağaçtan kuş sesinden ödün verilmezdi
society,eyüp çoraklı çıkan kitabı historia antikçağda araştırma fikrinin doğuşu konuğumuz
society,barok roma etkisindeki nuruosmaniye camii kütüphanesi
society,cengiz hoca tasarımında yapı yapının görüş açısını engellememeli süleymaniye medresesi
society,kızılayfest başlıyor  nisanda yardımcı misiniz başvuru
society,arşivlerinde ibrahim yasa kültür dünyamızdan kişilerin tanıtıldığı programın konusu sosyolog ibrahim yasa
society,eğitimöğretim yılı dönemi mazeret sınavları   tarihleri arasında yapılacaktır
society,sonuçları ciddiye alıp almayacağımızı çalışmanın bilimsel yöntem belirlerkaçırmayalım
society,gerçek dert araştırma önemlidir yola koyulmak
society,sosyoloji sosyal sorumluluk yönetimi yüksek lisans programı resmi hesabı stklar hakkında
society,hocanın önsözünden küçük kısım  çarşamba saat hocayı dinlemeye bekliyoruz
society,yöntemsiz  çarşamba
society,merhaba geçen yılki akademik gelişim eğitimleri olacak
society,mezopotamyadan anadoluya anadolunun yazılı belgelerinde ticaretin izleri  nisanda gtgt
society,annenizin türkçesini kullanıyorsunuz etkinliği düzenlendi
society,merkez kampüste
society,konservatuvarımız  yaşında
society,bugü
society,merh
society,sosyolojiye yakışan programı videoya çekip sitesinde yayımlamak uzaktakilere izleme fırsatı
society,yöntemsiz  çarşamba
society,kulüpler toplaşın murat hoca  çarşamba kitap dağıtacak
society,keyifli etkinlik geliyor ekoloji kulübü iftiharla sunar
society,güzel haber
society,hocam sısyolojiye gelin bölümdeyiz
society,şaban teoman duralı hocamız üniversitemizi anlatıyor
society,kreuzbergin ünlü türk çetesi  boysun alman üyesiydi şimdilerde michelin yıldızlı aşçı raue zor isiml
society,sürprizli etkinlik
society,avrupa mülteci krizini anlamak güzel kaçıyorlar avrupa kapılarını açmıyor
society,araştırma üniversitesi ülke dışından öğrenci hoca çekebilmenin başta gelen şartlarından sağlam  kütüphan
society,nisanda hocalarla birlikteyiz bekleriz
society,teori pratikle birleştirilmişse fevkalade başarılı buluyorum emeği geçenlere teşekkürler
society,kulüpler toplaşın murat hoca  çarşamba kitap dağıtacak
society,lisansüstü araştırmacılar medya konusunda çalışan arkadaşlarımız atölyeyi unutmasınlar başvurular devam ediy
society,şahane şahane kesinlikle şahane
society,durumda tırmadan sözü aldık
society,teşvik bence kaçırmayın
society,yapalım katılımcı arkadaşlara hocanın kitabını takdim edelim
society,üniversitesitrt birliğiyle uluslararası geçmişten geleceğe medya sempozyumu gerçekleştirilecektir
society,çarşamba
society,sosyoloji yapınca harika tecrübe edemeyenler üzülsün güz dönemini beklesinler
society,üniversitesi göç araştırma merkezi işbirliği düzenlenen göç akademisini başarıyla tamamlayan arkadaşlarımı
society,derste eğlendiğimi hatırlamıyorum
society,cumartesi sabahı konferans salonunu dolduran sakarya üniversitesi felsefe topluluğu öğrencilerini arkadaşlar
society,oyunlar oynamaya devam ediyoruz
society,sosyal psikolojik bağlamda küresel mültecilik meselesi adlı konferanstaydık
society,gönüllü akademisinde bugün harika atölyeydi
society,portala üye gönüllü
society,eğlendik
society,güzel oyunlarımızın sonuna geldik bitmesine üzüldük dilara köktürk erden hocamıza teşekkür ediyoruz
society,baltalimanı tesisleri boğaz baharda güzel boğazın enerjisi yansımış keyifli
society,gönüllü akademisinde bugün baltalimanı sosyal tesislerinde yaratıcı atölyesi
society,dilara köktürk hocamızla yaratıcı atölyesine başladık
society,güne kahvaltı başladık yaratıcı atölyesinde oynayacağımız oyunlardan enerji toplayalım
society,hikayesini dinleyeceğimiz araştırmanın raporunu görmek linke tıklamanız yeterli
society,fakültemizde güzel işler olacak işler güzel olacak
society,tubitak araştırma alanları ilgiler sorun alanları  bilim insanı araştırmanın içinden saha deney
society,zamanların nefisli haberi mümkün pazartesi sabahı fatmagül hocanın dersine giderdim
society,fakültede pencereme konan kuşu saha çalışmamıza yönlendirdiğim doğrudur
society,üniversitesi öğrencisiysen gönüllüyüm diyorsan etkinlik haydi
society,gönüllü kızılay işbirliğiyle kızılayfest projesi karşınızda detaylı bilgi başvuru
society,şaban teoman duralıya fahri doktora payesi  zonguldak haberleri
society,sevindik
society,zonguldak bülent ecevit üniversitesi kütüphanesi kantini  saat açık kıskanılası
society,arkadaşlar hesabını takip muyuz
society,afganistanlı avukatın türkiyede hayata tutunması
society,gönüllü akademisinde bugün hilâl çakmak moderatörlüğünde extintcion filmini değerlendirmeye başladık
society,vizeler sonrası toplantımızı yaptık keyifli etkinliklere hazır olun
society,egitimde modelini konuşuyoruz
society,lübnan nüfusuna fazla mülteci barındıran ülke  kişiye düşen mülteci sayısı lübnan  ürdün  türkiye
society,kesinlikle çalışmak kurtarır yorulduk malayani işlerden
society,kitabevi hasnun galipten taşındığından bence yerini dolduran eski kitap sevenler listesine baktınız
society,tutunamayanların ingilizceye çevrilmesini garipseyenler olmuş oğuz atay romanda kelimey
society,sevin seydi tutunamayanları yazılır yazılmaz çevirir günlerde oğuz atayla birlikteler konuy
society,güzel haber
society,çarşamba
society,nin düzenlediği çarşamba toplantılarının  konuğu fatmagül berktay türkiyede siyasal
society,türkiyede doğurganlık oranının  belirlendi
society,arşivinden ziya gökalp
society,suriye savaşı öncesinde yy ikinci yarısında dünyada meydana gelen mülteci krizlerinin kronolojisi
society,yılda dünyadaki mülteci sayısı  arttı  yılında fazla afganistanlı mülteci varken suriyelil
society,şubat türkiye geri kabul anlaşması sonrası türkiyeden yunanistana mülteci geçişleri geçen yıla
society,arşivlerini dijital ortama taşıdı iz bırakanlar programının  bölümünde ziya gökalp konu edilmektedir
society,tübitak  projesi kapsamında üniversitesi liderliğinde üniversiteler arası işbirliği
society,gidip mutlu hoca günseli hocadan öğrensem tübitak projesi hazırlamayı etkinliğinde öğrenmiştim
society,nin ayı etkinlikleri
society,doç yusuf adıgüzel gerçek hayata konuştu bilen suriyeli doktoru inşaatçı yaptık sayımızda
society,günümüze mimarlık konularında yayınlanan programlarından kısmını derledik
society,proje yazımında nelere dikkat edilmeli ömer özdinçle interaktif şekilde proje yazımını öğreniyoruz
society,hocadan güzel konferans istanbulda yaşayanlar kaçırmasın
society,çarşamba koyu siyah harflerle kaydediyoruz atölye araştırma tasarımı araştırma deneyimi lisans lisan
society,iü sosyoloji müthiş
society,ömer özdinç akademi öğrencilerinin projelerine fikirlerini yöntemine değerlendiriyor
society,proje yönetiminde yönetimi gerçekleştirilmeli olasılık  etki önlemler
society,televizyon izleme rekoru kırdık
society,odtü sosyoloj bölümü düzenlenen  nalbantoğlu sempozyumu  odtü kkmde
society,akademide bugün ömer özdinç fikrini geliştir hayata geçir başlıklı dersimizi işliyoruz
society,fikir proje haline gelir proje döngüsü gerçekleşir ömer özdinç anlatıyor
society,ömer özdinç bizlere proje yazımına ilişkin kavramları kullanılacak araçları anlatıyor yol haritasını çiziyor
society,bekliyoruz
society,izlemek isterim
society,odak yazar söyleşilerinin konuğu ayfer tunç
society,atölyede deneyimli araştırmacı bizlerle olacak hocalara şimdiden teşekkürler
society,sıkı çalışıyor
society,medya konusunda atölye çalışması ilgilisine
society,güzel
society,nisanda çarşamba toplantılarında iüsbfden fatmagül berktay hocayı dinliyoruz
society,nisanda edebiyat fakültesi konferanslarındayız
society,nisanda tırmada araştırma deneyimlerindeyiz
society,nisanda hızlı akar tarihleri ıskalamayalım
society,hocamızı dinlemedim büyük fırsatı kaçırmak istemiyorum
society,ülkemizde geçici koruma kapsamında bulunan suriyelilerin illere dağılımı
society,çarşamba toplantılarında  nisanda profdrfatmagül berktay türkiyede siyasal düşünce tarihçiliği üzerine konuşa
society,dergisinin çağrısı duyurusu
society,dünyada insan ticareti kölelik hakkında şaşırtıcı gerçekler
society,sosyoloji bilgilerinin geçerliliğini saptamak yol gerçek üzerine sağlayacağı etkinliktir
society,insan ticareti kölelik cirosu    milyonu amerika kıtasında  zorla çalıştırılıyor
society,türk sinemasının taşları sayfamızda genişletilmiş yayında
society,atinada aktivizm aktivizm ekonomik siyasal mülteciler dayanışma girişimi
society,dikkat çekici tablo harveyin radikal coğrafya üzerine tartışmaları mekân
society,fatmagül berktay  nisanda sosyolojide çarşamba toplantılarında türkiyede siyasal düşünce tarihçiliği ke
society,medya çalışan arkadaşlar bugün haber bekleyin
society,edebiyat fakültesi ayı konferansı
society,dolu dolu atölye geliyor
society,mahmut özer hocadan önemli değerlendirme dünya üniversite sıralamaları ülke gerçekleri
society,tardeın icat taklit kuramı etnografyanın yayılma kuramından farklı değildir
society,yılı beyazıt sahaflar çarşısı artamonoff dumbarton
society,batıda gerçek felsefe yokluğuyla orta çağda roma imparatorluğu döneminde karşılaşmaktayız
society,batı üniversiteler araştırma enstitülerinin uygulama merkezleri gibidir öncelik araştırmadadır tedriste bizde
society,merakla bekliyoruz
society,akademinin aklını ayyuka çıkaralım
society,antoine ignacio kalfa çizilen galatadan manzarası büyük olasılık galata mevlevi
society,tanzimat döneminde mekanında devletin erki temsili
society,toplumlaşma bireylerin çıkarlarını karşılayan birimler halinde birarada geliştikleri formdur
society,batı deneyiminde diyelim
society,insanlar entellektüeldir insanların toplum içinde entellektüellerin işlevini görmez
society,toplumsal fenomeni açıklamak üreten asıl getirdiği işlev ayrı ayrı incelenmelidir
society,yana ideolojik olanı ayrımlayıp eleştirebilmemizi mümkün kılan sosyal bilimin gelişmesidir
society,toplumumuzun sorunlarının sağlıklı biçimde ele alınabilmesi tarihimizin değerlendirilmesi gerektiğine
society,bağlı çıkar grubuna sosyoloji içinde burjuva küçük burjuva devrimci sosyoloji ayrılmakt
society,sosyoloji aynı konu aldığı toplumlar tarih içinde oluşmuş bilgi sistemidir
society,edebiyat fakültesi konferansları
society,bugün feyhaman duranın tutkusu gül irepoğlunun anlatımıyla tekrar canlanacak
society,yıl kapı yıkılıp bugünkü giriş inşa edilecekbabı ali babı seraskeri girişi aynı
society,üniversitenin bugünkü giriş kapısı yapılmamışresimde yapıldığı dönemdeki halini görüyoruzgülhanedeki
society,akşam ilginç resim paylaşmak istiyorum mahmutun cuma selamlığı beyazıt camiiressam
society,sosyoloji
society,nüfusu trnin  katı abdde nüfusu  milyonu aşan sayısı trdekinin yarısı trde kentleşme süreci batıd
society,kırsalda merkeze uzak yerlerdeki yaşlıların durumu politika notu bizde nedir
