society,gönüllü akademisinin dolu dolu geçen yılını izlemeye davetliyiz
society,milli eğitim bakanlığı ansiklopedisi cilt  maddesi  yazan ömer lütfi  sayfa
society,ilcesi kaymakamlığı nüfus vatandaşlık işleri dairesi atatürk dogru soylemis
society,sınav okuyucusu arıyoruz tarih uygunsanız soyad bölüm telefon numarası biodaki
society,turuncu saçlı çılgın kızı tanıyorum bölümünü seviyor
society,teşekkür ediyoruz güzel yorumlarınız güzellerinde görüşmek
society,kulüp bölümde anlamlı koca boşluğu dolduruyor güzel dolduruyor kaliteli dolduruyor teşekkür ediyoruz efen
society,gönüllü akademisi mezunlarını haftaya çarsamba kapanış programı akademinin öğrencilere neler kattığını
society,bugün  mayıs  kırım sürgününün  yıldönümü
society,kapanış kapanış  mayıs saat
society,beklenen gün geldi akademi mezunlarını veriyor herkesi bekleriz  gelin dönem neler yaptığımızı görün http
society,kulübü yıl güzel etkinlikler gerçekleştirdi başkan gülfize yrdcsı feyzayı yknu tebri
society,duraklarımızdan birinde palastayız ilginç hikayesini dinliyoruz
society,bahri oralın öncülüğünde edilip ayağa kaldırılmış halini gezmekteyiz
society,samatya kapı ağası mimar sinana yaptırılmış ağa hamamındayız
society,sezon finali hayran bırakır sorunun cevabı şehir toplum kulübünde
society,istanbuldaki aya nikolas kiliselerinden birindeyiz hocamız kiliselere özgü motifleri anlatıyor
society,samatya gezimiz keyifle devam
society,genç karl karl  türkçe altyazılı fragman aracılığıyla
society,sosyolog isteyen liseli gençleri  temmuzda yaz okuluna bekliyoruz
society,aidiyet önemli arkadaşlar bölüme sahip çıkalım
society,gönüllü akademisi bgn huzurevinde yaşlılarımızın yanındaydıinanılmaz keyifli muhabbet beraber kendilerinden tecr
society,beklenen gün geliyor yarın şehir toplum kulübü samatyayı geziyoruz
society,türkiyede gençlerin olma hali raporu
society,mayıs adile kasrı huzurevine davetlisiniz öğrencimiz yaşlılar gençler arasında deneyim köprüsü ku
society,mayıs vezneciler çıkışında buluşuyoruz hepinizi bekleriz
society,gönüllü akademisi kattı videosunu çektik detaylar  mayıs mezuniyet töreninde bekleriz  http
society,insanın sokakla bağı koparılmak isteniyorsa bağları oluşturulmalı güçlendirilmeli
society,istatistiklerle gençlik  türkiye nüfusunun ünü genç nüfus oluşturdu
society,yeşilaydan doktora yüksek lisans öğrencilerine fırsatı detaylı bilgi
society,şehir toplum günü dönem kapanışını güzel etkinlikle gelmeyen
society,gönüllü fakültede güzel
society,üniversiteye geldiğim günden öğrenciye ağabeylik mehmet emin hocamı tebrik ediyorum
society,tebrikler
society,ın türkiyede vatandaşlık kitabı
society,yurda koydukları sigara otomatını bahri kullanmayı biliyordu saygı duyuyorduk adın
society,konuşma kalacak hocanın cümlesini paylaşacağım dedi büyük zenginliğimiz öğrencil
society,yarin saat sokaktaki hayatı bileninden dinliyoruz  nolu dersliğe bekliyoruz
society,mültecilerin eğitime katılımı piyasası duygusal entegrasyonu sağlıyor  röportajı
society,üniversitesi iktisat fakültesinin desteği yürüttüğü projeden ilgin sonuçlar izlemeye değer
society,inanılmaz değişimdönüşüm geçiriyor maalesef dinamikleriyle suç ilişkisini inceleyemiyoruz
society,bugün göç sosyolojisi dersinde yusuf adıgüzel hocamızla kumkapıda sahadaydıkgöçün çeşitliliğini yerinde gördük htt
society,tebrikler mehmet emin hocam
society,tebrikler
society,selçuk sosyoloji söyleşilerinde beylü dikeçligil konuşuyor sosyoloji hayatın bilgisidir
society,selçuk sosyoloji söyleşilerinde beylü dikeçligil konuşuyor sosyoloji insana ontolojiyi hatırlatan bilimdir
society,gönüllü akademisi öğrencileri bitirme projesini gerçekleştirdi teşekkürler arkadaşlar  sağlikli yaşa
society,arkeoloji ekoloji panelimiz başladı
society,mehmet emin balcı çağdaş sosyolojinin neoklasik kökleri parsonsschutz tartışması başlıklı tezini savunarak dok
society,mehmet emin balcı çağdaş sosyolojinin neoklasik kökenleri  schutz tartışması başlıklı tezini savunarak
society,programımız bugün harun küçük osmanlı modernleşmesinin öncü ismi ibrahim müteferrika üzerine olacak
society,akşam harun küçük osmanlı modernleşmesinin öncü ismi ibrahim müteferrika üzerine konuşacağız
society,işgücü istatistikleri şubat  işsizlik oranı  seviyesinde gerçekleşti
society,herkesler kaydını
society,uluslararası kongresi  mayıs
society,tanpınarın  şehri pariste yazar üzerine doktora yapmakta öğrencim habil sağlam hazırlad
society,tanpınarın parisi
society,geçici koruma altındaki suriyelilerin illere dağılımı nüfusa oranları istanbulda yarım milyona yaklaşıyor
society,mayıs sayımızın orta sayfa konuğu osmanlı bürokrasisi biyografi yazıcılığıyla önemli çalışmalar yapan abdulham
society,üçü
society,tübitak bireysel genç girişimciler programı çağrısı
society,ulkeleri miktar gocmen olmasina onay veriyor pozitif bakani
society,sarayın perspektif görünüşü şuydu  işgalinden terkedildi saray blahernai ayvansa
society,bizans büyük sarayının yerleşim şemasıyaklaşık  futbol sahası büyüklüğünde söylenir
society,özetle dükkanı şimdilik kapatıyoruz kendinize bakınız fikriniz talebiniz eleştiriniz varsa atınızcağnım dük
society,bizimle mehmet emin balcıya facebooktan gidiyorum işaretleyip gelmeyenlere sevgiler saygılar
society,vermekten vazgeçmeyenlere afiş açana makerda kesene katı herşeyi pompokoyla okuta
society,pompoko yılın kapanışını yaptık derin zihni süreçlere gark yeşil şallı arkadaşaneşesinden ödün vermeyen gülf
society,yarın bursada tanpınar zamanı
society,yaşam kalitesinin yüksek şehirler
society,taksimi kurt yapmaz kuzulara şah vicdansız medeniyet vicdansız
society,sosyoloji bölümü  eğitimöğretim yılı yarıyılı sınav programına ulaşmak
society,tübitak bireysel genç girişim programı  yılı  çağrısı açıldı
society,numaralı sınıfta bekliyoruz
society,geometri ortaya çıktı kadastro kaplıyor ölçülemeyen kalmadı yeryüzünde
society,haydi
society,eğitimöğretim yılı yarıyılı programı açıklanmıştır
society,dönemi sınavları programı
society,aklın anatomisi   baskı aklın eleştirisinin teşrihi ş teoman duralı
society,fikri benimseyin akşama gelin fikri benimseyenler tanışalım
society,programımıza başvurular  mayıs haziran arasında olacak şimdiden edelim başvuru koşulları
society,mevlana değişim programı bilgilendirme toplantısı  mayıs salı  arasında iletişim fakültesi konferans salonunda yapılacaktır
society,şerif esendemirin türkiyede yerinde yaşlanma mekân gerontolojisinin temel parametreleri başlıklı makalesi
society,nün sürekli etkinliklerinden okumaları poko dönemi kapatıyor tebrikler sosyoloji
society,bugüne abdde alandan binlerce doktora yüksek lisans tezine ücretsiz ulaşabilirsiniz
society,ezmeyin hocayı atmış
society,universitesinde dersimizi
society,sabancı vakfı üniversitesi sivil toplum kuruluşları sosyal sorumluluk yönetimi yüksek lisans dersine
society,yarınki etkinliğimiz okunacak metne üzerinden ulaşabilirsiniz
society,beyazıt öztürkten yoruldum hayat adlı parçayı dinliyoruz
society,otizmli beyazıt öztürk bugüne sayıda resim sergisi açtı tablolarından birkaçını görme fırsatı bulduk
society,zihinsel engelliler adına beyazıt öztürk zihinsel engelli yakınları adına meryem öztürkü dinledik beyazıt saz
society,üniversite sınavı sonrası görme yetisini kaybeden gülsüme şenocak göremediği günü anlattı
society,bedensel engelliler adına savaş şimşek  yaşında geçirdigi kaza sonucu engelli oluşunu sonrasındaki tecrübeleri
society,işitme engelliler adına ozan türkün konuşmasını işaret dili tercümanı zeynep koloğlu aktardı
society,cemal kafadar canlı yayında
society,yaşarken başlıklı engellilik panelinde engelli olanların günlük hayat tecrübeler
society,gencleri bekliyoruz
society,öğrenci kabul disiplinlerarası çalışmaya dizayn edilmiş göç çalışmaları yüksek lisans programı kontenjan
society,türk dili edebiyatı bölüm seminerlerinin kapanış programı bugün amfi olacaktır konu edebiyat ideoloji
society,sosyal sorumluluk öğrencileri yarın güzel düzenliyor elden ele yayalım katılalım
society,ikinci noktaysa şehirlerin karakteristiğini kaybetmesi küresel izler taşımaya başlaması yapıların
society,mukaddimenin ingilizce tercümesini pdf indirebilirsiniz htt
society,sosyoloji gerçekten güzel işler öğrencilerin ilgisi takdire şayan ismail coşkun hocamızı kutluyorum
society,sabır hazırız idari sürecin tamamlanmasını bekliyoruz
society,birincisi parçalı dünyada yaşıyoruz sözü neslin hesapçı gençlerin işime
society,ayfer tunç konuşmasından dokunan noktaları paylaşmak noktaya değineceğim
society,konuşmasıyla günün kalitesini artıran isim ayfer tunç harika söyleşiydi htt
society,sağolun öğretim üyeleri öğrencilerinin sizlerin desteği tşk
society,yarın hocanın moderatörlüğü güzel duyarlı etkinliği gerç
society,edebiyat sosyoloji düğüm açıcıdır bugün güzel verimli değerlendirmeler kilit açıcı anahtar
society,akademik yılında kriminoloji ceza adaleti tezli yüksek lisans programımız başlıyor iühf
society,iü hukuktan kriminolojiden güzel haber
society,nin ilgisi gösteriyor derridanın dediği edebiyat edebiyat değildir
society,bugün edebiyat sosyoloji kelimeyle güzeldi dolu dolu toplantı idi tekrar tekrar handan
society,gönüllü akademisi öğrencilerinden elif abidinoğlu tarih elif nur aktaşkimya bitirme projelerinin afişlerini asmay
society,sosyoloji göç çalışmaları tezli yüksek lisans programına öğrenci alacak kontenjan  kişi başvurular
society,mümkün muhtemel  ayfer tunç gerçek hayatta görmesem hayal ede
society,handan inci ayfer tunça katılımları doyurucu konuşmaları teşekkür ederiz
society,edebiyatın sosyolojinin imkanları başlıklı sosyoloji günleri programı sorularla devam
society,sosyoloji günlerindeedebiyatın sosyolojinin imkanlarını  ayfer tunç ismail coşkundan
society,edebiyat büyük başlıklı disiplinlerin nüfuz edemediği yerlere temas imkan sunar
society,edebiyat politika sosyoloji farklı kodlara sahiptir asıl farklı kodların karşılaşması şeyle
society,ayfer tunç konuşmasına devam
society,ayfer tunç handan inci üniversitesi sosyoloji bölümündeyiz
society,günümüz romanında doğubatı gerilimi ahmed mithat edib tanpınar kimlik ekseninde işlenmektedir
society,handan inci konuşmasını kantın biçim estetik vurgusu hegelin içerik tarihsellik vurgusunu karşılaştırar
society,sosyoloji günleri edebiyatın sosyolojinin imkanları temalı  bölümü sezon finali ismail coşkun
society,handan inci konuşmasına başladı
society,edebiyatın sosyolojinin imkanları başlıklı sosyoloji günleri programı başlıyor
society,üniversitesi sosyoloji bölümü lisansüstü başvuruları  mayısta başlıyor ayrıntılı bilgi
society,bizde alternatif sosyoloji yl çalışmaları yl göç çalışmaları yl sosyoloji doktora sosyal sorumlulu
society,hisli havada amfi entelektüel haz garantili oradaydım demek geç http
society,kontenjanlarımız sınırlıdır
society,çalışanlar önemli teşekkürler
society,hanehalkindan kisilik hanehalki yasayan   olmali
society,üni sbe lisansüstü başvuruları  mayıs haziran tarihleri arasında yapılacaktır başvuru şartları
society,geçmişten geleceğe medya uluslararası sempozyumu iü doktora salonunda başladı
society,geçmişten geleceğe medya uluslararası sempozyumu iü doktora salonunda başladı
society,şehrin medeniyet göstergesi engellilerinyaşlıların çocukların rahatça seyahat edebilmesiyle ölçülür
society,istatistiklerle  ortalama hanehalkı büyüklüğü
society,kaçırılmasa ismail coşkun hoca
society,kaçırmayın  gidebilenler gitsin
society,nde bugün ayfer tunç handan inci ismail coşkun edebiyatın sosyolojinin imkanlarını konuşacak
society,çevirmenim tahsin yücel yazın alanında önemli metinler çevirmiş ruh rahmet eylesin dedi
society,okumak isteyene belde hoparlöründe belediye ilanı anuuunsu fişteklendi
society,gelicem inşkaçmazz
society,mimar sinan yollarına ilgi duyan inşaat mühendisliği üstüne şartları zorlayıp restorasyon yüksek lisansı yapan
society,kimler geliyor handan hocanın tanpınarlı
society,gün memlekete giden biletleri erteleyip geleceğiz hocam
society,kapı güvenliği uyarılmıştır girişte sorun yaşanmaz sorun yaşandığında güvenlikten sosyo
society,yarın sevgili üniversitemin anılarla dolu amfisindeyiz heyecanım tarifsiz
society,miyazakinin prenses mononoke animesi önden izlenip gidilebilir
society,gelenler gelmeyenleri fotodan fişliyorum
society,aferin gelmişsiniz
society,sefer animelerle geldiiikkk
society,ille edebiyatseverleri edebiyat dostlarını bekliyoruz
society,yarın kıymetli konuklarımız edebiyata sosyolojiye söyleşeceğiz bölümü konu komşuyu üniversi
society,cenazesiyle şeyini memlekete yolladık radyosu kaldı türkiye frekansı bozulmasın duvara sabit
society,yüzyüze geldiğimiz artık kanıksadığımız
society,katılımları emeklerinden ismail coşkuna teşekkür ediyoruz
society,selçuk sosyoloji söyleşilerinde beylü dikeçligil olgular arası ilişkiler anlatır üzerine
society,akademi siyaset konulu profdrismail coşkunun konuşmasıyla başladı
society,coşku başladı
society,efkon kapanış programı dekanımız profdr nin konuşmasıyla başladı
society,amfi inanılmaz kıpırtı heyecan akademi siyaset  beklemedeyiz
society,ayrımcılık kültürel ırkçılık yabancı karşıtlığı düşmanlığı sosyal hastalıklar avrupada yayılıyor
society,selçuk sosyoloji söyleşilerinde beylü dikeçligil konuşacak olgular arası ilişkiler anlatır
society,yürürlüğe giren  sayılı yasanın verdiği özgürlük imkanını üniversite  ihtilaline giden yolda ideolojik müc
society,ismail coşkunun akademi siyaset başlıklı konferansı ilgiyle takip
society,bilim insanı siyasi toplumsal meselelere ilgi hassasiyet geliştirebilirken aktüel politikle arasındaki akademik
society,erol güngör kürsü dokunulmazlığının arkasına geçerek politik konum almazken bilim dili konuşması ciddi
society,ismail coşkunun akademi siyaset başlıklı konuşması sorucevap bölümü sona erdi
society,toplanti akademi siyasetbirdönem akademiyi anlamaya çalıştıkeleştirel düşüncemüdahillikbilim arası ince ç
society,ismail coşkunun akademi siyaset başlıklı konuşması sorucevap bölümü sona erdi
society,sorucevap kısmıyla devam
society,erol güngör kürsü dokunulmazlığının arkasına geçerek politik konum almazken bilim dili konuşması ciddi entelektüeldir
society,bilim insanı siyasi toplumsal meselelere ilgi hassasiyet geliştirebilirken aktüel politikle arasındaki akadem
society,ismail coşkunun akademi siyaset başlıklı konferansı ilgiyle takip
society,yürürlüğe giren  sayılı yasanın verdiği özgürlük imkanını üniversite  ihtilaline giden yolda ideolojik mücadelede kullanmıştır
society,düzenleme üniversiteyi devlet aygıtının doğrusu bürokrasinin uzantısı haline getirmeye yönelik olmuştur
society,darülfünun arasındaki asıl gerilimi darülfünunun ankaraya tepeden bakan psikolojik mesafesinde görmek gerekmektedir
society,sonrası radikal reformlar karşısında tutumu dikkate alınan kurum vardırbunlardan askeriye üniversi
society,yıllarla darülfünundan meşrulaştıran başka ideolojik üretim beklerken istediği
society,ismail coşkun akademi siyaset konusunu anlatıyor
society,yıllarındaki düzenlemelerin ardından  yılı özerkliği sağlayan üniversite yasasına sahip olmuşuzdur
society,edebiyat fakültesi konferanslarının altıncısı dekanımız hayati develinin açılış konuşması başladı
society,ziya gökalpin darülfünun şiiri üniversite siyaset açısından bugün yol gösterici olabilecek metindir
society,ismail coşkun akademi siyaset başlıklı konuşmasına dinleyicilere teşekkür başladı
society,edebiyat fakültesi konferanslarının sı fakülte dekanı hayati develinin açış konuşmasıyla başladı
society,olacağız geliniz
society,efkon hakikatle açtığı yolu siyasetle kapatıyor modernleşme serüveni konuşma dizisi yapmışlar bugün
society,biyografiye öğrencilerin babası kulübün danışmanı ekleyelim bugün buluşalım
society,mayıs  tarihlerinde gerçekleşecek maxqda nitel analizi eğitimimiz başvurular
society,yayını yapsa güzel ömür
society,birinci girişin üstü öğrenci işler biriminin yanı
society,öğrencileri gönüllüleri bekliyoruz
society,senenin kapanış etkinlikleri bugün  yarin
society,politik felsefe toplantısı başladı politikacı dostlar aramızda olsaydı
society,ustam necdet işli hazırladığımız yeniçeriler remizleri mezar taşları ilgililere duyurulur
society,ahmet hamdi tanpınar orhan kemalin istanbulu işleyişleri karşilastiriliyor
society,eyüp çoraklı konuğumuz olacak kitabı konuşacağız
society,ooooooo günün haberi
society,hacettepe üniversitesi nüfus etütleri enstitusunun hune  yılında fotograflari yarışması
society,dusunme tarzimiz yaslanma hızımızla görünüyor bardağın dolu tarafını görenlerin ömrü uzun olabilir
society,mayıs   iükkm politik felsefe günleri
society,perakende satış endeksleri  perakende satış hacmi önceki aya  arttı
society,cuma görüşmek
society,bugün ismail coşkundan akademi siyaseti dinleyeceğiz herkesi saat bekliyoruz
society,tarih bölümünden cemil aydının kitabı hakkında kısa mülakat
society,handan inci orhan kemalin özellikle öyküleri ortaokul öğrencielrine ders kitabı okutulmalıdır
society,iü edebiyat fakültesi kalite çalışmaları akreditasyon sunumuna linkten ulaşabilirsiniz
society,mannın siyaset tarih sosyolojisi klasiğinin cildi elimizde
society,sosyoloji türkiyede uygulamaları yüksek lisans dersimizde bugün sabancı vakfını konuk ettik teşekkü
society,ayakta olma ihtimaline karşı idmanlıyız
society,mayıs çarşamba sosyoloji günleri tutmak erkence gelelim ayakta kalmayalım
society,yarın ismail çoşkun hoca akademi siyaset üzerine konuşacakakademi üzerine güzel konferans serisinin sonuncu
society,davetlisiniz edebiyat fakültesi konferansları dizisinin yılki konferansı yarın gerçekleşecek dışarıdan
society,güzel etkinliği gerçekleştiriyor figen toksü hocanın moderatörlüğünde bekliy
society,tarihçilik uğraşısi
society,akşam mukayeseli perspektiften tarihçilik uğraşısını herodotosu konuşacağızkonuğumuz
society,bekliyoruz
society,armağan borç ekseninde değerin toplumsallığını didiklemek akademik ilgilerim arasında graeberdan
society,dua
society,ali ergur hocayı dinlemeye değer
society,ekip ekip proje proje sağolun arkadaşlar
society,mayıs salı günü yl programımızda devlet toplum ilişkileri dersini veren profdr ismail coşkunun akademi siyaset
society,ayfer tunç handan inci ismail coşkun aynı kürsüde olacaktı çocuklar şendik
society,politik felsefe  mayıs salı
society,karşı muttefiklerinin yaninda aronun hatiralar kitabina onsoz yazan kissinger duruma vurgu yapar
society,aron durkheimin donemlerinde sahitlik ettigi buyuk savasa karsi avrupa degerlerini savunma derdindeydi nazizm
society,sanayi üretim endeksi  sanayi üretimi önceki aya  arttı
society,yıl tema başvurular başladı
society,edebiyat yazmış nahid sırrı dönüp dönüp okunulası yazarlarımızdan
society,beklenen gezi gelmiiişş
society,dönemini  mayısta samatya gezisi kapatıyoruz duyduk duymadık demeyin
society,tanpınara başlamalı
society,maskesi gibidirler zıt görünseler birini anlamı diğerinde tamamlanır
society,müziğin sosyolojisinde kavramlar sınırlar temalı cilt sayı editörümüz ali ergur konuğu
society,ali ergur hoca müzik üzerine konuşuyor salı
society,takibe başlamalıydınız
society,fakültenin karşısında orhan kemal halk kütüphanesinde
society,sakinleri handan hoca yarın orhan kemal üzerine konuşacak kaçırmayalım demiyoruz orda olalım diyoru
society,edebiyat fakültesi konferansları ismail coşkun hocanın  mayıstaki akademi siyaset konuşmasıyla sezon finali yapaca
society,edebiyat sosyoloji kaçırmayın
society,hafta takvimsizim gidemeyeceğim mutlaka gitmeniz gereken söyleşi ayfer tunç handan
society,hatırlatıyoruz salı
society,iü edebiyat fakültesi sosyoloji bölümü
society,edebiyatın sosyolojik imkanlarına güzel vakti kaçırmasın düzenlenmiş
society,hayır sorun bekliyoruz
society,yarın akşam yayındayızeleştirel tarihçilik aynadaki herodotos kitabı üzerine konuşacağız
society,yaslilik cocukluluk kucuk kusaklar arasi ilişkiler yasama bakış üzerine dörtlük yapim
society,dünya düzeninin çöküşü akademikkavramsal tartışmadan ibaret
society,pazartesi yayındayız herodotosu tarihini tarihe bakışını konuşacağız  htt
society,mayısta arkeoloji ekoloji ilişkisini çevresel değişimlerin faktorlerin ilişkiye etkisini konuşuyoruz bekler
society,harika etkinlik
society,geleceğin önemli sorunu uzun yaşamak olacak
society,istanbulda gün  evini taşıyor avrupa yakası  ntv
society,inanılmaz eğlendiiiiiiiiiiiiiik
society,osmanlı medreseleri çerçevesinden bakıldığında batıdaki kavramı anlama gelir  mayıs
society,ufak sezon finali
society,dönemlik okumalarının sonuncusunu mehmet emin balcı hoca moderatörlüğünde pompoko yapıyoruz  mayıs cuma
society,yıl önemli projelere imza attı okumaları işin delisi okumaları kaç
society,sosyoloji türkiyede uygulamaları yüksek lisans dersimize  mayıs pazartesi sabancı vakfını konuk ediy
society,yaşasın okumaları
society,üniversitesi yarışları avcılar kampüsünde başladı
society,üniversitesi yarışları avcılar kampüsünde
society,huzurun istanbulunu uygulanan dijital harita eşliğinde metinler okuyarak gezmek
society,haberler topraktan yeşeriyor japonyanın bitkilere dönüşen gazetesi
society,içim gitti artık
society,enerjiniz başarılar
society,başka vesile bekleyelim çarşamba etkinlikleri  sonrası
society,mayıs  tarihinde uygulanacak ilkbahar dönemi adaylarına hatırlatma
society,uğur tanyelinin yıkarak anarşist mimarlık kuramı altlık adlı kitabı bugün kitapçılarda
society,iü sosyoloji gerçekten kabımıza sığmıyoruz sığamıyoruz arı gibiyiz arıııı
society,bölümümüz türk edebiyatı anabilim dalı arşgörcemile odunkıranın edebiyat ideoloji ilişkilerine konuşacağı
society,kabına sığmıyor yarın küreklere asılıyoruz
society,gönüllü arkadaşlarımıza kızılay teşekkür belgesi katılım sertifikalarını verdik etkinliklere
society,vesileyle takip edin derim
society,iibayezid bayezid vakfiyesinde caminin ayrılmaz sakinleri kuşlar yıl harcanmak  altın yem parası
society,öğrencilerimiz projesi kapsamında bağışı kampanyasına destek veriyorlar
society,iü sosyoloji bölüm başkanımız ismail coşkun açılış konulmasını
society,kızılay avrupa bölge merkezi müdürü ayşe ipek akyol teşekkür konuşmasını
society,gönüllü koordinatörlerimizi temsilen selin dizbay arkadaşımız gönüllülerimize teşekkür
society,proje koordinatörlemizden yusuf adıgüzel hocamız teşekkür konuşmasını
society,kızılayfest sertifika töreni hazırlıklarımızı tamamladık  çıkın çıkın gelin
society,sosyal sorumluluk bilime bekliyoruz
society,afişlerimizi astık pazartesi günü gönüllü
society,yaşlanmanın kentsel alanlar uzerindeki kacinilmaz etkileri duruma karsi geliştirilen politikalar
society,geleceğin önemli sorunu uzun yaşamak olacak
society,ayfer tunç geliyormuş ohayre
society,güzel yaptık  yılda geri dönüşüm projeleri
society,emekli günlerimi tarihedebiyat seminerlerinde geçirmek istiyorum
society,edebiyat sosyoloji temalı dizi konuşmalar söyleşipanel taçlanıyor ayfer tunç handan inci sosyoloji
society,edebiyat olmazsa olmazımız  mayıs çarşamba   bekliyoruz
society,okuyorsan ansızın bilmediğin projede gönüllü bulabilirsin deengellininengelleri
society,cumartesi heybeliye gelen kazanır bekliyoruz
society,rektör rektör kızılay sorumluları gönüllü projesi ekibi yarın kongre merndeyiz
society,yarın saat yapacağımız sertifika törenine gönüllülerimizi gönüllü isteyenleri bekliyoruz
society,nadide tweetlerimizi önümüzdeki haftaya saklıyoruz şimdilik duyurmuş olalım konuşuyormuş ismail coşkun
society,universiteli
society,herşey yaşarken engelli olanlar panelimize metin şentürkü davet edebiliriz  mayıs perşemb
society,akademinin dersinde öğrencilerimizden akın günaydın elif nur aktaştan gitar solosu şarkılara destek
society,sakinlerinin kaçırmaması gereken konuşma notumuzu yerimizi alalım
society,büşra turan moderatörlüğünde akademi öğrencilerimizle ayağım filmini gönüllülük bağlamında tartışıyoruz
society,ilgisiz kalmayalım
society,çayı şekersiz içenleri bekliyoruz taze çay kahve kitap ilaveten muhabbet
