society,çalışmaları yüksek lisans başvuruları devam kitapçık linke tıklayınız
society,sosyoloji tezsiz sosyal sorumluluk yüksek lisans programı başvuruları başladı şartı
society,üniversite öğrenci disiplin yönetmeliği değişti yönetmelikteki değişikler hali
society,tezsiz yl programına başvuru lisans mezunu yeterli şartı aranmıyor başvurular
society,sosyoloji bölümü  eğitimöğretim yılı güz yarıyılı sınav programı açıklanmıştır
society,konut satış istatistikleri kasım  türkiyede  kasım ayında   konut satıldı
society,dönemin dördüncü öğrenci temsilciliği toplantısını felsefe ihtisas kitaplığında gerçekleştirdik
society,edebiyat fakültesi öğrenci temsilciliği çalışıyor sürpriz organizasyonlarla
society,vefatının  yılında mehmet akif ersoy etkinliği gerçekleştirildi
society,çalışmaları yl başvuruları  ocaka devam ayrıntılar
society,ufuk kocabaş disiplinler arası iletişim önemli
society,çalışmaları programı disiplinlerarası örgüyü yansıtacak şekilde dizayn edildi alanda yol gitmek isteyenler öne
society,tezsizmiş konu güzel bence havvişim
society,yenikapıdaki  yıllık ayak izlerini yerinde gördüğümde heyecanlanmıştım müze
society,arkeolojik buluntular müzesi kurulsa
society,önümüzdeki yıl yenikapı batıkları erken dönem yerleşmeleri konusunu konuşacağız bekleriz
society,tezi kalemde işe yaramaz ilan etmek türkiyedeki hastalıklı kalite söyleminin somut örneği
society,ömrüm arkeolojisi  tarihi çalışırdım
society,tüh geç haberim dinlemek isterdim
society,çalışmaları tezli ylamptk tezsiz yl programlarına başvurular  ocaka devam başvurular
society,sivil toplum kuruluşları sosyal sorumluluk yönetimi tezsiz yl programına yarıyılında  öğrenci kabul edilecektir
society,çalışmaları tezli yl programına yarıyılında  öğrenci alınacaktır başvuru ayrıntıları
society,iü sosyoloji bölümüne yanımızda teşekkür ederiz
society,ufuk hoca yenikapı batıklarının hikayesine oluyoruz
society,ufuk kocabaş şehir toplum kulübünün sosyoloji bölümünün misafiri yenikapı batıkları projesini konuşuyoruz
society,ufuk kocabaş arkeolojisi yenikapı batıkları projesi üzerine konuşuyor
society,bilgiyi soruyu sanatı insanı merak etmek bilmiyorum zihin açıcı
society,aydın gülan idarî yargıda istinaf  çağlayan adliyesi konferans salonu
society,edebiyat fakültesi konferanslarının hayati develinin açılış konuşması başladı
society,edebiyat fakültesi konferansları edebiyat fakültesi dekanımız hayati develinin açış konuşmasıyla başladı
society,çiğdem dürüşken özgür sanat başlıklı konuşması bizlerle
society,dürüşkenin doyurucu konuşması dikkatle dinlenmekte
society,çiğdem dürüşken özgür sanat insan üzerine konuşuyor
society,edebiyat fakültesi konferansları sorucevap devam
society,gözlerim neler görüyor
society,fakülte genel kitaplığında üstatlarla beraber mehmet akif ersoyu anlatmaya çalıştık
society,çiğdem dürüşken özgür sanat insan üzerine konuşuyor
society,edebiyat fakültesi konferansları edebiyat fakültesi dekanımız hayati develinin açış konuşmasıyla başla
society,rus tarihinde burslu doktora imkanı
society,ethicayı deliliğe övgüyü ütopyayı orijinal dilinden çevirerek türkçeye kazandıran değerli hocamız bugün
society,hatırlatma edebiyat fakültesi konferanslarının ikincisi bugün çiğdem dürüşken özgür sanat
society,yenikapı batıklarını keşfe çıkacağızsizleri bekliyoruz
society,çıkın çıkın gelin
society,hatirlatma  aralık çarşamba ufuk kocabaş imparatorluğun kayıp limanını konuşacağız yeriüef amfi  saat
society,konferans öncesinde çaykahve  davetlisiniz
society,edebiyat fakültesi konferansları  çiğdem dürüşken  özgür sanat insan yarın saat bekli
society,bilim heyecandır dedirten konular
society,kültür ekonomisi
society,aralıkta amfi ufuk kocabaş imparatorluğun kayıp limanıyenikapı batıkları üzerine konu
society,sınav takvimi açıklanmıştır ayrıntılar
society,türkiyede geçici koruma altındaki suriyeliler göçmenlerin kültürel entegrasyonupdf
society,dinlediğimde tadı damağımda kalmıştı hocanın anlatımının şimdi sunumunu yapcam güzel güzel
society,edebiyat fakültesi konferansları  konuşma çiğdem dürüşken  özgür sanat insan bekliyoruz
society,aralık saat iü edebiyat fakültesi amfi özgür sanat insan bekliyoruz
society,kişi göç yollarında hayatını kaybetti bunlardan akdenizde
society,bini türkiye üzerinden  kişi akdenizden avrupaya geçti geçen yıl sayı
society,bugün dünya göçmenler günü dünyada yerinden edilmiş kişi sayısı  bunlardan  milyondan fazlası suriyeli
society,gerçekleştirilen terör saldırısı sonucu hayatını kaybedenlere rahmet yakınlarına milletimize başsağlığı
society,söylemeden geçemeyeceğim kayahan özgül hoca entelektüel derinliği irfanı istanbulda yaşasaydı
society,ineertis savaş tecrübe etmeyene görünür
society,iü dili edebiyatı anabilim dalı başkanı çiğdem dürüşken edebiyat fakültesi konferanslarında
society,beyaz bekliyoruz
society,sonbahar dönemi ydus  eyds değerlendirme işlemlerine ilişkin kılavuz güncelleme
society,edebiyat fakültesi konferansları aralık salı saat  çiğdem dürüşken hoca bizlerle olacak
society,istanbulun  ilçesi önemli karar
society,yarın saat toplumun vicdanı mıdırı konuşacağız toplaşıp gelin
society,kurtuluş kayalı hoca sosyoloji akademi niyazi berkes üzerine takım mülahazalar
society,yökten doktora yapacaklara aylik  aracılığıyla
society,sosyoloji edebiyatın nesi etkinliği düzenlendi
society,başvurular  aralık  ocak  tarihleri arasında çalışmalarına  yl programına
society,sosyoloji tezli çalışmaları tezsiz sosyal sorumluluk yönetimi yl başvuruları başlıyor
society,yanında dünya sualtı sporları federasyonu cmas bilimsel danışma kurulu üyesidir
society,kocabaş aynı zamanda türkiye milli komisyonu somut kültürel miras ihtisas komitesi başkan
society,üniversitesi adına yenikapı batıkları kazısı konservasyon projesinin başkalığını
society,çalışmaları sualtı arkeolojisi sualtı kültürel mirasının korunması antik gemi yapım teknikleri üz
society,ufuk kocabaş öğrenmek isteyenler buraya toplaşsın
society,ufuk kocabaşın geçmişe açılan kapı yenikapı batıkları kitabına göz atın deriz
society,ufuk kocabaş yenikapı batıklarını konuşacağızkoşun koşun gelin
society,imparatorluğun kayıp limanını ufuk kocabaş konuşmak hepinizi bekliyoruz tarih saat yeriü
society,türk dili edebiyatı bölümü ölümünün  yılında mehmet akifi anıyor
society,sosyal koruma istatistikleri  sosyal korumaya   harcandı
society,işgücü istatistikleri eylül  işsizlik oranı  seviyesinde gerçekleşti
society,kişiden altısı konutta oturuyor
society,akdeniz konferanslarında sosyolojitürkiyede  yılda ortaya çıkan eşitsizlikler nelerdir eşitsizliklerin üstesinde
society,edebiyat fakülteside edebiyat fakültesi konferansları konferans dizisi gençlerle yolculuk
society,sosyal sorumluluk uzmanlık sosyolojinin sosyal sorumluluk yl programına başvurular
society,akademi akademiyi konuşuyor edebiyat fakültesi konferanslarında çiğdem dürüşken hocayı dinleyeceğiz haftaya
society,milli eğitim bakanlığı türkiyenin  ulusal raporunu yayınlamış
society,sosyoloji günlerinde kayahan özgül hocayı dinlemeyi kaçıranlar bugün klasik filojideki edebiyata doğubatı konulu
society,bekleriz
society,aralık
society,bölümden
society,mutlaka videosunu izleyin
society,bende suratlar asık  zannediyordum
society,kaçırmıyoruz şubatta kurtuluş kayalı hoca sısyoloji günlerinde olacak
society,sosyologlar hayli azarlandık bitiminde amfiden sopayla kovalanacağız
society,neyin yerli edebiyat söyler
society,konferanstan sonraki çıkarımyoloji mahallenin yaramaz sokak çocukları
society,edebiyatın sunduklarının sosyolojik değer taşıyıp taşımadığına sosyolog karar verir
society,sosyoloji edebiyatın emicesi
society,sosyoloji günleri sosyoloji edebiyatın nesi konusuyla devam
society,sosyoloji günleri konferansbaşı kayahan hocayı dinliyoruz
society,bugün saat amfie yrd doç kayahan özgülden sosyoloji edebiyatın nesi oluru dinlemeye bekleri
society,okumalarının  oturumunun ayrıntılı bilgisine ulaşmak
society,okumaları  sennetgözün vicdanı metni bağlamında konuşulacak olupokuyup gelmeniz tavsiye edilir
society,cuma  numaralı sınıfta bekliyor olacağızhanekeden beyaz bantbizden sorutoplumun vicdanı mıdı
society,yıl edebiyat fakültesi binası güler
society,osmanlı kültürünü edebiyat tarihini yorumlayamazsınız  ahmet raciden değerli zincir
society,güzel etkinliği heyecanla bekliyoruz
society,birbirinden kıymetli hocaların talebesi olabilmek değerlendirin
society,sosyoloji edebiyatın nesi oluyormuş gelin beraber dinleyelim
society,çalışmaları yarıyılı lisansüstü eğitim kontenjanlarına başvuru tarihleri  aralık  ocak
society,sosyoloji edebiyatın nesi yarın sosyolojide yrd doç kayahan özgül anlatacak öğreneceğiz
society,öğrenci danışmanlığı hakkında önemli duyuru geçmiş dönemlerde ders seçme derse kayıt işlemlerinde öğrenciye
society,aralıkta amfite saat üniversitesinden yrd doç kayahan özgül sosyoloji edebiyatın nes
society,yarın  aralık salı saat  sosyoloji edebiyatın nesi oluru yrddoçdr kayahan özgülden dinliyoruz
society,bazında gayrisafi yurtiçi hasıla  gayrisafi yurtiçi hasıla düzeyinde hesaplandı
society,yıllık gayrisafi yurtiçi hasıla bağımsız yıllık gayrisafi yurtiçi hasıla hesaplandı
society,dönemsel safi yurtiçi hasıla çeyrek temmuz  eylül  gayrisafi yurtiçi hasıla gsyh
society,aralık salı günü sosyoloji edebiyatın nesi oluru yrddoçdr kayahan özgülden dinlemek saat amfi
society,ayrı
society,gerçekleştirilen terör saldırısı sonucu hayatını kaybedenlere rahmetyakınlarına milletimize
society,istanbulda gerçekleşen alçak terör saldırısını şiddetle kınıyor lanetliyoruz
society,fakülteye hareket geldi edebiyat fakültesi konferansları  aralık salı saat  çiğdem dürüşken bizlerl
society,lisrel önemli analiz programlarından enteresan teknik bilhassa sosyal psikoloji çalışanlar mutlaka değe
society,ikisi kayahan hoca sosyolojide klasik filolojide birbirinden önemli
society,yrd doç özgül diyar diyar edebiyatta doğubatı başlıklı konuşmasıyla klasik filoloji seminerl
society,edebiyat fakültesi konferansları halkımıza açık devam bekleriz özgür sanat
society,dün başlayan lisrel eğitimi devam yapısal eşitlik modellemesi konusunda eğitim alıyoruz
society,klasik filoloji seminerleri hız kesmeden devam
society,türkiyenin uluslararası rekabet gücünü artırması doktora kapasitesini artırması lazım yayınlanan rakamlarla
society,selçuk sosyoloji söyleşileri  türkiyenin göç hikâyesi sosyoloji öğrencileri ilgililer davetlidir
society,edebiyat fakültesi konferanslarında üniversite konuşuluyor çiğdem dürüşken hocayı dinliyoruz
society,isveç konuyla ilgilenen herkesi bekliyoruz
society,aralık salı günü sosyoloji edebiyatın nesi oluru yrddoçdr kayahan özgülden dinlemek saat
society,türkiye ulusal hesaplar sisteminde revizyon sna esa uygulanmasına ilişkin duyuru
society,bostan sabahı
society,ceza infaz kurumlarındaki erkek sayısı kadınlardan  fazla
society,sanayi üretim endeksi ekim  mevsim takvim etkisinden arındırılmış sanayi üretimi önceki aya
society,sosyoloji edebiyatın nesi sorunun yanıtını merak ediyorsanız aralıkta mkayahan özgülü dinlemeye
society,lerde beyazıt meydanında tramvaylar
society,nolu derslikte şeylerin hikayesi adlı belgesel gösterimini gerçekleştireceğiz bakış açısı içi
society,duyuru  aralıkta gerçekleştireceğimiz söyleşi katılımcımızın acil toplantısı sebebiyle içerikte değişikliğe gidilm
society,fakültenin esaslı hocalarından çiğdem dürüşkeni dinleme fırsatı gelmeyebilir kaçırmayın
society,septem artes liberales heyecanla beklenen güzel etkinlik çıkarması klasik filolojiden gelmiş
society,aralıkı edin edebiyat sosyolojisi temalı sosyoloji günlerinde yrddoçdr mkayahan özgülü dinleyeceğiz aral
society,edebiyat fakültesi konferansları nda çiğdem dürüşken hoca bizlerle özgür sanat insan
society,sorularına baktınız mıoecdnin tesadüfi yöntemle belirlediği okullarda öğrencilerin soruları okuyup yanıtlama
society,okulun yıl etkinliklerinin güzelliği
society,kemerleri bağlamayın ruhlarımız güzel diyarlara götürülecek
society,edebiyat fakültesi konferansları nda çiğdem dürüşken hoca bizlerle özgür sanat insan
society,bugün cnntürk saat  haber bülteninde türkiyenin  sonuçlarını değerlendireceğiz
society,sosyoloji çalışmaları yüksek lisans programımız hesabı açmış hayırlı
society,kütüphaneden gelsin
society,türkiyede çalışmaları dersi kapsamında ifeada kentsel gözlemevinde incelemelerde bulunuyoruz
society,üniversitesi sosyal bilimler enstitüsü çalışmaları yüksek lisans programı herkese merhaba diyoruz
society,sonuçları gölgesinde timss sonuçları pozitif eğilim içinde medya olumsuz bulguları seviyor maalese
society,aralıkı edin edebiyat sosyolojisi temalı sosyoloji günlerinde yrddoçdr mkayahan özgülü dinleyeceğiz
society,bugünkü  sonuçları göz önünde bulundurularak hocaların hazırladığı öğretmenlik mesleği rapor
society,sabah düşmüştüm pisaya  yaş grubu giriyor öğrencilerin çoğunluğu lise  ortaöğretim politikalarına odaklanmamız
society,timssde yukari dogru ivme varken sonuçlari degil ortaögretime gecisi tabana yayilmis nitelikli egitimi
society,bağımsız dış politika yerli savunma sanayisini geliştirmek isteyen türkiyenin  yaş grubunda dünyayla yarışacak
society,sonuçları açıklandı türkiye matematik okuma puanları düşmüş kötü sonuç derinden düş
society,aralık perşembe  arası bostandayız toprak havalanacak kolun çalışması
society,edebiyat fakültesi üniversiteyi konuşuyor edebiyat fakültesi konferansları  aralık salı saat  söz
society,sevgili bölümümüz öğrencilerini fırsattan mahrum bırakacak tövbeler
society,dönem antikçağda kentler fikirler ders açılsa sevgili  öğrenciler devamı
society,felsefe olmadan konuları ele alırsak üretilecek bilginin yapılacak yorumların eksik olacağını öğretti
society,ders farklı akademik geçmişe sahip öğrencileri derinden etkiledi
society,mekanın siyasallığı metropolden kaçış ütopyalar özgür sanat bunlardan
society,türkiyede çalışmaları göç sosyolojisi neoliberal politikaları uygulamaları mimarlık toplumsal cins
society,kentkentlilikmodernlikmodernleşme kavramları üzerinden sosyolojifelsefe mimarlıkşehir bölge planlama alanlarından
society,haftada türkiye dünyadaki tarihi gündemdeki meseleler üzerine konuşma şansımız
society,bünyesinde  döneminde eğitime başlayan çalışmaları yl programının döneminin bitmes
society,sevgili öğrenciler projede almak  sınıf spss deneyimi öğrenciler arıyorum ilgilenenler gelip
society,başka çalışmamak koşuluyla yüksek lisansdoktora öğrencisi olabilir
society,sosyoloji edebiyat sosyolojiyi konuşuyor üniversitesinden kayahan özgülü dinliyoruz
society,dünyada şehirleşme  yıl öncesinden başlayarak şehirlerin ortaya çıkışı yayılışı
society,gönüllülüğün yaşam biçimi haline gelmesi dileğiyle  aralık dünya gönüllüler günümüz kutlu
society,aralık dünya gönüllüler günü değişimin parçası kutlu
society,sefer klasik filoloji güzellemesi olacak  aralıkta buraya sürü kalpkalpkalp koymak istiyorum
society,dünya sağlık örgütüne dünya genelinde milyardan fazla kişi engelli nüfusun
society,edebiyat fakültesi konferansları felsefe bölümü başladı klasik filoloji devam aralık  salı saat
society,gelişen ülkeler  üniversitesinde trden  isim  koçü  sabanc  bilkent  istanbl  odtü  itü  boğzç
society,konuşmaktan bıkmayacağım konu tanpınar yarın birliktey
society,bireysel eylemlerimizin iklim üzerindeki etkileri hakkında konuşalım aralık  devin bahçeci söyleşi
society,edebiyat fakültesi konferansları yılın konusu büyük harfle üniversite  aralık  salı saat  amfi
society,nüfus yaşlılık konulu medya eğitimi gerçekleştirildi
society,adamda lerde avrupadaki  işçiden birinin göçmen olduğuna atıf yapıyordu şimdi  işletmeci
society,yana sosyoloji kulübünün üyesi büyük mutluluk büyük onur sosyolo
society,sosyoloji günleri edebiyat sosyolojisi temasıyla devam aralıkta saat amfie bekleriz ayrıntılar
society,edebiyat fakültesi konferansları nın ikincisi  aralık  salı saat  amfi  notumuzu alalım önemli
society,ceza infaz kurumu istatistikleri
society,öğretmenlik mesleği mesleğin statüsü raporumuza   ulaşabilirsiniz
society,engellilik araştırmaları kongresi gerçekleştirildi
society,uluslararası sosyoloji derneği yayınlarından kasım sayısı kadın cinayetleri dosya konulu
society,aysanın müteşekkir bilinçli vatandaş kavramı önemli
society,yaşlanmanın sosyolojisi temalı  cilt  sayı yayında eski sayılar yazı çağrıları
society,yaşlılık konusu gündem maddelerimizden olacaktır tuikin  yaşlılık istatistikleri
society,sosyoloji kongresinde gelişmkte kentsl alanlarda kültürel yaşam kentsel aidiyetistanbul beylikdüzü örne
society,wiley yazar seminerleri uluslararası akademik dergilerde yayın adım adım rehber htt
society,istatistik güzellemeler yazmak istiyorum bebeyimsin
society,adana çıkan yangında hayatını kaybeden çocuklarımıza allahtan rahmet ailelerine sabır yaralılara acil ş
society,hallolur gerçekten güzel vaatyalnız erken edip öğrencilikte kalmazsın inşdekan olmad
society,asagidaki tuvaletin yerinden çıkık kapisini taktırabilmek
society,özel hayatındaki başarılarını toplumsal üniye yaşat eliflavobalard
society,arkadaşımız tavrıyla iktidar sahiplerine korku salıyor önümüzdeki seçimlerde tbmmye bağımsız olacak
society,dönem türk felsefe tarihinin önemli ismi kanlı canlı dinleme fırsatı varken kaçırmayın htt
society,tebrik ediyoruz
society,bildiğim kadarıyla etkinlikler herkese açık uzun zamandır beklediğim atılım sürekli dileğiyletakipte kalı
society,akşam nin misafirleri cemal reşit reydeyiz şanslı gün
society,üniversitenin fakültenin mensubuyuz dedik güzel günlerin habercisi konferans
society,üniversitenin amaçlarından dünya sorunlarına çözüm getirmektir neokapitalizme hizmetkarlar yetiştirmek
society,üniversitesinde güzel olacak
society,şehrin adını taşıyan üniversite gecikmiş hedef başlansa kâr
society,edebiyat fakültesi konferansları dekan hayati develinin açılış konuşması başladı
society,edebiyat fakültesi konferanslarının ilki rektörümüz mahmut akın konuşması devam
society,edebiyat fakültesi konferanslarına öğretim üyesi öğrenci katılımı üst düzeyde
society,edebiyat fakültesi konferansları başladı profdrcengiz çakmak günümüz dünyasında hakikat üniversite üzerine
society,iü edebiyat fakültesi konferansları cengiz çakmakın hakikat üniversite  konuşmasıyla başladı
society,edebiyat fakültesi konferanslarının programında cengiz çakmak hakikat üniversite başlıklı konferansına baş
society,cengiz çakmak edebiyat fakültesi konferanslarında günümüz dünyasında hakikatampüniversite üzerine konuşuyor htt
society,cengiz çakmak ilgi dinlenmekte
society,çakmak üniversite dünyayı anlayan taşıyan aynı zamanda mesleklerinde insan yetiştirmeyi amaçlar http
society,cengiz çakmaka doyurucu konferansı teşekkür ediyoruz
society,edebiyat fakültesi konferansları soru cevap devam
society,üniversitesi kütüphane üniversitedir
society,üniversitesi istanbulu kültür şehri gelişmesine yardımcı olacaktır
society,üniversitem hâlâ üniversitedir
society,çakmak üniversite dünyayı anlayan taşıyan aynı zamanda mesleklerinde insan yetiştirmeyi amaçlar
society,cengiz çakmak edebiyat fakültesi konferanslarında günümüz dünyasında hakikatampüniversite üzerine konuşuyor
society,üniversitelerimizin yönetmeliği yayınlandı
society,edebiyat fakültesi konferansları yarın amfi ikram  konferans davetlisiniz
society,hzeynep bilici erasmusun teknik kısmını anlatıyor
society,yurtdışı deneyimlerini aktarıyor
society,özge doruk bizlere viyanada pastaneromada makarnacıpragda tavsiye
society,betül erdoğan polonya deneyimini bizlerle paylaşıyor bavulunuz hafif gidipağır döneceksiniz
society,beyazıt camisi minaresinden maket beyazıt medresesi görüntüsü
society,teoman duralı aristoteles felfesebilim başlıklı konuşmasıyla klasik filoloji seminerlerinin konuğu
society,başlıyor günümüz dünyasında hakikat üniversite yarın
society,iü edebiyat fakültesi dili edebiyatı teoman duralı  ocak
society,edebiyat fakültesinde sonbahar
society,tüsevin türkiyede bireysel bağışçılık hayırseverlik raporu çarkaoğlu aytaç önemli verileri içeriyor
society,fakültede hareketliliktir başladı gidiyor klasik filoloji büyük hocayı ağırlıyor aralık teoman duralıyı
society,varsa vaktinizden varsa hakikatten çalacağızsalı günü üniversite hakikat başlıyorgü
society,aralıkta amfite yrd doç kayahan özgül sosyoloji edebiyatın nesi üzerine konuşacak
society,edebiyat fakültesi konferansları yarın cengiz çakmak başlama vuruşunu
society,ekonomik güven endeksi kasım  ekonomik güven endeksi
society,şehrinde  araştırma üniversitesi şehrin uluslararası öğrencilerden geliri yaklaşık  dolar
society,edebiyat fakültesi konferanslarının ilkinin konuğu cengiz çakmak felsefe bölümü başlıyoruz
society,edebiyat fakültesi konferanslarının ilki salı saat   bekliyoruz
society,sizlere kırmızı halı seremesekte amfinin sırasını ayırırız
society,ekipçe protokoldeyiz öyleyse
society,arkadaş ayırtmış duyduğumuza
society,yarın öğrencinin yurtdışına deneyimlerini konuşacağızbu afişteki arkadaş
society,çantamı alıp gidesim geliyor diyenler gitmenin çeşit yolundan birkaçını dinleyeceğiz
society,sosyoloji günleri ilgi takip köksal alver edebiyat toplumun hafızasının sunulmasıdır
society,edebiyat fakültesi konferansları başlıyor davetlisiniz günümüz dünyasında hakikat üniversi
society,pazar pazartesi edebiyat fakültesi konferansları salı günü bekliyoruz
society,açık ders kapsamında  kasımda iklim değişikliğini profdr levent kurnaz anlatacak kulüp katılım göster
society,başlık başlık
society,doçdrayfer bartu candan doçdrcenk özbay katkısı antropoloji çalışmaları  tasarım
society,edebiyat fakültesi konferansları başlıyor  kasım salı saat
society,küçük orta büyüklükteki girişim istatistikleri
society,sosyoloji günleri edebiyat sosyolojisi temasıyla devam  aralık salı saat amfie bekleriz
society,beyazıt meydanı havuz üniversite
society,bideb programları başvuru tarihleri düzenlendi
society,sanayi işgücü girdi endeksleri çeyrek temmuz  eylül
society,seraskerat kapısı civarı
society,ticaret hizmet endeksleri çeyrek temmuz  eylül
society,beyazıt
society,larda beyazıt seraskerat kapısı
society,beyazıtlar
society,beyazıt camisi minaresinden meydan meşhur havuz
society,darülfünun önünde tören
society,lardan lerin başlarına yıkımlar öncesinde beyazıt meydanı
society,altında sarnıç havuz sarnıç getire şimdi
society,caddesi yapılırken laleli edebiyat fakültesi önü insanlar yollarda
society,ekim  gecesi üniversitesi beyazıt kapısı
society,beyazıt kulesinden manzarai umumiye uzaklarda baruthanenin bacası abdullah biraderler arşivi
society,hacettepe üniversitelerinin düzenlediği engelilik araştırmaları kongresinde engelilerin sorunları tü
society,cuma  vefa bostanında buluşup kompost başlangıç yapacağız elden ele yayalım
society,edebiyat süreçte niyetli başarılıdır
society,mbb şehir politikaları merkezinden  yüksek lisans  doktora tezine destek veriliyor
society,merhum halil sahillioğlu hocamızın eserlerine erişim
society,ekteki özdemir asaf sözü geç dönem örneklerinden
society,sosyoloji günleri sorucevap bölümüyle devam
society,alver sosyoloji edebiyat insana topluma olanları keşfetmeye anlamaya kavramaya yönelik arayıştır
society,başlamış bulunuyoruz
society,erken dönem toplumsal yapı değişmeye önemli kaynaklar edebî metinler sabri ülgener örneğin değe
society,sosyoloji günleri ilgi takip köksal alver edebiyat toplumun hafızasının sunulmasıdır
society,edebiyat sosyolojiye anlatır ı merak ediyorsanız bugün amfie köksal alveri dinlemeye
society,sosyoloji günlerinde köksal alveri  kasım  amfi edebiyat sosyolojisi üzerine dinleyeceğiz htt
society,sosyoloji günlerinin sinde köksal alver edebiyat sosyolojiye anlatır bugün edebiyat
society,söylemlerin çözümlenmesi sürecinde dildeki yapıların ele alınmasına ilişkin örneklerle devam ediyoruz
society,profdrkurtuluş kayalı  türk sinemasından kalkarak coğrafyayı anlamayı denemek
society,konuşmalar dizisinin  etkinliği başladı
