society,hakkında  kitap yayımlanan yazar gerekliydi artık tanpınar araştırmaları merkezi
society,üniversitesindeki arkadaşlara duyurudur
society,bilmiyordum olmasın delidir
society,işinin delisi düşündüğünüz şahısları tavsiye etmek dmye mesaj bırakabilirsiniz
society,etkinliğin ayrıntılı bilgisi adresine muhabbet tanışmak etkinliğe bekleriz
society,işin delisii davetlimiz abdullah harun ilhan çektiği kısa filmler fotoğrafları üzerine
society,nelere dikkat edebiliriz gelin beraber öğrenelim
society,hareketlilikte edebiyat fakültesi konferanslarını atlamıyoruz herzamanki salı saat amfi
society,ygsye ilişkin resmi sitemiz hesabımız dışındaki bilgilere itibar edilmemesi gerekmektedir
society,dijital görülebilen yazmaları bulunduran sitelerin listesi
society,perşembe  ikram  araştırma deneyimlerinde iü sbfden kıymetli hocamızı ayşegül komsuoğlu
society,hilmi ziya ülken bizde edebiyat tarihi düşündürücü olmuştur
society,üniversitesinin büyük kariyer etkinliği geleceğine yön  martta profdrcemil bils
society,ygs adayları dikkat
society,avcılarda yaşlıların mevcut durumu araştırması kapsamında saha araştırma eğitimimiz başladı öğrenci arkadaşlarımızla
society,gerçek öğrenci kulübü olmayı başaran sosyoloji kulübünü tebrik etmek
society,üniversitesi gönüllü akademisi başvuruları dakikalar başvurular saat  sona erecek
society,iü sosyoloji kulübü dizi etkinliğin ilkini gerçekleştiriyor işinin delisi insanlarla gençleri
society,salı edebiyat fakültesi konferansları günü
society,göç akademisi eğitim programına kabul edilen öğrencilerin listesi aşağıdadır
society,hazırlıkları yaptık sizleri bekliyoruz
society,medeniyet araştırmaları merkezi iü dili edebiyatından eyüp çoraklıyı konuk  ctesi  ş
society,bugün mehmet emin balcı hoca sizleri bekliyor olacağız
society,eyüp çoraklı  cumartesi saat  bilim sanat vakfı mamda historia üzerine konuşacak önemli
society,stavros niarchos vakfı geç antik çağ bizans araştırmaları merkezi bizans anıtları fotoğraf arşivimiz açıldı
society,augustinus itiraflar latinceden çev çiğdem dürüşken
society,iüden stratejik ortaklık projesi tablio
society,boyle seylerle gelin sayin sosyoloji fakultenin kutuphanesinin takicisi olalim guclü kutuphaneler lazim htt
society,kararlaştırıldı ilan edildi paylaşııldı
society,hareketlilikte edebiyat fakültesi konferanslarını atlamıyoruz herzamanki salı saat amfi
society,yavuz hoca bence güzellik yapar
society,birbirimizi izlemeyince aynı saatte sosyoloji araştırma merkezinin etkinliği
society,aştık arkadaşlar fakülte edebiyat fakültesi olmaya başladı  martta olacağız
society,ölürse ölür canlar ölesi
society,gönüllü akademisi hakkında detaylı bilgi almak isteyen arkadaşlarımız detaylı kitapçığı linkte bulabilir
society,serkan keskin sarp aydınoğlu haldun taner anma etkinlikleri kapsamında edebiyat fakültesine
society,akademi farklı dinlemeyeceğiz arkadaşlar anlatacağız göreceğiz tasarlayacağız yazacağız hepsinden önemlis
society,sinema toplum söyleşisi yüksel aksu semra güzel korver katılımıyla gerçekleşti
society,yetmez büyük avrupa yakasında şehrin ihtiyacı güçlü kapsamlı işlevsel hizmet veren bilgiye erişimi kolaylaş
society,istilası öncesi şehir
society,yarın saat radyode müjdat gökçe medeniyet coğrafyasında türkiyede göç göçmenlik dünyada mültec
society,gönüllü akademisi başlıyor üniversitesi  sınıf öğrencileri kaçırmasın kontenjan sınırlı başvurular
society,ingilizce pratik günleri kariyer merkezimizde devam ediyoor bekleriz efenim
society,iü gönüllü akademisi dönemi başvuruları başladı başvuru
society,üniversitesinden  yılında stratejik ortaklıklar projesi tablio
society,ticaret üniversitesi sosyoloji kulübü bugün  besim dellaloğlunu ağırlıyor katılım isminizi atmanız
society,baharı şehri feyhaman duran karşılamak
society,hafızamız filmlerden etkilenir söylenenlerle kast edilir intihar fikir konuşmala
society,gönüllü projesine başvurular başladı başvuru yapmadınız
society,davete gitmemek elde
society,çağrı
society,önemli konu besim hoca konuşuyor davete icap etmekte yarar
society,uluslararası mülteci hakları derneği üniversitesi göç araştırmaları merkezi düzenlenen göç akad
society,salı edebiyat fakültesi konferansları günü
society,gönüllük akademisi başlıyor yerimizi alalım
society,gönüllülük akademisi başvuruları başladı
society,nin kapsamlı araştırması sonucunda hazırlanan gönüllülük akademisi gönüllüğü yaygınlaştır
society,gönüllülük projesi evresinde gönüllük akademisi başlıyor
society,gönüllü akademisi başvuruları  cuma devam üniversitesi örgün eğitim   sın
society,iü rektörlukten gelen mesaj guzel yazilmış
society,iü rektörü mahmut dünya kadınlar gününü kutladı
society,kadınlar günü kutlu âdemliğimiz gençlerle yolculuk konferanslar dizisi
society,çalışıyor tohumlar ekildi bostanımız güzel olacak inşallah
society,türkiyenin suriyeli çocuklar eğitim politikası nedir gerçekten bilmeye öğrenmeye ihtiyacımız
society,elinize sağlık gençler
society,okumaları geldi çattı  cuma
society,arkadaşlar unutmuyoruz
society,davet kırılır hiçkoşa koşa geliyoruz
society,toplaşın nün ısrarlı muhteşem teşebbüsünü ziyarete gidiyoruz
society,kesinlikle kaçırılmaması gereken konferansı klasik filoloji ses tarih coğrafya psikoloji felsefe
society,duymadık demeyin
society,yazmaları bulduğuma soru geliyor birçoğunu şurada toplanmış veritabanlarından buluyorum
society,nitel araştırma dediniz kaçmaz kaçmamalı kaçırmayın
society,ziyaret şart
society,ferda keskin foucaultnun soylem anlayisi konusunda konusacakmis  bilgisi dustu
society,arkadaşlar önemli katılmakta omuz vermekte büyük yarar
society,süper tşk
society,bugün bostandayız iü yabancı diller fakültesi yakınındaysanız gelin bizimle bostana katkıda bulunu
society,konuşmayı yeşilay genel başkan yardımcısı yrd doç ibrahim topçu
society,bağımlılığa yönlü bakmak panelimiz başladı panele farklı üniversitelerden yüzlerce arkadaşımız katılıyor
society,hafta canlı yayın konuğum olacaklar değerli katılımlarınızla sizleri bekliyoruz
society,istatistiklerle kadın  türkiye nüfusunun ini kadın nüfus oluşturdu
society,osmanlı müziği ilgilenenler kaçırmasın
society,filmleri samimi
society,vefa bostanımızdan hadi hadi büyüyün artık
society,cuma günü semra güzel korver moderatörlüğünde gerçekleştirdiğimiz keyifli yüksel aksu söyleşimizden kareler
society,izleyebilsek dinleyebilsek
society,icat yapın uzaktakiler nasiplensin
society,akşam konuğumuz shakespearin eserlerinde türk tahayyü
society,cengiz bektaşın mimari yaşama kültürü dersinin haftası sahada öğrencilerin katılımıyla tamamlandı
society,cengiz hoca sosyokültürel yapı yaşama kültürü ilişkisini boğaz yalıları üzerinden anlattı
society,fakülteye hareket geldi psikoloji bölümü sosyal bilimlerde nitel araştırmaları konuşuyor
society,ilgilisine çağrı
society,aklınıza takılan sorular edebiyatogrtemsilciedutr adresine yazabilir başvurunuzu aynı adresten yapab
society,iüef genelindeki öğrencilerin katılımıyla gerçekleşireceğimiz sinema toplum öğrenci kongresine başvuru
society,türyak düzenlenen örnek kıdemli vatandaş kongresi yarışması ayrıntılı bilgi
society,cengiz bektaş hocaya vermek
society,yapılar türkler istanbulu fethedip güvenli haline getirdikten yapıldı
society,çalışmaları öğrencileri bugün cengiz bektaş boğaz yalılarını keşfe çıkıyor
society,humboldt  yüzyılda felsefiedebi kavram ortaya çıkan bildungu  yüzyıl başında eğitim alanına uyarladı
society,bildung  yüzyılda eğitim ülküsü yurttaşlık anlayışıydı
society,mutlaka katılın derim
society,üniversitesi öğretim üyeleri altın madalya ödülüne layık görüldü
society,konferanslarına yetişememek şeydir bilemezsiniz yavaş olun istirha
society,trdeki suriyelilerin  milyonu  yaşındaki çocuklar  yılda trde yerleşik hayata geçmediklerini düşünmek muhal
society,bağımlılığa yönlü bakmak paneli katılım belgeleri hazır  salı günü salı cemil bils
society,yıldan mültecilerin geri dönüşü  seviyesine düşüyor  yakın  yaş suriyeli çocuk hayata türkiyede
society,edebiyat fakültesinde şubat hareketli geçti şubatı aratmayacak canlılıkta
society,akademi akademik pozisyon akademik arastırma eğitim pratikleriamaçları acısindan sorgu
society,universitenin oldugunu dusunmek diziyi verimli buluyorum
society,akademi akademik pozisyonunu güçlü kılmak fazla üzerine düşünmek durumundadır konuşmala
society,fakültemiz dekanlığı düzenlenen gençlerle yolculuk konferanslar dizisinin ikincisi  martta deraylar
society,martı bekliyoruz bildung kişisel kültürel olgunlaşma alman modernleşmesi üniversite hayli zengin konu
society,ilahiyat fakültesi büyük konferans salonunda düzenlenecek seminerimize öğrencilerimiz davetlidir
society,haber haber fenomenoloji literatürü dijital ortamda erişime açılıyor
society,kölnde günüm bahsediyor devlet büyüğü sanıp soruyorum
society,ismi muhtesem yapilan
society,vefa bostanı  zöhre gözükara
society,yıl essende çalıştık adres sormadan yeri bulamıyorduk şehrin altını gördük üstünü görmedik bil
society,eğitim veren almanı beğenmeyip sırtımı döndüm görelim turko dedi yaptım adımı jileti kayna
society,ellerinde mesai çıkışında türkiyeye yollar sabah geri almanyaya taşırlardı çalışın hayatımıza
society,tür etkinlikleri hafta sonları yapsanız bizler mahrum kalmasak
society,fakültemizde önemli etkinlik coğrafya bölümü konferanslar dizisi  konu türkiyede nüfus politikaları
society,sosyoloji araştırma merkezi yakıcı meseleyi ele alacak suriyeli göçmen çocukların eğitimi meselesi bekleriz
society,dünkü harika söyleşimizden öğrenirken güldüğümüz söyleşi güzel çalışmaya devam
society,zehra başkanı dün etkinlikte çaycıydı zehra cağnım ekoloji çay
society,bugün çaycı oldum çaycı olmayı sevdim sosyolog bulup çalışamazsam çayhane açmaya
society,bugün dillendirdik gelecek almazsak kaybederiz
society,alalım yüksel beyi kadroya dilimize katalım
society,liderler zirveside üniversitesinin büyük kariyer etkinliği rotanın kayıtlarını almaya başladık
society,toplumu sinemacı gözünden dinlemenin keyifli halini yaşattı bugünondan duymamız gereken
society,öğrenci temsilciliğinin sosyoloji kulübünün numaralarını bekliyoruz kesinlikle işti arkadaş
society,sinema özellikle dilinde toplumun yalın hali demek dilde hoca bölümüne
society,fotoğrafın hikayesi yazan
society,kaçırdığımıza hayıflandığımız güzel yapmış gençler
society,desteklerini esirgemeyen yanımızda dekanımız  dekan yardımcımız sevtap kadıoğlu ismail
society,keyifli söyleşiyi ettiğimiz ekibine izlemeye gelen herk
society,katılımlarıdan ötürü yabize söyleşi öncesi söyleşi sırasında büyük destek vermiş ço
society,varsa sinemada demişti uluçay sosyolojiyi ekleyelim sinema toplum kongresinin adımı
society,çeviribilim bölümünün çeviri söyleşilerinden haberdar mıyız  salı amfide konu yazın çevirisi çeviri
society,hayati develi öğretmenlerin entelektüel yapısını değerlendiriyor
society,uluslararası mülteci hakları derneğinin üniv göç araştırmaları merkezi ortak düzenlediği göç akademisi
society,çocuklarda
society,edebiyat öğrenci temsilciliğinin düzenlediği sinema toplum söyleşilerindeyiz
society,gecenin hükmü sabaha kadardır
society,fakülteden akşam çıkan mutlu öğrenciyi görmemiştim yüksel aksuya emeği geçen
society,amfi hınca hınç dolmuş üniversitesi öğrenci konseyi sosyoloji kulübü yönetmen yüksel aksuyu gençlerle
society,çocuklarda
society,filmlerimde kötü karakter kullanmak istemem
society,modertörlüğünde sinemada evrensellikyerellik hakkında konuşuyoruz
society,yüksel aksu söyleşisi ilgi takip sinema toplum ilişkisi konuşuluyor
society,söyleşimiz başladı
society,sinema sayesinde aman allahım vaovv diyoruz
society,dün etkinlik afişleriyle dolu duvarları görünce hissettiğim öğrenciyken yoktu
society,edebiyat fakültesine hareket geldi
society,bugün amfi önünde ikramlarımızla sizleri bekliyor olacağız
society,proje ilan ilgilisine
society,öğrenci konseyini sosyoloji kulübünü tebrik etmek gerekiyor sıkı güzel işler
society,kitabımı bağışlamaya hazırım
society,şehir kütüphanesine ihtiyaç artıyor
society,değer sensin projesi saha araştırmacılarını arıyor ayrıntılı bilgi
society,yarın semra güzel korver moderatörlüğünde yüksel aksu sinema toplum konuşuyoruz etkinlik kaçmaz söyle
society,hava güzel bugün ders demiyor söyleşide yerimizi alıyoruz
society,iç içe klüp
society,öne çıkarılan faydalardan selfi terasları yaşamayın selfi çekin deniyor fotoğr
society,edebiyat fakültesi öğrencilerinden güzel işler sosyolojisiz oradayız
society,suriyeli göçmenlerin kalabalık  martta odaklanan araştırmanın deneyimlerini dinle
society,yarın herkesi semra güzel korver moderatörlüğündeki yüksel aksu sinema toplum söyleşisine bekliyoruz katılım dışa
society,gerçek bilim insanıydı hocam nur içinde aracılığıyla
society,programımız dışarıdan katılıma açık girişler edebiyat fakültesi kapısından yapılacaktır  ikram  söyleşi
society,değerli yapımcı yönetmen semra güzel korverin moderatörlüğünde gerçekleştireceğimiz söyleşimiz  saat
society,evlenme boşanma istatistikleri  evlenme boşanmalar önceki yıla azaldı
society,istanbulun ihtiyacı istanbula yakışan güçlü zengin ferahfeza kütüphane istiyoruz
society,üniversitesi sosyoloji bölüm hesaplarının desteği bağımlılığa yönlü bakmak panelinde kayıt sayısı
society,etkinliği yapıyoruz eviniz
society,kulüplerinin kurulma hikayesini anlattığımız röportajımızdan
society,önemli etkinlik notunu aldı cuma ada
society,bölümümüz emekli öğretim üyelerinden nihat keklik vefat etmiştir merhuma allahtan rahmet felsefe camiasına başs
society,girişimcilik
society,üniversite gençliği bağımlılığa yönlü bakmak paneli  salı günü iü profdrcemil bilsel konferans
society,kayıt yenileme işlemleri cuma günü sona erecektirders seçiminizin ardından materyal ücretinizi yatırarak kaydınız
society,etkinlik geldiyaşasın
society,neler öğrenmek konuşmak buzulların ölümü dönemin belgesel etkinliğine yarın başlıyoruz
society,ssm bugün sanatseverler açık girişler ücretsiz
society,martta araştırma deneyimlerida profdr ayşegül komsuoğluampçdr yyeşim özer suriyeli göçmen çocuklar üzeri
society,lisansüstü eğitim öğretim yönetmeliğinde değişiklik yürürlüğe girmiştir yönetmelik
society,araştırma deneyimlerida profdr ayşegül komsuoğluampçdry yeşim özer suriyeli göçmen çocuklar üzerine konuşacakla
society,cengiz çakmak çiğdem dürüşken teoman duralı edebiyat fakültesi konferansları  tansu açık akademiyi konuşmaya
society,edebiyat fakültesi öğrencilerinden güzel işler sosyolojisiz oradayız
society,ulusaşırı göç hareketleri dersimizde kumkapıda sudanlı macit etiyopya cafesindeyiz macitin göç hikayesini
society,seferbaskıhiperlinkten
society,okumalarının  oturumunun etkinlik sayfasına üzerinden ulaşabilir ayrıntılı bilgi alabilirsiniz http
society,spiralimizi yaptık umutla ektiklerimizin büyümesini bekliyoruzdestek herkese teşekkür ederiz
society,dilin dünyasında ötekini filmi üzerinden okumak meraklısına
society,ali ergur ustalık bilgisini pratiğin bilgisi bilgilerin edinilip damıtıldığı
society,hekimlik pilotluk hata yapma maliyetinin yüksek mesleklerdir
society,ali ergur teknoloji karşısında ustalık bilgisinin aldığı halleri tartışmaya teknolojinin mahiyeti meslek algısını tanıml
society,teknoloji insanın varlığını sorgularken simgeselleştirdiği araç görülebilir
society,araştırma deneyimlerinde ali ergur sosyal bilimcilerin sahip gereken özelliklerden bahsediyor
society,sosyolojide dönemsel öne çıkan yöntemlere kuramlara eğilimlere davranmak ciddiyetsizliktir
society,bugün profdr ali ergurun teknoloji karşısında ustalık bilgisinin dönüşümü üzerine araştırma deneyimlerini akta
society,bugün burdayız
society,köklü denen üniversitenin devasa insanı tarihiyle mimarisiyle zenginliğiyle içeriğiyle buyuleyen kütüph
society,iktisat sosyolojisi ilgilenenlere cem özatalayın kaleme aldığı sosyoloji dergisinde yayınlanmış makaleyi tavsiye
society,profdr ali ergurun araştırma deneyimlerini paylaşacağı yarınki etkinliğe bekleriz ayrıntılar
society,ustalık bilgisinin dönüşümü konuşma başka güzel olacak
society,sosyal sorumluluk yl türkiyede uygulamaları dersinde hafta dernekler müdürlüğünden nurettin şahbaz
society,öğrencimiz burcu tümün yerleştirme tasarımcısı ayazma sergisini gezmek  gün
society,kadıköyde güzel kütüphane tarih edebiyat sanat kütüphanesi  ümit oğuz göksel
society,araştırma deneyimlerini dinlemeye devam ediyoruz yarın ali ergur hekimler pilotlar üzerinden ustalık bilgisinin dö
society,rektörlük binası
society,turinge üniversitede gönüllülük projesine desteği teşekkürler önümüzdeki aydan gönüllü akademisi eğiti
society,gönüllü olmanın akademik boyutu üniversitede gönüllü araştırması teşekkürler sosyoloji teşekkürler
society,yollarını arıyoruz umarım yol buluruz
society,sosyolojiden ilgi çekici konferans teknoloji karşısında ustalık bilgisinin dönüşümü hekimler
society,profdr ali ergurun araştırma deneyimlerini paylaşacağı yarınki etkinliğe bekleriz ayrıntılar
society,araştırmacıların zorlandıkları önemli konulardan araştırma tasarımı araştırmacıların deneyimle
society,cilt  sayımızın editörü ali ergur yarın sosyoloji bölümünde konuk olacak
society,şubatta araştırma deneyimlerinde profdr ali ergur teknoloji karşısında ustalık bilgisinin dönüşümü üzerine
society,açık ders seminer dizisi internetten yayınlanmaya başlandı açık ders videoları
society,istanbulda akademiye dostlar  martı edebilirler
society,sosyoloji divanı sosyolojik muhayyile sayısında teoman duralı muhayyile hafıza toplum felsefesi üzerine güzel
society,edebiyat fakültesi konferansları akademiyi konuşmaya devam konu konuk önemli
society,şeyleri üzerinden okumadan sosyoloji yapmanın imkanı
society,arap dünyasındaki üniversitelerin aralarındaki dünya sıralamasındaki yerleri
society,ahmet hamdi tanpınarın hayatını eserlerini hakkında yazılanları arşivini araştırmacılara sunmak amacıyla hazırla
society,türkiyenin ihtiyacı dergi yayında tebrikler yolu açık ömrü uzun
society,yaşlılık çalışmaları dergisi yayın hayatına başladı yazılarınızı göndermek
society,güzel yeşilay kulübü hepinizi bekliyoruz
society,amerikan sosyolojisinin dönemine bakın almanyada üstaddan etkilenmemiş yoktur tamamı simmelin dersini
society,hopkins ülkenin lokomotifi olacak üniversitelerin alman modeline kurulduğunu biliyo
society,etkinlik elden ele yayılsa desteğe ihtiyaç
society,sahaya ilişkin tecrübelerin paylaşılması genç araştırmacılar büyük fırsat kaçırmayın derim
society,teknoloji ustalık bilgisi geliniz
society,iftarlık  sınıf öğrencisi ademin ekseninde türkiye siyasetini toplumsal yapıyı döner dolaşır
society,yüksel aksunun ikinci uzun metrajlı filmi entelköy efeköye karşı
society,yılan hikayesi yapımda yönetmen koltuğuna oturan yüksel aksu  martta iü edebiyat fakülte
society,sinema toplum söyleşilerinde yüksel aksu araya geliyoruz  cuma saat  amfi
society,avcılarda yaşlı hizmetleri yaşlıların mevcut durumu araştırmasında saha uygulamasında görev alacak gönüllü araştırma
society,haftaya cuma     ikram söyleşi oradayız
society,haydi uzat elini
society,sosyoloji araştırmaları merkezi avcılarda yaşlı hizmetleri yaşlıların mevcut durumu araştırması saha araştırmacıla
society,araştırma yöntem kitapları okumak yetmez deneyimler ışığında yürümek gerekir önemli deneyimi
society,saha araştırmacıları arıyoruz ayrıntılı bilgi
society,devri vaktinde
society,şubat salı günü araştırma deneyimlerinin beşincisinde konuk ali ergur
society,konut satış istatistikleri ocak  türkiyede  ocak ayında   konut satıldı
society,bugün anlamlı gündü dersten üniversitesi sosyoloji günlerine
society,rüyâ burcunda yazar ahmet hamdi tanpınar paneli akşam akmde olacak kültürsanat dolu akşam
society,güzel fırsat kaçırmayın
society,yök doktora bursu kapsamında üniversitesinin yök onaylanmış alanlarına başvurular
society,mitolojiden felsefeye ahlaktan siyasete disiplini içeren seminer metinleri antikçağ kültürüyle ilgilenenler içi
society,bostan planlarımızı yaptık etkinliklerimizle bostanı hayata geçirip ektiklerimizin büyüdüğünü görmek sabırs
society,sosyoloji divanı özel sayısosyolojik muhayyile
society,gençlerde tıpmühendislikpsikolojisosyolojisosyal hizmet bağımlılığı farklı yönlerden ele
society,tarihinde gerçekleşecek üniversite gençliği bağımlılık konulu panele davetlisiniz
society,ömer lütfi akad yazmadığı kitapların filmini çekmiştir toplumsal gerçekliği filmlerine başarılı şekilde yansıt
society,lı yıllar kültürel sorunların geriye itildiği ekonomik sorunların ön plana çıktığı yıllardır
society,sosyoloji günlerinde kurtuluş kayalı hocamızı dinliyoruz
society,yakup kadri reşat nuri eserleriyle toplumu anlamaya çalışır cumhuriyetle gelen değişimlere eserlerinde
society,kurtuluş kayalı hoca eski mülkiyeli mülkiyenin sosyoloji ilişkisinden bahsediyor
society,kurtuluş kayalı sosyoloji günlerinde ilgi takip
society,sosyoloji günleri ismail coşkunun açış konuşmasıyla başladı
society,iü sosyoloji edebiyat sosyolojiyi konuşmaya devam yarın saat   amfi
society,araştırma deneyimleri dizimizin sinde ali erguru ağılıyoruz araştırmanın hikâyesini dinlemek isteyenleri
society,yarın sosyoloji günlerinde hoca ağabeyi kurtuluş kayalıyı dinliyor
society,sosyoloji günleri keyifli etkinlik
society,yarın saat seyyid paşa medresesinde öğrenci kulüpleri çalıştayı gerçekleştirilecektir kulüp başkanları
society,beyazıt yerleşkesi
society,ev şehir seminerlerinin şubat ayı konuğu yrd doç murat şentürk dostu konulu sunumunu gerçekleştir
society,yaşlanmanın sosyolojisi temalı sayı cilt sayı  editörümüz murat şentürkün sunuş metni
society,ssm açık girişler ücretsiz
society,feyhaman duranın portre manzara natürmort eserlerini görebilirsiniz
society,yaşam memnuniyeti araştırması  mutlu beyan bireylerin oranı
society,sektörel güven endeksleri şubat  hizmet sektörü güven endeksi
society,yrd doç seda topgülün çalışma yaşamında yaşlı ayrımcılığı yaş ayrımcılığı başlıklı makalesi
society,perşembe dopdolu
society,göç konferansi türkiyede yaşanan göç göçmen konusunun sosyal hukuki boyutu
society,başladığımız boylamsal  araştırma özelliği kazanan antalya yaşlılık araştırmasının sonuçları
society,antikçağ felsefesi
society,şubat perşembe edebiyat fakültesinde sosyoloji kurtuluş kayalı günü fakülteyi sosyoloji kurtuluş kayalı
society,sayının editör editör yardımcısı murat şentürk fatih karakaya tebrik teşekkür
society,yarın saat
society,dünyanın güzel kuş evi seyyid paşa medresesinin duvarında
society,haftaya salı gsü sosyolojiden ali ergur hocayı dinliyoruz araştırmadeneyimsosyoloji
society,hocam güzel haberi paylaşabildik selamlar çalışmalar
society,duyuru kurtuluş kayalı söyleşisi  şubat üniversitesi aracılığıyla
society,yakın geleceğin temel sosyal meselesi yaşlanmak yaşlılık olacaktır başlangıç temennisiyle
society,sosyoloji dergisinin yaşlanmanın sosyolojisi temalı sayısı yayında makaleler
society,baykuş başka öter kuzgun başka latince güzel sözler antolojisi derleyen latinceden çev çiğdem dürüşken
society,üniversitemizin uygulama örnekleri çalışma programı başladı
society,istanbulda olsam konferansa giderdim
society,önümüzde soru kurtuluş kayalı konuşuyor  şubat perşembe saat  amfi  bekliyoruz
society,türk romanı ekseninde türkiyeyi okumak teşebbüsüyle sosyolojik metinlere yansıyan türkiye fotoğrafı arasında
society,baharın müjdecisi müjdesini getirdi cemre düştü güzel mutlusundan zamanlar doğaya selam
society,edebiyat sosyoloji konuşmaları konuşma dizisinin tamamlanmasını müteakip sonbahar  neşredilmiş olacak
society,bugün ingilizce pratik günlerimiz başlamıştır kayıt yaptırmadan görselde belirtilen gün saatte
society,sosyoloji sosyal sorumluluk yl programı uygulamaları dersi konuğu vakıflar bölge müdür
society,leiden üniversitesinde hukuk alanında yükseklisans isteyen öğrencilere garanti bankasından imkanı
