society,zamanın tarih aşkı zifir arasından bilirsiniz terkisinde şiir
society,kentsel dönüşüm gülay yedekçi
society,kadının fenni  indirimli feyza meriç
society,jineoloji tartışmaları  indirimli
society,jineoloji tartışmaları  indirimli
society,nükleer enerji raymond
society,gündelik hayat sosyolojisi  indirimli ensar çetin
society,yüzyıl sivil toplumun şafağı  indirimli ferman salmış
society,tarihsel kültürel antropoloji  indirimli christoph wulf
society,sosyolojisi okumaları  indirimli cengiz yıldız
society,şehir şuur  indirimli nidayi sevim
society,öğretmen emeğinin dönüşümü  indirimli halil buyruk
society,sosyolojisi okumaları  indirimli cengiz yıldız
society,kozmopolitlik özgürlük coğrafyaları  indirimli
society,moderniteyi düşünmek  indirimli gurminder bhambra
society,sosyoloji  indirimli mehmet zencirkıran
society,tarih boyunca sanat  indirimli
society,sosyoloji felsefe  indirimli emile durkheim
society,sosyolojisi okumaları  indirimli cengiz yıldız
society,öğretmen emeğinin dönüşümü  indirimli halil buyruk
society,tarihsel kültürel antropoloji  indirimli christoph wulf
society,fransız felsefesinin macerası  indirimli alain badiou
society,moderniteyi düşünmek  indirimli gurminder bhambra
society,kozmopolitlik özgürlük coğrafyaları  indirimli
society,diyarbakırda ermeni kıyımı  indirimli hilmar
society,biraderim alekseyin köylü ütopyası ülkesine seyahati  indirimli
society,şiddetin cinsiyetli yüzleri  indirimli alev özkazanç
society,birikim   ağustos eylül  indirimli kolektif
society,ittihat terakki kürtler  indirimli naci kutlay
society,fransız felsefesinin macerası  indirimli alain badiou
society,sosyolojisi okumaları  indirimli cengiz yıldız
society,jineoloji tartışmaları  indirimli
society,kierkegaarddan hayat dersleri  indirimli ferguson
society,cumhuriyetçi  indirimli jeanfrançois bayart
society,faşistler  indirimli mann
society,medyatikleşen kültürler  indirimli andreas hepp
society,tarihsel kültürel antropoloji  indirimli christoph wulf
society,gündelik hayat sosyolojisi  indirimli ensar çetin
society,sosyoloji felsefe  indirimli emile durkheim
society,sosyoloji felsefe  indirimli emile durkheim
society,jineoloji tartışmaları  indirimli
society,nükleer enerji raymond
society,hegemonya politik toplum  indirimli mehmet özgüden
society,büyüme bölüşüm  indirimli duncan foley
society,jineoloji tartışmaları  indirimli
society,ilişkisel sosyoloji  indirimli powell
society,nükleer enerji raymond
society,dezenformasyon  indirimli ahmet cevdet aşkın
society,kaçış çizgileri  indirimli guattari
society,kadınlar toplumun altüst  indirimli mariarosa dalla
society,iktidarı dağıtmak  indirimli raul zibechi
society,carbonia zamanlar hepimiz komünisttik nanni balestrini
society,dokunursa fotoğrafa bakmayın bilir annesi umutlarla almıştı kırmızı tshirtü şortu ayakkabıyı
society,dedim eylüldü savruluşu bundandı kimsesizliğimizin
society,jineoloji tartışmaları  indirimli
society,yabani gerçek carine mccandless
society,aşktan üstün    indirimli kolektif
society,özne hayatı konuşunca  indirimli derleme
society,gösteriş  indirimli dyhouse
society,yörük çocuğunun hatıraları  indirimli emine uslu
society,sosyoloji  indirimli schaefer
society,müslümanlaştırılmış ermeniler  indirimli
society,sosyoloji divanı   dosya toplumsal hareketler sayı  sosyoloji dergisi
society,sosyal değişme aydın yaka gündoğan yayınları ucuza kitap oku
society,sosyoloji yazıları  indirimli aydın yaka
society,çalışma toplum strangleman
society,erich fromm analitik sosyoloji  indirimli sevra fırıncıoğulları
society,müslümanlaştırılmış ermeniler  indirimli
society,akışkan dünyada kültür zygmunt bauman
society,sosyoloji  indirimli schaefer
society,dersimin kayıp kızları  indirimli kazım gündoğan
society,sosyoloji felsefe  indirimli emile durkheim
society,sosyoloji felsefe  indirimli emile durkheim
society,dezenformasyon  indirimli ahmet cevdet aşkın
society,kadının fenni  indirimli feyza meriç
society,ziya gökalp sosyolojik düşünce sistemi  indirimli orhan türkdoğa
society,türkiyenin  indirimli demet lüküslü
society,izmir kültürparkın anımsamadıkları  indirimli
society,yöntembilim  indirimli skemal kartal
society,mekanın üretimi henri lefebvre
society,şehir kavramlarının yolculuğu nihal ekin erkan
society,birinci yüzyılda türkiyede yahudiler hoşgörünün yüzü
society,fetiş ikâme kolektif
society,mutluluğun sakıncaları  indirimli farrelly
society,yapay kutsallıklar  indirimli mevlüt özben
society,tinin sosyolojisi  indirimli yıldız akpolat
society,barışma etiği ercüment çelik
society,toplumun vicdanı  indirimli mustafa tekin
society,ötekilerin cumhuriyeti  indirimli alissa
society,moderniteçoğulculuk anlam krizi  indirimli
society,sosyoloji yazıları  indirimli aydın yaka
society,yaşamak ölmek üstüne  indirimli yusuf ziya bahadınlı
society,azınlığın zenginliği hepimizin çıkarına mıdır  indirimli zygmunt
society,günlük değildir zygmunt bauman
society,insan kendine gelir  indirimli ahmet büke
society,sınırın sosyolojisi devlet sınır insanları ferhat tekin
society,toplumsal sapma  indirimli abdullah korkmaz
society,akıntıya karşı yazılar ciltli  indirimli fikret başkaya
society,topraksızlar  indirimli metin yeğin
society,patronsuzlar  indirimli metin yeğin
society,komün  ekoloji  indirimli metin yeğin
society,dünyanın sokakları  indirimli metin yeğin
society,sosyolog tarihçi bourdievroger chartier
society,türk sosyolojisinde kuramsal tartışmalar dergicilik yıldız akpolat
society,komprador rejimin anatomisi kadir cangızbay özgür üniversite ucuza
society,globalleştirme terörü kadir cangızbay odak yayınevi ucuza kitap
society,sosyalizm özyönetim kadir cangızbay ütopya yayınevi ucuza kitap
society,sosyolojiler sosyoloji kadir cangızbay ütopya yayınevi ucuza
society,sosyolog tarihçi bourdievroger chartier
society,türk sosyolojisinde kuramsal tartışmalar dergicilik yıldız akpolat
society,çalışma sorunu kathi
society,imkansızı istemek slavoj zizek
society,sosyolog tarihçi bourdievroger chartier
society,türk sosyolojisinde kuramsal tartışmalar dergicilik yıldız akpolat
society,örgütsel yaşamda etkin yönetimi  indirimli abdullah yılmaz
society,bozahmetli yörük aşireti  indirimli fatih uslu
society,türkiyenin demokratikleşmesi  indirimli kolektif
society,belviran kazası tarihçesi sosyal kültürel yapısı  indirimli güle
society,cinsellik üzerine toplumsal fragmanlar  indirimli emre
society,acılı coğrafyanın kederli çocukları ezidiler  indirimli mehmet bayr
society,istanbulda yaşlanmak  indirimli murat şentürk
society,yaşamak ölmek üstüne  indirimli yusuf ziya bahadınlı
society,örgütsel yaşamda etkin yönetimi  indirimli abdullah yılmaz
society,bozahmetli yörük aşireti  indirimli fatih uslu
society,türkiyenin demokratikleşmesi  indirimli kolektif
society,belviran kazası tarihçesi sosyal kültürel yapısı  indirimli güle
society,akışkan dünyada kültür zygmunt bauman
society,yasa koyucular yorumcular  indirimli zygmunt bauman
society,etiğin tüketiciler dünyasında şansı zygmunt bauman
society,siyaset arayışı  indirimli zygmunt bauman
society,postmodern etik zygmunt bauman ayrıntı yayınları ucuza kitap oku
society,sosyolojik düşünmek  indirimli zygmunt bauman
society,ölümlülük ölümsüzlük hayat stratejileri zygmunt bauman ayrı
society,postmodernlik hoşnutsuzlukları zygmunt bauman ayrıntı yayınları
society,modernlik müphemlik zygmunt bauman ayrıntı yayınları ucuza kitap
society,küreselleşme zygmunt bauman ayrıntı yayınları ucuza kitap oku
society,bireyselleşmiş toplum  indirimli zygmunt bauman
society,yaşam sanatı zygmunt bauman kitap ucuza kitap oku
society,akışkan dünyadan  mektup zygmunt bauman kitap ucuza
society,modernite kapitalizm sosyalizm küresel çağda sosyal eşitsizlik zygm
society,akışkan gözetim zygmunt baumanavid
society,azınlığın zenginliği hepimizin çıkarına mıdır  indirimli zygmunt
society,günlük değildir zygmunt bauman
society,toplumsal ekolojinin felsefesi  indirimli bookchin
society,insantanrı ölümsüzlük  indirimli
society,sosyologca dergisi sayı  indirimli kolektif
society,toplumsal cinsiyet medya
society,sosyolojik çözümlemenin tarihi bottomorerobert nisbet
society,sosyolojik düşüncenin evreleri raymond aron
society,sosyal yapı değişim aliye çınar
society,sosyolojisi elkitabı kolektif
society,türk halk bilimi eserleri  sedat veyis örnek
society,sınırın sosyolojisi devlet sınır insanları ferhat tekin
society,iklim adaletine ciltli  indirimli tokar
society,kavramın anatomisi topluluk  indirimli gerard delanty
society,bilgi sosyolojisi  indirimli hüseyin
society,cinsellik üzerine toplumsal fragmanlar  indirimli emre
society,sosyoloji divanı   dosya toplumsal hareketler
society,sosyoloji divanı   dosya toplumsal hareketler sayı  sosyoloji dergisi
society,moderniteçoğulculuk anlam krizi  indirimli
society,sosyoloji tarihi dünyada türkiyede levent ünsaldı
society,seçilmiş metinler bourdieu
society,mesleğin incelikleri howard
society,bourdieu tarihsel analiz  indirimli kolektif
society,sosyal bilimcilerin yazma çilesi howard
society,şehir  indirimli
society,aylak sınıfın teorisi  indirimli thorstein bunde veblen
society,ilişkisel sosyal bilimler sergisi sayı   indirimli kolektif
society,durkheim öldü  indirimli asa
society,türkiyedeki suriyeliler  indirimli murat erdoğan
society,hukuk sosyolojisi  indirimli
society,çalışma sosyolojisi nevzat güldiken
society,özgür eğitim okulun kökenleri
society,ulusal kültürlerin sonu  indirimli kolektif
society,sınırın sosyolojisi devlet sınır insanları ferhat tekin
society,türkiyenin  indirimli demet lüküslü
society,akışkan dünyada kültür zygmunt bauman
society,ziya gökalp sosyolojik düşünce sistemi  indirimli orhan türkdoğa
society,insanın özgürlük arayışı  indirimli ali bulaç
society,akışkan dünyada kültür zygmunt bauman
society,toplumsal eylemin yapısı  talcott
society,toplumsal eylemin yapısı  talcott
society,günümüz toplum yapısı sorunlarımız  indirimli orhan türkdoğan
society,bedenin anlamı sınırları
society,şiddetle tavsiye
society,erich fromm analitik sosyoloji  indirimli sevra fırıncıoğulları
society,insanın özgürlük arayışı  indirimli ali bulaç
society,eleştirellikten uyuma  indirimli alev erkilet
society,türkiyenin  indirimli demet lüküslü
society,ziya gökalp sosyolojik düşünce sistemi  indirimli orhan türkdoğa
society,toplumsal hakikat nevzat çapkın
society,toplum burak özçetin
society,bedenin anlamı sınırları
society,doğan ergun hocanın sosyoloji tarih isimli meraklılarının bildiği güzel kitabı ekledik güzelliğe
society,akışkan dünyada kültür zygmunt bauman
society,dansı  indirimli gonca girgin tohumcu
society,toplumsal eylemin yapısı  talcott
society,toplumsal eylemin yapısı  talcott
society,günümüz toplum yapısı sorunlarımız  indirimli orhan türkdoğan
society,insanın özgürlük arayışı  indirimli ali bulaç
society,dansı  indirimli gonca girgin tohumcu
society,sosyoloji tarihi   indirimli yıldız akpolat
society,sosyoloji kuramları ritzer
society,postmodern kavşakta sivil toplum yasin aktay
society,sosyolojik düşüncenin evreleri raymond aron
society,sosyolog tarihçi bourdievroger chartier
society,sosyoloji tarihi   indirimli yıldız akpolat
society,feminizm kuram alev özkazanç
society,kavramın anatomisi topluluk  indirimli gerard delanty
society,cinsellik üzerine toplumsal fragmanlar  indirimli emre
society,sosyal medya gençlik  indirimli ömer miraç yaman
society,postmodern kavşakta sivil toplum yasin aktay
society,kentleşme göç  indirimli ahmet koyuncu
society,ereğli   çelik işçileri  indirimli şafak
society,çöküş  insanın halleri  indirimli celaleddin vatanda
society,bilgi sosyolojisi  indirimli hüseyin
society,sosyolog tarihçi bourdievroger chartier
society,sosyoloji tarihi   indirimli yıldız akpolat
society,tarihsel sosyoloji ferdan ergutayşen uysal dipnot yayınları ucuza
society,tarihsel sosyoloji  indirimli theda skocpol
society,sosyolojinin felsefi kökenleri benton
society,sosyoloji kuramları ritzer
society,sosyolojik düşüncenin evreleri raymond aron
society,tarih sosyolojisi  indirimli ramazan yelken
society,sosyoloji divanı   taşra fragmanları  indirimli kolektif
society,feminizm kuram alev özkazanç
society,cinsellik üzerine toplumsal fragmanlar  indirimli emre
society,sosyoloji yazıları  esra burcu
society,sosyolojinin başlıkları  indirimli baykan sezer
society,sosyal bilimler işe yarar   indirimli kolektif
society,tinin sosyolojisi  indirimli yıldız akpolat
society,toplumun vicdanı  indirimli mustafa tekin
society,sosyoloji ihsan sezal
society,ölme üzerine inceleme  indirimli kellehear
society,kültürdeğişme toplumsal çözülme  indirimli orhan türkdoğan
society,sosyoloji yazıları  indirimli aydın yaka
society,sosyoloji kuramları ritzer
society,çağdaş sosyoloji kuramları klasik kökleri ritzerjeffrey
society,sosyolojik düşünme çözümleme  indirimli kerim edinsel
society,kurumlara sosyolojik bakış  indirimli kolektif
society,bilgi sosyolojisi  indirimli hüseyin
society,türkiyede toplumsal değişim lütfi sunar
society,sosyolojik düşüncenin evreleri raymond aron
society,çağdaş sosyoloji kuramları klasik kökleri ritzerjeffrey
society,sosyolog tarihçi bourdievroger chartier
society,cadı kazanı avrupa aydınlanmasının unutulmuş radikalizmi philipp blom
society,sosyoloji kuramları ritzer
society,sosyolojik düşüncenin evreleri raymond aron
society,kız ışığı çalıp şarkılar söyledilerberi yanda ormanlar yanardı ciğerpareler tuyar
society,sosyoloji  indirimli schaefer
society,sosyoloji  indirimli azmi yetim
society,sosyal hareketlerin sosyolojisi  indirimli orhan türkdoğan
society,demokrasinin sosyolojisi ali yaşar sarıbay
society,etiğin sosyolojik temelleri  indirimli mustafa solmaz
society,sosyoloji tarihi dünyada türkiyede levent ünsaldı
society,çağdaş sosyoloji kuramları klasik kökleri ritzerjeffrey
society,örgüt sosyolojisi  indirimli gürsel
society,bilgi sosyolojisi  indirimli hüseyin
society,marxın sosyolojisi  indirimli jeanpierre durand
society,karizma zamanları yasin aktay
society,postmodern kavşakta sivil toplum yasin aktay
society,erkekler bribiescas doruk yayıncılık ucuza kitap oku
society,kültürün işleyişi gananath obeyesekere doruk yayıncılık ucuza kitap
society,işsizistanda hüseyin eren babıali kitaplığı ucuza kitap oku
society,kadının gizlenmiş tarihi rowbotham payel yayınevi ucuza kitap
society,sosyoloji antropoloji mauss doğu batı yayınları ucuza kita
society,arsızlık kültür ibrahim okur okursoy kitapları ucuza kitap oku
society,özgürleşemeyen kadın belma tokuroğlu odak yayınevi ucuza kitap oku
society,feminizm ayırım foucault derridada roy boyne yayıncılık
society,aklımda pamuk yıldız ayizi kitap ucuza kitap oku
society,kadın bakış açısından toplumsal cinsiyet rolleri şeref uluocakcumhur
society,toplumda tabakalaşma hareketlilik ahmet zeki ünal birleşik kitabev
society,azınlıklar marjinal gruplar ilkay demirkürek kurgu kültür merkezi
society,radyoaktif kapitalizm deniz moralı tarih bilimi yayınları ucuza kita
society,kendine değer veren kadın lynda fıeld ganj yayınları ucuza kitap oku
society,yeryüzünün yabancıları çingeneler suat kolukırık kitapçılık
society,politik sosyoloji ali yaşar sarıbay yayınları ucuza kitap
society,cinsellik üzerine toplumsal fragmanlar  indirimli emre
society,ekolojik sentez  indirimli yıldırım akman
society,ekotopya okuma notlari
society,uluslararası siyaset sosyolojisi seyfi
society,sosyolojik teori gelişmesi bellibaşlı paradigmala kinloch
society,sözün sosyolojisi kadir canatan
society,sosyoloji ihsan
society,sosyodini farklılaşma mustafa arslan
society,sosyolojisi zeki arslantürk
society,sosyolog tarihçi bourdievroger chartier
society,sosyolojisi yazıları mustafa aydın
society,çeviri sosyolojisi sevinç arı
society,sosyodini farklılaşma mustafa arslan
society,sosyoloji ihsan
society,sözün sosyolojisi kadir canatan
society,çeviri sosyolojisi sevinç arı
society,sosyolojisi yazıları mustafa aydın
society,sosyolog tarihçi bourdievroger chartier
society,dinlerin kavşağında izmir sosyolojik rehber okçay
society,çalışma sorunu kathi
society,sosyoloji kuramları ritzer
society,toplumun mantığı mantıksal anlatı sosyoloji ali yaşar sarı
society,sosyoloji kuramları ritzer
society,sınırın sosyolojisi devlet sınır insanları ferhat tekin
society,sosyolojik çözümlemenin tarihi bottomorerobert nisbet
society,sosyal yapı değişim aliye çınar
society,sistematik sosyolojisi mustafa aydın
society,boşanacaksın evleneceğiz hande çayır
society,weberde bilim sosyoloji  indirimli doğan özlem
society,cinsellik üzerine toplumsal fragmanlar  indirimli emre
society,dinî sosyaliteler frenk hayatının gecesinde necdet subaşı
society,sosyolojisi necdet subaşı
society,toplumlar ilkel köleci kapitalist toplum biçimleri kerov
society,aşiret modernleşmesi mahmut kaya
society,efendisiz halklar  indirimli barclay
society,tüketim toplumu  indirimli ismail demirezen
society,modernizim gelenekselcilik arasında  indirimli şamil öçal
society,bilgi sosyolojisi  indirimli hüseyin
society,insantanrı ölümsüzlük  indirimli
society,sosyoloji  indirimli sami şener
society,sosyologca dergisi sayı  indirimli kolektif
society,derin ahlak  indirimli ilhami güler
society,çöküş  insanın halleri  indirimli celaleddin vatanda
society,toplumun vicdanı  indirimli mustafa tekin
society,sosyoloji yazıları  esra burcu
society,toplumsal sapma  indirimli abdullah korkmaz
society,derin ahlak  indirimli ilhami güler
society,dinin toplumsal kökenleri  indirimli ilker belek
society,kentleşme göç  indirimli ahmet koyuncu
society,kavramın anatomisi topluluk  indirimli gerard delanty
society,postmodern kavşakta sivil toplum yasin aktay
society,endişeli muhafazakarlar çağı  indirimli volkan ertit
society,toplumsal hareket teorileri ortadoğu isyanları  indirimli ali ça
society,kürt toplumu üzerine ismail beşikçi
society,ereğli   çelik işçileri  indirimli şafak
society,boşanacaksın evleneceğiz hande çayır
society,sosyolojisi necdet subaşı
society,dinî sosyaliteler frenk hayatının gecesinde necdet subaşı
society,durkheim öldü  indirimli asa
society,hepimiz yamyamız  indirimli claude levistrauss
society,burjuva sosyolojisi  indirimli sezgin kızılçelik
society,acılı coğrafyanın kederli çocukları ezidiler  indirimli mehmet bayr
society,ilahi kanun sosyoloji nevzat çapkın
society,toplumsal hakikat nevzat çapkın
society,nişantaşı teneke mahallesi  indirimli egemen yılgür
society,rızanın imalatı kitle medyasının ekonomi politiği hermanno
society,kadın haklarının müdafaası wollstonecraft doruk yayıncılık ucuz
society,sıfır tolerans  indirimli ismail saymaz
society,dersimin kayıp kızları  indirimli kazım gündoğan
society,kimlik mekan gündelik hayat uğur kömeçoğlu ufuk kitapları ucuza
society,güvenlik şiddet savaş neocleous dipnot yayınları ucuza kitap
society,toplumsal cinsiyet medya
society,gençlik sosyolojisi  indirimli hayati beşirli
society,çalışma sosyolojisi nevzat güldiken
society,durkheim öldü  indirimli asa
society,enformasyon toplumunun putları  indirimli sadık güneş
society,bedenin anlamı sınırları
society,medeniyetin temelleri  indirimli
society,köprü  indirimli
society,ahmet bükenin sosyal ayrıntılar ansiklopedisi çıkıyor
society,insan kendine gelir  indirimli ahmet büke
society,saatleri ayarlama enstitüsü okuma notu
society,toplumsal eylemin yapısı  talcott
society,toplumsal eylemin yapısı  talcott
society,dinler tarihi tarihsel anlatı sharpe
society,çoğulculuk değer çoğulculuğunun siyaset teorisine uygulama
society,dünyada kamusal dinler
society,temsil kavramı fenichel pıtkın
society,toplumsal eylemin yapısı  talcott
society,toplum sözleşmesi ciltli  indirimli jacques
society,ekotopya okuma notlari
society,parçalılık metinlerarasılık ciltli  indirimli kubilay aktulum
society,topraksızlar  indirimli metin yeğin
society,patronsuzlar  indirimli metin yeğin
society,komün  ekoloji  indirimli metin yeğin
society,dünyanın sokakları  indirimli metin yeğin
society,parçalanmış zamanlar  yüzyılda kültür toplum hobsbawm
society,burjuva sosyolojisi batı sosyolojisini düşünmek cilt sezgi
society,burjuva sosyolojisi batı sosyolojisini düşünmek cilt sezgi
society,sefaletin sosyolojisi sezgin kızılçelik
society,sefaletin sosyolojisi sezgin kızılçelik
society,sanat sosyolojisi mahmut tezcan
society,sosyoloji tarihi  hobbesun sosyal teorileri sez
society,antropoloji gözüyleınıf kültür kimlik yazıları sibel özbudun
society,ekoloji doğal yaşam dünyaları insan necmettin çepel
society,türkiyede sosyal planlama sami güven
society,savaş erki erki neocleous
society,dinin soykütükleri  indirimli talal asad
society,dinin anlamı sosyal fonksiyonu  indirimli mircea eliade
society,türkiyede hıristiyan müslümanlar ysinan zavalsız
society,yüzyılda faşizmi cemal kutay
society,narsisizm dindarlık  indirimli rıza
society,psikolojisi fatma gül cirhinlioğlu
society,tevrattaki ütopya psikanalizmin arkeolojisi kaan polatlar
society,eski türk dini  şamanlık hayrettin kalkandelen
society,dinlerin çarpışması jeanpaul
society,dinin soykütükleri  indirimli talal asad
society,dinin anlamı sosyal fonksiyonu  indirimli mircea eliade
society,üzerine  indirimli vladimir ilyiç
society,eski iranda toplum  indirimli ahmet altungök
society,narsisizm dindarlık  indirimli rıza
society,toplum hareketinin perde arkası  halkla ilişkiler sezai kürşa
society,gezi tartışmaları  indirimli kolektif
society,emek yıllığı   indirimli
society,avrupa birliği siyaseti  indirimli brennan
society,siyaset bilimi  indirimli atilla yayla
society,kiç sözlüğü levent şentürk
society,yoksulluk kadın abdullah topçuoğlugamze aksan uygu alptekin
society,göstergebilim sosyoloji önal
society,çoğulculuk çokkültürlü çokdilli eğitim aydınihsan kaya
society,protestan ahlakı kapitalizmin ruhu
society,nehirler kuruyunca
society,kadını örttü ali bulaç
society,ergenlik dönemi yol haritası abdurrahman döner
society,özgürlüğün ekolojisi hiyearşinin ortaya çıkışı çözülüşü
society,sivil kadın türkiyede kadın sivil toplum ömer çaha
society,ölüm sosyolojisi adem sağır
society,kürtlerin kökeni durmuş kurt
society,istiyoruz nanni balestrini otonom yayıncılık ucuza kitap
society,istiyoruz nanni balestrini otonom yayıncılık ucuza kitap
society,carbonia zamanlar hepimiz komünisttik nanni balestrini
society,kadınlar toplumun altüst  indirimli mariarosa dalla
society,londra idamları  indirimli linebaugh
society,makine kırıcılık ned ludd linebaugh
society,antropoloji insan çeşitliliğinin önemi conrad phillip kottak
society,kürt dosyası mehmet gülün notları şeref gülbanu doğan
society,sosyolojik soruşturmalar gündelik olanın analizinden kesitler ali esg
society,toplumun mantığı mantıksal anlatı sosyoloji ali yaşar sarı
society,sivas kabadayıları  indirimli fuat bozkurt
society,medya popüler kültür  indirimli ekmel geçer
society,öpüşmenin tarihi popüler kültürün doğuşu  indirimli danesi
society,popüler kültür tekrarlanan imajlar burak satar
society,toplumsal bellek belgesel sinema  indirimli asuman susam
society,yönetim düşüncesi  indirimli sancaktar
society,kapitalizmde sınıf  indirimli ilker belek
society,türkiyede laiklik özgür şen
society,avrupa sağlık reformları kel göründü ilker belek
society,dinin toplumsal kökenleri  indirimli ilker belek
society,emek yıllığı   indirimli
society,toplumsal bellek belgesel sinema  indirimli asuman susam
society,mısırın uzun  yüzyılı  indirimli özge özkoç
society,sınırlar ülkesinde  indirimli sherko fatah
society,yönetim düşüncesi  indirimli sancaktar
society,mitostan felsefeye  indirimli attilla erdemli
society,harcıyorum öyleyse varım  indirimli
society,direnişsürgün ölüm günleri  indirimli tarık uygun
society,zamanlar mülkiye  indirimli savaş
society,skolastik fantazya  indirimli hüseyin köse
society,türk toplumunda zazalar kürtler  indirimli orhan türkdoğan
society,sekülerleşme  indirimli mehmet ali
society,istanbulda yaşlanmak  indirimli murat şentürk
society,boşanacaksın evleneceğiz hande çayır
society,okulu  indirimli kurtul gülenç
society,kızıma felsefe öğretiyorum rogerpol
society,kitleler psikolojisi gustave
society,hepimiz yamyamız claude levistrauss
society,salnama ehmede xani  mehmet gültekinbahar gültekinnihat gültekin
society,kürtler tarih siyaset kültür strohmeierlale yalçın  heckma
society,inadına canlı kadınlar ekoloji hayatta kalma vandana
society,insanı tanımak ahmet rıfat
society,sakıncalı yazılar demirkazık
