politics,bugün saat canlı yayınına konuk olacağım
politics,almanya dışişleri bakanlığının ülkemize yönelik seyahat uyarısı hakkında basın açıklaması
politics,afganistanın başkenti kabilde düzenlenen terör saldırısı hakkında basın açıklaması
politics,münihte  temmuz  tarihinde terör eylemleri hakkında basın açıklaması
politics,bugün saat haber canlı yayınına konuk olacağım
politics,olağanüstü hâl ilanı demokrasi hukuk özgürlükleri koruma amacına yönelik
politics,yunanistan dışişleri bakanının kıbrıs barış harekâtı hakkındaki açıklamasına basın açıklaması
politics,fars haber ajansına atfen makamlarınca dile getirildiği ileri sürülen ifadeler hk soruya cevabım
politics,suudi arabistanın  temmuz  tarihinde ülkemizde gerçekleştirilen darbe teşebbüsüne yönelik tutumların
politics,milletimiz meydanı darbecilere bırakmamış tarihî duruş sergilemiştir
politics,iddialara ilişkin soruya cevabım
politics,uluslararası basın organlarında yeralan darbecilere yönelik kovuşturmalar hakkındaki
politics,gün olma beraber olma türkiye olma günüdür tehdit tektir tehdit türkiyenin geleceğidir
politics,siyasi partiden darbeye karşı ortak bildiri
politics,birleşmiş milletler güvenlik konseyince yayımlanmasına mısırın engel olmasına soruya cevabım
politics,türkiyedeki darbe girişimine karşı tutum demokratik yollarla seçilmiş hükümetimize destek beyan açıklama
politics,natoab ortak bildirisi hakkındaki soruya cevabım
politics,varşova zirvesinde genel sekreteri komisyonu konseyi başkanları imzalanan
politics,bakan çavuşoğlu azerbaycan dışişleri bakanı memedyarov ortak basın toplantısında soruları yanıtlıyor
politics,nicete gerçekleştirilen terör saldırısı hakkında basın açıklaması
politics,engellediğine yönelik yorumları hakkındaki soruya cevabım
politics,dışişleri bakanlığı sözcüsünün türkiyenin güneydoğu anadolu bölgesindeki soruşturmaları
politics,azerbaycana gerçekleştireceği ziyaret hakkında basın açıklaması
politics,ülkemiz rusya arasında turizm ilişkilerinin geliştirilmesi yapılacak toplantı hakkında basın açıklaması
politics,avrupa parlamentosunda terörizmi teşvik serginin açılışı hakkında basın açıklaması
politics,ulusal mutabakat hükümetinin hükümet binasına yerleşmesi hakkında basın açıklaması
politics,srebrenitsa soykırımı anma töreni hakkında basın açıklaması
politics,istanbulda düzenlenecek dünya miras komitesinin  toplantısı hakkında basın açıklaması
politics,iraktaki terör saldırısı hakkında basın açıklaması
politics,fransa ulusal meclisinde kabul edilen basın özgürlüğü kanununa ilişkin değişiklik tasarısı hk soruya cevabımhttps
politics,suudi arabistanda meydana gelen terör saldırıları hakkında basın açıklaması
politics,irakta meydana gelen terör saldırısı hakkında basın açıklaması
politics,bangladeşteki terör saldırısı hakkında basın açıklaması
politics,rusya lavrov ilişkilerimizin normalleşme sürecinde karşılıklı adımlara ilişkin verimli görüşme yaptık htt
politics,ziyareti
politics,kabilde düzenlenen terör saldırısı hakkında basın açıklaması
politics,karadeniz ekonomik işbirliği bakanlar toplantısına katılımı hakkında basın açıklaması
politics,meydana gelen terör saldırısı hakkında basın açıklaması
politics,bütçesel hükümler faslının açılışı hakkında basın açıklaması
politics,meydana gelen terör saldırısı hakkında basın açıklaması
politics,fransuvanın ermenistan ziyareti kapsamındaki açıklamaları imzalanan ortak bildiri hakkında basın açıklaması
politics,gerçekleştirilen saldırı hakkında basın açıklaması
politics,kolombiyada hükümet farcın karşılıklı ateşkes silah bırakma hususunda anlaşmaları hakkında basın açıklaması
politics,kkorenin balistik füze denemeleri hakkında basın açıklaması
politics,haziran ayında yoğun diplomatik temaslarına devam
politics,rfnin suriyedeki saldırıları hakkında basın açıklaması
politics,dışişleri bakanı vellanın ülkemizi ziyareti hakkında basın açıklaması
politics,düzenlenen terör saldırısı hakkında basın açıklaması
politics,terörizmin dini sınırları yoktur meydana gelirse gelsin nefrete karşı durmalıyız
politics,dünya enerji kongresi  ekim  tarihlerinde düzenlenecek
politics,kuzey kıbrıs türk cumhuriyeti dışişleri bakanı tahsin ertuğruloğlunun ülkemizi ziyareti hakkında basın açıklaması
politics,sınırımızdan yasadışı geçmeye çalışan suriyelilere ateş açıldığı iddiası hakkındaki soruya cevabım
politics,hakkında basın açıklaması
politics,mısırın seçilmiş cumhurbaşkanı mursiye verilen hapis cezası hakkında basın açıklaması
politics,komisyonunun  haziran tarihli raporuna ilişkin soruya cevabım
politics,afganistana gerçekleştireceği ziyaret hakkında basın açıklaması
politics,türkiyeden lankaya dışişleri bakanı düzeyindeki ziyareti gerçekleştiriyor
politics,abdnin orlando şehrinde meydana gelen terör saldırısı hakkında basın açıklaması
politics,idlipte pazar düzenlenen hava saldırısı hakkında basın açıklaması
politics,dışişleri bakanlığı müsteşarı sinirlioğlunun çin halk cumhuriyeti çhc ziyareti hakkında basın açıklaması
politics,lankaya gerçekleştirecekleri ziyaret hakkında basın açıklaması
politics,myanmarı ziyareti hakkında basın açıklaması
politics,seyahat duyurusu
politics,halepteki hastanelere düzenlenen hava saldırıları hakkında basın açıklaması
politics,bakan  polonya romanya dışişleri bakanları varşovada basının sorularını yanıtlıyor
politics,türkiyeromanyapolonya dışişleri bakanları üçlü toplantısını gerçekleştiriyoruz
politics,varşovada düzenlenecek türkiye polonya romanya üçlü dışişleri bakanları toplantısı hakkında basın açıklaması
politics,yunan dışişleri bakanlığının ayasofyada ramazan boyunca kuranı kerim okunmasını kınaması hakkında soruya cevabım
politics,dışişleri bakanı haber canlı yayınında soruları yanıtlıyor
politics,kazakistanda meydana gelen terör saldırısı hakkında basın açıklaması
politics,zirvesi brüksel konferansı öncesinde temas grubu toplantısı  haziranda yapıldı
politics,afganistan uluslararası temas grubu toplantısı hakkında basın açıklaması
politics,alman parlamentosunun  olaylarına ilişkin  haziran  tarihli kararı hakkında basın açıklaması
politics,somalide bombalı saldırı hakkında basın açıklaması
politics,yılı hac düzenlemelerine ilişkin soruya cevabım
politics,ülkemizden cumhurbaşkanı düzeyindeki ziyarette cumhurbaşkanımıza refakat
politics,dışişleri bakanı düzeyindeki ziyareti gerçekleştirmek ruandaya geldik bakan mushikiwabo görüştük http
politics,idlipte hastaneye gerçekleştirilen hava saldırısı hakkında basın açıklaması
politics,fransız güvenlik güçlerinin müdahalelerde bulunmasıyla soruya cevabım
politics,fransada çalışma yasası reformu sebebiyle yaşanan sokak gösterileri
politics,ruandaya yapacağı ziyaret hakkında basın açıklaması
politics,ziyareti hakkında basın açıklaması
politics,yıl almanyanın solingen şehrinde evleri yakılarak katledilen vatandaşımızı saygı rahmetle anıyoruz
politics,solingen saldırısının  yıldönümü hakkında basın açıklaması
politics,gelişmiş ülkeler toplantısı açılış oturumunda konuşma
politics,antalyada ev sahipliği yaptığımız gelişmiş ülkeler eagü toplantısı fotoğrafı başladı
politics,gelişmiş ülkelere yönelik toplantı hakkında basın açıklaması
politics,toplantısı etkinliklerle gün sürecek üzerinde konuğu ağırlayacağız
politics,gelişmiş ülkeler  toplantısı  mayıs tarihlerinde antalyada düzenlenecek
politics,gelişmiş ülkeler eagü toplantısı bayrak çekme töreniyle resmi başladı
politics,dünya insani zirvesi bayrak indirme töreni sona erdi
politics,hakkında basın açıklaması
politics,yemende meydana gelen terör saldırıları hakkında basın açıklaması
politics,dünya insani zirvesi fotoğrafı
politics,dünyadaki insani krizleri çözüm çabalarını ele alacağımız dünya insani zirvesi istanbulda başladı
politics,dünya insani zirvesi başlıyor oturumları canlı yayınla takip edebilirsiniz
politics,suriyeli sığınmacılar türkiyedeki sağlık hizmetlerini ücretsiz alabiliyor
politics,diz etkinlikler türkiyedeki suriyelilere sunulan sağlık eğitim hizmetleri  meb
politics,ülkede kaç suriyeli sığınmacı
politics,dünya insani zirvesi  mayısta
politics,çerkes sürgününün yıldönümü hakkındaki soruya cevabım
politics,mısır havayolları uçak kazası hakkında basın açıklaması
politics,dışişleri bakanları ilkbahar toplantısına katılmak brüksele geldik
politics,lankada yaşanan felaketi hakkında basın açıklaması
politics,dışişleri bakanları toplantısı hakkında basın açıklaması
politics,yunanistan makamlarının batı trakya türk azınlığı hakkındaki açıklamaları hakkında soruya cevabım
politics,irakta meydana gelen terör saldırıları hakkında basın açıklaması
politics,kırım sürgünü matem mitinginde okunan mesajı
politics,mayısta avrupa konseyi bakanlar komitesi toplantısına katılımı hakkında basın açıklaması
politics,gelişmiş ülkeler eagü toplantısı  mayısta antalyada eagülerin kalkınma çabalarını destekliyoruz
politics,kırım sürgününün  yıldönümü hakkındaki soruya cevabım
politics,perşembecuma günleriyse bakan dışişleri bakanları ilkbahar toplantısı brüksele geçecek
politics,bakanımız çarşamba günü sofyada avrupa konseyi bakanlar komitesi toplantısına katılacak
politics,bakanımız pazartesisalı günleri viyanada suriye konulu toplantılara iştirak
politics,hafta dışişleri bakanı yoğun diplomasi haftası olacak
politics,suriye konusunda düzenlenecek dışişleri bakanları toplantıları hakkında basın açıklaması
politics,dünya insani zirvesi küresel insani yardım sisteminin güçlendirilmesi tarihi fırsat sunuyor
politics,irakın başkenti bağdatta meydana gelen terör saldırısı hakkında basın açıklaması
politics,bangladeşte cemaati islami partisi liderlerinden nizamiye verilen idam cezasının infazı hakkında basın açıklaması
politics,uluslararası toplum insani krizlere etkin şekilde müdahale edebilir
politics,insan hakları yüksek komiseri elhüseyinin ülkemize ilişkin açıklamaları hakkında soruya cevabım
politics,suriyede pazar hava saldırısı hakkında basın açıklaması
politics,dünya miras komitesi  oturumu  temmuz tarihleri arasında düzenlenecek
politics,mayısta gelişmiş ülkeler eagü toplantısında katılımcıları ağırlayacağız
politics,diz vesilesiyle insani alandaki tecrübeampörnek uygulamalarını uluslararası toplumla paylaşma fırsatı bulacak
politics,düzenlenecek dünya insani zirvesinediz  mayısta evsahipliği yapacağız
politics,ülkemiz önümüzdeki aylarda önemli üstdüzeyli uluslararası toplantılara evsahipliği
politics,türk halkının avrupa halklarının kutlu
politics,pariste suriye konusunda düzenlenecek toplantıya katılımı hakkında basın açıklaması
politics,suriyede yerlerinden edilmiş kişilerin barındığı çadır hava saldırısı hakkında basın açıklaması
politics,komisyonunun vatandaşlarımıza vize serbestisi sağlanmasına yönelik tavsiyesi hakkında basın açıklaması
politics,dünya insani zirvesi  gün istanbulda düzenlenecek
politics,ülkemizin ekvatora yardımı hakkında basın açıklaması
politics,halepe hava saldırıları hakkında basın açıklaması
politics,yoğun diplomatik temasla geçen hafta  nisanda sarabistanbaeazerbaycanampçini ziyaret
politics,ziyareti
politics,medeniyetler ittifakı toplantısına katılmak yü ziyaret
politics,milli meclisinin faaliyetlerinin yasaklanması hakkında basın açıklaması
politics,nisanda yapılacak aigkcica dışişleri bakanları toplantısı vesilesiyle pekini ziyaret
politics,medeniyetler ittifakı  küresel forumunda cumhurbaşkanımıza refakat etmek
politics,birleşik arap emirliklerini ziyareti hakkında basın açıklaması
politics,suudi arabistan ziyareti hakkında basın açıklaması
politics,ege denizindeki faaliyetinin icrasında türkiyenin engel çıkardığı yönündeki iddialar hk soruya cevabım
politics,başkanı obamanın  olaylarına ilişkin açıklaması hakkında
politics,genel sekreterinin ülkemizi ziyareti
politics,ekim tarihleri arasında düzenlenecek
politics,dünya insani zirvesine  gün kaldı
politics,deaş terör örgütünün kerküktazehurmatuya saldırısından etkilenen türkmenlerin tedavisi hakkında basın açıklaması
politics,genel sekreteri stoltenberg   tarihlerinde ülkemizi ziyaret
politics,kabilde düzenlenen intihar saldırısı hakkında basın açıklaması
politics,polonya dışişleri bakanı witold waszczykowskinin ülkemizi ziyareti hakkında basın açıklaması
politics,strazburg ziyaretinde başbakanımız refakat
politics,ekvatorda meydana gelen deprem felaketi hakkında basın açıklaması
politics,sınırımıza yaklaşan suriyelilere ateş açıldığına gazetede çıkan haber hakkındaki soruya cevabım
politics,kırım milli meclisinin faaliyetlerinin askıya alınması hakkındaki soruya cevabım
politics,arabistan türksuudi koordinasyon konseyi kurulmasına ilişkin mutabakat belgesi imzaladık
politics,terörizmle mücadele küresel forumunun eşbaşkanlığını fasa devretmemiz hakkındaki soruya cevabım
politics,zirvesi adalet barış birlik dayanışma temasıyla  nisanda düzenlenecek
politics,zirvesi kapsamında dışişleri bakanları konseyi toplantısı düzenleniyor
politics,afganistanın nangarhar vilayetinde düzenlenen intihar saldırısı hakkında basın açıklaması
politics,suudi arabistan kralının ülkemizi resmi ziyareti öncesinde görüştük
politics,uygulanmaya başlanan ateşkesi memnuniyetle karşılıyoruz
politics,hindistanda meydana gelen yangın faciası hakkında basın açıklaması
politics,dışişleri bakanı murat akgünün sorularını yanıtlıyor
politics,dönem başkanı hollandanın dışişleri bakanı beraberindeki heyetin ülkemizi ziyareti hakkında basın açıklaması
politics,dışişleri bakanı yarın sabah cumartesi murat akgünün sorularını yanıtlayac
politics,nin dinamik vizyoner dış politika izleme kapasitesini güçlendiriyoruz
politics,türkiye israil görüşmeleri hakkında basın açıklaması
politics,dünya insani zirvesi  mayısta
politics,dışişleri bakanı çavuşoğlunun iranı ziyareti
politics,anadolunun sesini dünyaya duyurmak  yıldır canla başla çalışan nın kuruluş yıldönümünü kutluyorum
politics,finlandiyaya ziyaret gerçekleştirmekte başbakanımıza refakat ediyoruz
politics,özel temsilcimiz emrullah işlerin trablus ziyareti hakkında basın açıklaması
politics,üçlü dışişleri bakanları toplantısına katılmak iranı ziyaret ediyoruz
politics,pakistanda meydana gelen felaketi hakkında basın açıklaması
politics,türkiye cumhuriyeti musul başkonsolosluğu yerleşkesine yönelik hava harekatı hakkında basın açıklaması
politics,dışişleri bakanları toplantısı hakkında basın açıklaması
politics,türkiyenin suriyelileri zorla ülkelerine geri gönderdiği iddiaları hakkında basın açıklaması
politics,temas hattında azerbaycanermenistan sınır hattındaki çatışmalar hakkında basın açıklaması
politics,cumhurbaşkanımız başkanı obama görüştü
politics,suriyede rejimin sivillere saldırıları hakkında basın açıklaması
politics,ulusal mutabakat hükümeti başkanlık konseyi üyelerinin trablusa intikali hakkında basın açıklaması
politics,dünya liderlerini insani zirvesi bekliyoruz
politics,cumhurbaşkanımız antisemitik islamofobik yabancı düşmanı akımlarla ortak mücadele etmemiz şarttır
politics,somalide vatandaşlarımıza yönelik gerçekleştirilen saldırı hakkında basın açıklaması
politics,gelecek nesiller yeşil dünya nın açılışına  gün kaldı
politics,dışişleri bakanıdeğerli dostum işbirliğimizin gündemindeki konuları bölgesel gelişmeleri ele aldık
politics,çalışma ziyaretinde bulunmak nükleer güvenlik zirvesine katılacak cumhurbaşkanımıza refakat etmek abdde
politics,gerçekleştirilen alçakça terör eylemini kuvvetli şekilde kınıyoruz başsağlığı diliyoruz
politics,yemendeki terör saldırısı hk basın açıklaması
politics,tarihlerinde abdye çalışma ziyareti gerçekleştirecektir
politics,irakta meydana gelen terör saldırısı hk basın açıklaması
politics,gkrynin açtığı üçüncü uluslararası hidrokarbon arama ihalesi hk basın açıklaması
politics,deaş terör örgütünün kerküktazehurmatuya yönelik saldırısından etkilenen türkmenlerin tedavisi hk
politics,eski yugoslavya uluslararası ceza mahkemesinin kararı hakkında basın açıklaması
politics,türkiye arasında  martta varılan mutabakata ilişkin ayrıntılar
politics,insani krizlere etkin şekilde müdahale edebiliriz
politics,bugün gerçekleştirilen terör saldırılarını nefretle kınıyor lanetliyoruz
politics,dışişleri bakan yardımcısı blinkenın ülkemizi ziyareti hk basın açıklaması
politics,dışişleri bakanı vella   tarihlerinde ülkemize resmi ziyaret gerçekleştirecektir
politics,insani krizlere müdahale ortak sorumluluk ahlaki görev
politics,dünya insani zirvesi  mayısta
politics,mısırın kuzey vilayetinin ariş kentinde dün  düzenlenen terör saldırısını şiddetle kınıyoruz
politics,görevleri başında şehit edilen mensuplarımızı  şehitleri anma gününde dışişleri şehitliğinde andık
politics,dışişleri bakanı cevad zarif   tarihinde ülkemizi ziyaret edecektir ayrıntılar
politics,şehitleri anma günü vesilesiyle şehitlerimizi saygı rahmetle anıyoruz
politics,tarihi olaylara atfen türkiyeye türk kimliğine yönelik ağır iddialar içeren açıklamalarına ilş soruya cevabım
politics,yunanistan bşbk çipras cbşk pavlopulosun ermenistan cbşk sarkisyanın ziyareti vesilesiyle osm impnun parçalanışı
politics,nijeryada meydana gelen terör saldırıları hk basın açıklaması
politics,türkiye insani yardım alanında büyük donör ülkelerden
politics,batı şeriada  dönüm araziye koyma kararı hk basın açıklaması
politics,pakistanın peşaver şehrinde gerçekleştirilen terör saldırısı hk basın açıklaması
politics,dünya insani zirvesi  mayısta sitesini ziyaret ettiniz
politics,yılında düzenlenen referandum hk basın açıklaması
politics,türkiyeazerbaycan yüksek düzeyli stratejik işbirliği konseyi toplantısı ankarada yapıldı
politics,saldırısı sonrası acımızı paylaşan dostlarımıza teşekkür ediyoruzherkes ortak tehdit terörle topyekü
politics,ankaradaki alçak terör saldırısını lanetliyorum terörün türü mücadelemiz sonuna devam
politics,ın ün tazehurmatu nahiyesine gerçekleştirdiği saldırı hk basın açıklaması
politics,güçlü insani diplomasi insani yardım geleneği yaklaşık  suriyeliyi ağırlıyor
politics,türkingiliz tatlıdil forumu toplantısı hk basın açıklaması
politics,türkiyebelçika dışişleri adalet içişleri bakanları toplantısı ayrıntılar
politics,türkiyeyunanistan yüksek düzeyli işbirliği konseyi toplantısı izmirde gerçekleştirildi
politics,türkiye belçika dışişleri adalet içişleri göç iltica bakanları toplantısı ortak basın açıklaması
politics,deaşın tunusta gerçekleştirdiği terör saldırıları hk basın açıklaması
politics,türkiyeyunanistan  yüksek düzeyli işbirliği konseyi izmirde toplandı
politics,türkiye belçika dışişleri adalet içişleri bakanları toplantısı  martta ankarada gerçekleştirilecek
politics,başbakanımıza refakaten brüksele ziyaret
politics,dünya kadınlar gününü kutluyoruz
politics,irakta meydana gelen terör saldırısı hk basın açıklaması
politics,dünya insani zirvesi güçlü insani diplomasi geleneği bulunan ülkemizde  mayısta gerçekleştirilecek
politics,cumhurbaşkanımıza refakaten fildişi sahili gana nijerya ziyaretleri
politics,bakanımızın atinayı ziyareti hk basın açıklaması
politics,günlük afrika ziyareti sona eriyor cumhurbaşkanımıza refakaten ginede
politics,türkiyekanada siyasi istişareleri müsteşarımızın başkanlığında   tarihinde ottavada düzenlenecektir
politics,cumhurbaşkanımıza refakaten afrika ziyaretinin üçüncü durağı nijeryada
politics,fildişi sahilinin ardından afrika ziyaretinin ikinci durağı ganada cumhurbaşkanımıza refakat
politics,bağdatta sayıda kişinin hayatını kaybettiği yaralandığı terör saldırısını şiddetle kınıyoruz ayrıntılar
politics,türkiyeafrika ortaklığı güçleniyor somut sonuçlar veriyor
politics,rusya federasyonunda meydana gelen grizu patlamaları hk basın açıklaması
politics,afrika ziyareti sırasında cumhurbaşkanımıza refakat
politics,arasındaki siyasi istişareler istikşafi temaslar hk basın açıklaması
politics,hocalı katliamının  yıldönümü hk basın açıklaması
politics,ege denizindeki faaliyeti hk basın açıklaması
politics,insani yardım alanında büyük donör ülkelerden türkiye  mayısta dünya insani zirvesine ev sahipliği yapacaktır
politics,doçdrbülent şenayagit müslümanlara karşı hoşgörüsüzlük ayrımcılıkla mücadele özel temsilcisi atanmıştır
politics,yıldönümünde yapılacak törene ilişkin soruya cevabım
politics,dünya savaşı sırasında yahudi mültecileri taşıyan isimli geminin batırılmasının
politics,gkrydeki denya camiinin kundaklanması hk basın açıklaması
politics,yüksek düzeyli ortaklık forumucumhurbaşkanımız ın açılış konuşmasıyla başladı
politics,yüksek düzeyli ortaklık forumu  şubat  tarihlerinde istanbulda düzenlenecektir ayrıntılar
politics,yapılacak türkiyesomali işadamları forumu bugün gün toplanacaktır
politics,dışişleri uluslararası işbirliği bakanı gentiloninin ülkemizi ziyareti hk basın açıklaması
politics,hazırlıkları tamamlanmıştır türkiye uluslararası toplumdan takriben  heyeti ağırlayacaktır
politics,tifliste türkiyeazerbaycangürcistan dışişleri bakanları üçlü toplantısına katılıyor
politics,terör dünyanın ortak sorunudur ortak meselenin üstesinden ortak mücadele gelinebilir
politics,dayanışmanın artık somut sonuç odaklı işbirliğine dönüştürülmesini bekliyoruz
politics,ankaradaki alçak saldırı sonrası taziye destek mesajlarıyla ülkemizle dayanışma gösteren dostlarımıza teşekkür
politics,dışişleri bakanı ziyareti ayrıntılar
politics,türkevi binası projesi hk basın açıklaması
politics,gürcistan janelidzenin davetine icabeten gürcistanda
politics,rfnin hava saldırılarında sivilleri hedef alması hk basın açıklaması
politics,bakanımızın gürcistanı resmi ziyareti türkiyeazerbaycangürcistan dışişleri bakanları üçlü topl hk
politics,bosna hersekin bugün üyelik süreci çerçevesinde gerçekleştirdiği adaylık başvurusu memnuniyetle karşılanmaktadır
politics,ziyareti sırasında başbakanımıza refakat
politics,alanda destek vermeye devam edecektir önemli dönüm noktası teşkil edecektir
politics,yönelik insani yardımlarımız hk basın açıklaması
politics,ülkemiz sağlanan yardım hk basın açıklaması
politics,münihte uluslararası suriye destek grubu toplantısına katıldı
politics,kerrynin evsahipliğinde düzenlenen kısıtlı katılımlı ön destek grubu toplantısına katıldı
politics,meydana gelen intihar saldırıları hk basın açıklaması
politics,marjında katarlı suudi mevkidaşlarıyla biraraya geldi
politics,güncel krizlerin güvenlik sınamalarının ele alınacağı  münih güvenlik konferansına katılmak
politics,forumunda somalide kaydedilen ilerleme geleceğine ilişkin işbirliği olanakları görüşülecektir
politics,almanya aiblingdeki tren kazasında hayatını kaybedenlerin yakınlarına başsağlığı yaralananlara acil şifalar
politics,dışişleri bakanı macaristan ziyareti ayrıntılar
politics,macaristan ziyareti kapsamında macaristan başbakanı viktor orban kabul edildi
politics,macaristan dışişleri dış ticaret bakanı szijjarto başbaşa görüşme gerçekleştirdi
politics,macaristan temasları kapsamında macaristan ulusal meclisi başkanı laszlo köver kabul edildi
politics,dışişleri dış ticaret bakanı szijjartonun davetine icabetle
politics,ı ziyareti hk basın açıklaması
politics,sncumhurbaşkanımız cumhurbaşkanı bmgs eşbaşkanlıklarında  şubat  tarihlerinde istanbulda yapılacaktır
politics,demokratik halk cumhuriyetinin  şubat  tarihinde gerçekleştirdiği uzun menzilli füze fırlatması hk
politics,iraka yönelik vize rejimimizde değişiklik hakkındaki soruya cevabım
politics,amerika ziyaretinin durağı ekvatorda cumhurbaşkanımıza refakat
politics,açık semalar antlaşması asa çerçevesinde rfnin ülkemizde gerçekleştiremediği gözlem uçuşu hk soruya cevabım htt
politics,dışişleri bakanı lavrovun rus uçaklarının türk egemen hava sahasını ihlali konusundaki ifadeleri hk
