politics,uluslararası ombudsmanlık sempozyumuna katıldı ayrıntılar
politics,meydana gelen terör saldırıları hk basın açıklaması
politics,bakanımız hakkındaki makalesi
politics,dışişleri bakanı munci hamdi biraraya geldi ayrıntılar
politics,nün komisyonu yayınlanan rapor hakkındaki soruya cevabı
politics,adalet kalkınma partisi milletvekili emrullah işlerin ziyareti hk basın açıklaması
politics,bakanlığımızda yaptığımız görüşmelerde işbirliğimizin alanda geliştirilmesi yönündeki irademiz
politics,tunus dışişleri bakanıdeğerli kardeşim munci hamdiyi ülkemizde ağırlamaktan memnuniyet duyuyoruz
politics,hükümetinde boş bulunan bakanlıklara atama hk basın açıklaması
politics,dışişleri bakanının ziyareti hk basın açıklaması
politics,bmnin kurucu etkin aktörü türkiye haklı güçlü tezlerini platformda yükseltmeye
politics,kampanya boyunca türkiye adaletten yana güçlü duruşunu ülkeleri uluslararası toplum nezdinde ke
politics,dönemi güvenlik konseyi üyeliğine seçilen angolavenezuelamalezyayeni zelanda ispanyayı tebrik
politics,temasları devam ayrıntılar
politics,temasları devam ayrıntılar
politics,güvenlik konseyi adaylık kampanyamızı yorkta geniş katılımlı resepsiyonumuzla tamamladıkgeri sayım başladı
politics,pasifikteki gelişmekte küçük ada devletleripsids devir teslim töreni resepsiyonunda katılımcılara hitap ettik
politics,gelişmiş ülkeler eylem planı izleme raporunun tanıtım resepsiyonuna katıldık
politics,temaslarına devam ayrıntılar
politics,sonuç olsunküresel adalet barış eksenli insani dış politikamız türkiyeyi kutup yıldızı parlatm
politics,türkiye sorunlara adilkapsamlı kalıcı çözümler üretenbarış adaletin savunucusu konumuyla konseyi
politics,kampanya sürecince dünyanın bölgesinden gördüğümüz teveccüh ilgi türkiyenin adaylığının heyecan uyan
politics,yana yürüttüğümüz yoğun kampanya döneminin ardından yarın yapılacak seçimlerden ülkemizin sonuc
politics,temasları ayrıntılar
politics,saldırı hk basın açıklaması
politics,taki osmanlı eserlerine saldırılar hk basın açıklaması
politics,ayrıntılar
politics,ekim tarihleri arasında yorku ziyaret edecektir ayrıntılar
politics,gerçekleştirilen terör saldırısı hk basın açıklaması
politics,haremi şerifte müslümanların ibadet hürriyetlerine yönelik girişimleri hk basın açıklaması
politics,kosta rikalı mevkidaşı biraraya geldi ayrıntılar
politics,genel sekreteri stoltenbergle biraraya geldi ayrıntılar
politics,haremi şerifte müslümanların ibadet hürriyetlerine yönelik girişimleri hk basın açıklaması
politics,ekim  tarihinde resmi ziyaret gerçekleştirecektir
politics,sunün soruya cevabı
politics,kosta rika dışişleri bakanının ülkemize gerçekleştireceği ziyaret hk basın açıklaması
politics,tarafının müzakere sürecinde görüşmelere katılmama kararı hk basın açıklaması
politics,genel sekreterinin ülkemizi ziyareti hk basın açıklaması
politics,gkrynin sondaj faaliyetleri hk basın açıklaması
politics,kurban bayramı vesilesiyle yurtdışında yaşayan vatandaşlarımıza yönelik kutlama mesajı
politics,türk dili konuşan ülkeler işbirliği günü hk basın açıklaması
politics,başkonsolosluğumuz personeliyle biraraya geldi ayrıntılar
politics,yaşanan gelişmeler hk basın açıklaması
politics,yasadışı yerleşim faaliyetleri hk basın açıklaması
politics,dışişleri bakanlığı  eylül  tarihinde açıklama hk basın açıklaması
politics,ilişkin güncel seyahat güvenlik duyurusu
politics,deki arabuluculuk dostlar grubu toplantısına eşbaşkanlık ayrıntılar
politics,işçilerimizin kısa sürede misurataya nakilleri sonrasında ülkemize ulaşmaları amacıyla türlü çalışma yürütülmektedir
politics,vatandaşlarımız misuratada konaklama sağlık kontrollerine ilişkin gerekli tertibat alınmıştır
politics,çerçevede havaalanında bulunan vatandaşlarımızın ghatdan misurataya nakillerine başlanmıştır
politics,işçinin ghata nakledilmesi üzerine bakanlığımız vatandaşlarımızın yurda dönüşleri müdahil olmuştur
politics,libyada faaliyet gösteren şirketlerimizden birinin şantiyesinin bulunduğu ubariden acil tahliye ihtiyacı doğması
politics,personelin tahliyesi gerekli telkinlerde bulunulmuştur
politics,libyadaki güvenlik durumu çerçevesinde mayıstan yana bakanlığımızca muhtelif güvenlik duyuruları yayımlanmış
politics,seyahat güvenlik duyurusu
politics,gazzeli yaralıların ülkemizde tedavisi hk basın açıklaması
politics,nün alman basınında çıkan haberler hakkındaki soruya cevabı
politics,nün uygur asıllı akademisyen ilham tohtinin müebbet hapis hükmü giymesi hkbir soruya cevabı
politics,temasları ayrıntılar
politics,nın ülkemizde hava savunma sistemi konuşlandırma yönünde aldığı karar hk basın açıklaması
politics,cumhurbaşkanı erdoğan  genel kurulunda dünya liderlerine hitap ayrıntılar
politics,terörizmle mücadele küresel forumu türkiye abdnin eşbaşkanlığında yorkta düzenlendi
politics,yorkta konulu dışişleri bakanları toplantısına katıldı ayrıntılar
politics,asya işbirliği diyaloğu bakanlar toplantısına katıldı ayrıntılar
politics,meydana gelen gelişmeler hk basın açıklaması
politics,cumhurbaşkanlığı seçim sonuçları hk basın açıklaması
politics,dışişleri devlet bakanıyla biraraya geldi ayrıntılar
politics,dışişleri bakanlığı müsteşarı sinirlioğlunun başkonsolosluğumuz personelinin kurtarılmasına ilişkin mesajı
politics,başkonsolosluğumuz personeli hk basın açıklaması
politics,dışişleri bakanlığı başkonsolosluğumuz personelinin yoğun çabalar sonucunda aramıza dönmelerinden büyük mutluluk duyuyoruz
politics,başta müsteşarımız hakan fidan ekibi arkadaşlarımızın serbest bırakılmasında emeği geçen herkese
politics,serbest bırakılan başkonsolosluk personelimizin ailelerinin dışişleri camiamızın milletimizin gözü aydın
politics,başkonsolos öztürk yılmaz eşi özay hanımla görüşerek geçmiş dilkelerimi ilettim
politics,musulda alıkonulan  personelimiz sabah özgürlüklerine kavuştular
politics,resmi ziyaret gerçekleştirdi
politics,nın abyle imzaladığı ortaklık anlaşmasının onaylanması hk basın açıklaması
politics,konulu güvenlik konseyi toplantısına katılımı hk basın açıklaması
politics,eylül  tarihinde yı ziyaret edecektir
politics,milli meclisine meclis üyelerinin evlerine saldırılar hk basın açıklaması
politics,nün  eylül  tarihinde gerçekleştirilen seçimlere tutumumuz hk soruya cevabı
politics,düzenlenen ın barışı güvenliği konulu konferansa katıldı
politics,rejimin kimyasal silah kullanımı hk basın açıklaması
politics,genel kurulu sırasında sınırlı sürede yapacağımız sayıdaki temasla etkin diplomasimizi sürdüreceğiz
politics,boyutlu diplomasimiz bölgelerdeki dış politika konularına ilgi göstermemizi gerektiriyor
politics,genel kurulu sırasında cumhurbaşkanımıza refakat sayıda toplantıya katılacağım
politics,doğu avrupa afrika kültür konuları  genel kurul programı hakkında bakanlık yetkililerinden bilgi aldım
politics,bakanlık birimlerinden dış politika konusunda bilgi almaya devam ediyorum
politics,türkiyeabd ortaklığı şimdiye önümüzdeki dönemde alanda devam
politics,ülkeyi ilgilendiren konuları detaylarıyla görüşme fırsatı bulduk
politics,bakanlık görevini üstlenmem sonrasında ülkemize gerçekleştirilen dışişleri bakanı düzeyindeki ziyaret açısı
politics,abdli mevkidaşım dostum kerryi dışişleri bakanlığında ağırladım
politics,arasında sürdürülmekte istikşafi temasların  turu  eylül  tarihinde selanikte gerçekleştirilecektir
politics,büyükelçiliği ataşesi mensubumuz arasında yaşanan olay hk basın açıklaması
politics,ayrıntılar
politics,sünün soruya cevabı
politics,ürdünde ayrıntılar
politics,meydana gelen saldırı hk basın açıklaması
politics,ateşkes ilanı hk basın açıklaması
politics,devlet hükümet başkanları zirvesi düzenlendi
politics,yaşanan terör saldırısı hk basın açıklaması
politics,yasadışı yerleşim faaliyetleri hk basın açıklaması
politics,ukrayna dışişleri bakanı fransa dışişleri bakanı araya geldim http
politics,dışişleri bakanı ikili görüşme gerçekleştirdim bölgesel gelişmeleri ele aldım
politics,natoukrayna konseyi isaf toplantılarında cumhurbaşkanımıza eşlik ettim
politics,cumhurbaşkanımızın fransa cumhurbaşkanı ispanya başbakanı görüşmelere katıldım
politics,zirvesi ingilterede bulunan cumhurbaşkanımıza refakat etmekteyim
politics,ın vilayetinde meydana gelen terör saldırıları hk basın açıklaması
politics,cumhurbaşkanı erdoğan
politics,batı şeriadaki yasadışı yerleşim faaliyetleri hk basın açıklaması
politics,meydana gelen terör saldırısı hk basın açıklaması
politics,anavatan garantör türkiye türk milletinin ayrılmaz parçasını teşkil kıbrıs türk halkının zama
politics,kktc dışişleri bakanı nami müzakereci özersaydan gelişmeler hakkında bilgi aldım
politics,cumhurbaşkanımız kktc cumhurbaşkanı derviş görüşmesi
politics,kıbrıs türk halkının varoluş davasının önderi küçük kurucu cumhurbaşkanı rauf denktaşın anıt mezarlarını ziyar
politics,cumhurbaşkanımız ercan havalimanında halkın coşkulu tezahüratıyla karşılandı
politics,yurtdışı ziyaretinde cumhurbaşkanımıza kktcde refakat ediyorum
politics,görüşmede türk tarafının kıbrıs sorununun çözümü yönündeki kararlı çabalarına türkiyenin desteğini teyi
politics,nün başkonsolosluğumuz personeli hk basında iddialara ilişkin soruya cevabı
politics,basınında yeralan ülkemize yönelik dinleme iddiaları hk basın açıklaması
politics,nün soruya cevabı
politics,bugün gelerek görevine başladı
politics,mensuplarına konuşması
politics,bugün mensuplarına
politics,yemene seyahat yemende bulunan vatandaşlarımıza yönelik güvenlik seyahat duyurusu  ağustos
politics,israil filistin arasında süresiz ateşkes ilan edilmesine ilişkin varılan mutabakat hk basın açıklaması
politics,sünün nın bataryalarını ülkemizde konuşlandırma sürecine ilişkin soruya cevabı
politics,irakın diyala vilayetinde musab umeyr camiine gerçekleştirilen saldırı hakkında basın açıklaması
politics,libyada devam çatışmalar hakkında basın açıklaması
politics,kandilli rasathanesi öğretim üyesi profdrnurcan meral özel ctbto uluslararası izleme sistemi direktörlüğüne seçildi
politics,başkonsolosluğumuz personelinin rehin alınması konusunda basında yeralan iddialar hk basın açıklaması
politics,bugünkü basında yeralan iddialar hk basın açıklaması
politics,nün almanya askeri uçağının incirliki kullanmasına izin verilmediği iddiası hk soruya cevabı
politics,arasında gerçekleştirilen ateşkes müzakerelerinin kesilmesi hk basın açıklaması
politics,nün basınında yayımlanan haberlere ilişkin soruya cevabı
politics,güney afrika devlet başkanının özel temsilcilerini kabul
politics,milasbodrum dalaman havalimanları sınır kapılarımızda evize girişlerde sorun yaşanmamaktadır
politics,dünya insani günü hakkında basın açıklaması
politics,dünya insani günü vesilesiyle dünya çapında fedakarca görev yaparken hayatını kaybeden insani yardım görevlilerini şükranla anıyoruz
politics,alman basınında yeralan ülkemize yönelik dinleme iddiaları hk basın açıklaması
politics,güncellenen seyahat güvenlik duyurusu metnine ulaşmak
politics,bulunan vatandaşlarımızdan yurda dönmek isteyenler  ağustosa başkonsolosluğumuza başvurabilirler
politics,temsilciler meclisi eski başkanı usame nuceyfiyle biraraya geldi
politics,belçikaya göçün nci yılı vesilesiyle brükselin tarihi meydanında  çiçekle türk halısı oluşturuldu htt
politics,yezidilerin ihtiyaçlarını gidermek türlü yardımı yapmaya hazırız
politics,konu adalet olduğunda etnik mezhebi fark gözetmeksizin herkese elimizi uzatırız
politics,dahile geçmiş dileklerimi ilettim türkiyenin tavrı insani konularda nettir
politics,sincar dağındaki helikopter kazasında yaralanan istanbulda tedavi gören milletvekili viyan dahille telefo
politics,seyahat güvenlik duyurusu
politics,gazzeden tedavi ülkemize getirilen filistinlileri hastanede ziyaret
politics,irak temsilciler meclisi eski başkanı usame nuceyfiyle ankarada biraraya geldi
politics,yaşanan gelişmeler hk basın açıklaması
politics,yoğun bakımda bulunan alissa acil şifalar diliyorum
politics,istanbulda tedavi altında ferguson telefonla görüşerek geçmiş dileklerimi ilettim
politics,iraktaki helikopter kazasında yaralanan muhabirleri alissa ferguson afadın koordinasyonuyla
politics,filistin başbakanı hamdallah türkiyenin gazzeye yönelik yardımları göstermiş işbirliği teşekkür
politics,ürdün dışişleri bakanları iit genel sekreteri görüşmelerde bulundum
politics,toplantı marjında filistin başbakanı kuveyt başbakan yardımcısı dışişleri bakanı suudi arabistan
politics,toplantıda gazzede yaşanan dramın israil zulmünün sona erdirilmesi  maddelik eylem planı öne
politics,gelişmeler  gazzede devam israil saldırıları başlığı altında ciddede toplandı
politics,işbirliği teşkilatı genişletilmiş icra komitesi girişimlerimiz sonucunda işgal altındaki filistin devleti topr
politics,genişletilmiş icra komitesi toplantısında konuşma ingilizce
politics,konulu genişletilmiş icra komitesi toplantısına katıldı
politics,yaşanan siyasi gelişmeler hk basın açıklaması
politics,vatandaşlarımıza zor süreçte metanet gösteren ailelerine geçmiş diliyorum
politics,vatandaşlarımızı kısa sürede ülkemize getirerek ailelerine kavuşturmak çalışıyoruz
politics,vatandaşımızla başkonsolosumuzca alınmaları akabinde konuştumsağlık durumları iyiaileleriyle
politics,kendileri trablusa  mesafede tarhuna kentinde dün serbest kaldıaz humusta misruata başkonsolosumuz tarafı
politics,adlı vatandaşımız trablus havalimanı yakınlarında tarihlerden yana alıkonulmuşlardı
politics,haziranda kaçırılan nazım süpürgeci emrah bahçeci  hazirandan kendisinden haber alınamayan necip
politics,gazze gündemiyle ciddede düzenlenmekte iit icra komitesi toplantısına iştirak
politics,ateşkes ilan hk basın açıklaması
politics,başbakanı nuri malikinin açıklamaları hk basın açıklaması
politics,mümkün fazla sayıda filistinli yaralıyı türkiyeye getirmeyi planlıyoruz
politics,çabalarımızla gazzede tesis edilen ateşkesin kalıcı gelmesi temaslarımızı sürdürüyoruz
politics,uçaklarımızla kuracağımız hava köprüsüyle sayıda filistinli kardeşimizi türkiyede tedavi etmek haz
politics,gazzedeki insanlık dramında yaralanan  filistinli kardeşimizi ankarada karşıladık
politics,ateşkesin tesisi insani yardımlar konusunda yoğun çaba içindeyiz
politics,dışişleri bakanı  katarlı muhatabım hamas lideri halit meşal gazzedeki
politics,bakan yardımcısı türkpa heyetiyle biraraya geldi
politics,siyasi istişareleri ankarada gerçekleştirildi
politics,arasındaki siyasi istişareler hk basın açıklaması
politics,meclis başkanı turanı kabul
politics,insani yardım konularının dışında kalıcı ateşkes sürecini değerlendirdik
politics,gazzede ihtiyaçların tespiti yardımların koordinasyonu filistin devlet başkanı mahmut telefon
politics,gazzede yürürlüğe giren ateşkes sonrası filistinli kardeşlerimize yardım kurumlarımız çalışıyor
politics,özel temsilcisi mıtriyi kabul
politics,sahadaki ekiplerimiz gazzenin imar hayatın normalleşmesi türlü çabayı gösteriyorlar
politics,meşal insani yardımlar konusunda görüş alışverişinde bulunduk
politics,ramazan ayı bayram süresince büyük acılar çeken gazze halkının yaralarının sarılması aciliyet arz
politics,görüştüğüm hamas lideri halit meşalin verdiği bilgiler ateşkesin uygulanmakta teyit
politics,gazzede akamete uğrayan  saatlik ateşkesin sağlanabilmiş olmasından memnuniyet duyuyoruz
politics,saat süreyle ateşkes ilan hkbasın açıklaması
politics,salgını hakkında uyarı
politics,dünyanın yanında seçim heyecanı
politics,deki okuluna saldırısı hk basın açıklaması
politics,dışişleri bakanı attiyah görüştü
politics,halk cumhuriyetinin özerk bölgesinde meydana gelen olaylar hk basın açıklaması
politics,temas hattında meydana gelen olaylar hk basın açıklaması
politics,dışişleri bakanının ülkemize gerçekleştireceği çalışma ziyareti hk basın açıklaması
politics,seyahat güvenlik duyurusu
politics,soydaşlarımızın bekası huzuru nin önceliklerinden biridir
politics,dışişleri bakanlığı müsteşarı sinirlioğlu erşad salihiyle görüştü
politics,dışişleri bakanlarının gazzede insani ateşkese yönelik girişime ilişkin ortak açıklaması
politics,türkiye dışişleri bakanlarının gazzede insani ateşkese yönelik girişime ilişkin ortak açıklaması
politics,büyük oranda tahrip gazzenin imarı yaraların sarılması önemli önceliklerimiz arasın
politics,ateşkesin sürekli kanın durması çalışmaya devam edeceğiz
politics,süreçte yoğun çaba sarfeden  meşale teşekkür ediyorum
politics,gece meşal telekonferansta detayları gözden geçirdik
politics,ateşkes öncesi sayıda ikili telekonferans ortak görüşmeler gerçekleşti
politics,gündür yoğunlaşarak süren ateşkes çabalarımız sonuca ulaştı gazzede taraflar  saatlik ateşk
politics,daki gelişmeler hk basın açıklaması
politics,yönelik saldırıları hk basın açıklaması
politics,yönden gazzedeki kriz ortamını rahatlatmak çalışıyoruz
politics,bölgede  ilacı gazzeye ulaştıran kızılay başkanımız görüşerek gazzedeki ihtiyaçlar konus
politics,ingiltere dışişleri bakanı phillip hammond gün boyu görüşmeler gerçekleştirdik
politics,başta filistin devlet başkanı mahmut iit gnl skr iyat medeni
politics,gazzede geçen gün büyüyen acıyı dindirmek çaba göstermeye devam ediyoruz
politics,türkü hastaların tedavilerinini ülkemizce üstlenilmesi hakkında basın açıklaması
politics,ricamızı kırmayan türkmenistan devlet başkanı gurbangulu berdimuhammedova vatandaşlarımızın aileleri adına içte
politics,türkmenistan devlet başkanı berdimuhamedovun kadir gecesi vesilesiyle affettiği hükümlü vatandaşımız bugün
politics,saat içinde başta  halit meşal onlarca görüşme gerçekleştird
politics,gazzedeki kırılgan ateşkesi kalıcı getirmek gazze halkının sakin bayram geçirmesi sürekli diplo
politics,bayramın aziz milletimize alemine dünyaya rahmet getirmesini temenni ediyorum
politics,bayram soframızdaki yerleri boş musuldaki konsolosluk çalışanlarımızı ailelerine kavuşturmak çabalarımı
politics,huzur içinde geçireceğimiz bayramlara ulaşmayı yüce rabbimden niyaz ediyorum
politics,bayram günlerinin başta gazze coğrafyasının acılarla yoğrulduğu zamanda kardeşlik bilincimizi
politics,uluslararası toplum filistinin niyetli tutumuna israil gerekli karşılığı vermeli insanlık dışı saldırıla
politics,amacımız gazzedeki masumların gözyaşının dinmesi bölgede huzuru tesis etmek
politics,günün paristeki büyükelçilik konutumuzda biraraya geldik
politics,pariste gün boyu gazzede sürdürülebilir ateşkes sayıda görüşme gerçekleştirdik
politics,türkiye kalıcı ateşkes çalışmaya devam
politics,görüşmeleri kapsamında attiyah biraraya geldiler
politics,dışişleri bakanlarının malezya havayollarına sefer sayılı uçağın düşürülmesine hk ortak açıklaması
politics,pariste dışişleri bakanı kerryle biraraya geldi gündem kalıcı ateşkesin sağlanması
politics,dışişleri bakanı attiyahın deki geçici ateşkes çağrısına ilişkin ortak açıklaması
politics,saatlik ateşkes sürecinde gazze halkına insani yardım konusundaki faaliyetlerimizi hızlandırıyoruz
politics,amerikalı muhatabım meslektaşlarımla gazzede kanı durdurmak temaslarda bulunacağım
politics,şimdi mevcut ateşkesi sürdürülebilir getirebilmek paristeyim
politics,sağlam ateşkesi konuşuyor olacaktıkisrailin tutumu barış çabalarında samimiyetsiz
politics,dün gün katarda filistinli taraflarla yaptığımız görüşmeler sonucunda ulaştığımız ortak metne israil dese
politics,gazzede süren insanlık dramında ortak çabalarımızla geçici karşılıklı ateşkes kararına varılmış olmasından
politics,dışişleri bakanı attiyahın deki geçici ateşkes çağrısına ilişkin ortak açıklaması
politics,misurata başkonsolosluğumuz faaliyetlerini sürdürmektedir ayrıntılar
politics,vatandaşlarımıza ilişkin düzenlemelerin yapılmasının ardından trablus büyükelçiliğimiz faaliyetlerini geçici askıya almıştır
politics,libyadaki fazla vatandaşımız tunusun djerba kentine sevk edilerek yurda dönmeleri sağlandı
politics,tahliyesi hk basın açıklaması
politics,düşen havayollarına yolcu uçağı hk basın açıklaması
politics,kriz masası basın açıklaması
politics,amacımız filistinli kardeşlerimize karşı işlenen acımasız saldırıların durmasını etmek
politics,gelinen aşamayı filistinli taraflarla ele alacağız
politics,kahirede ateşkes yoğun çaba sergileyen dışişleri bakanı gece boyu süren temaslarımızda
politics,gazzede kanın durması bizimle büyük gayret sarfeden katarlı dostlarımızla detaylı görüşmeler gerçe
politics,evlilik gidecek vatandaşlarımızdan bilgisi istenmesi uygulaması hk basın açıklaması
politics,insan hakları konseyinin filistindeki insan hakları ihlallerinin araştırılmasına kararı hk basın açıklaması
politics,ülkemiz filistine sağlayan yardımlar hakkında basın açıklaması
politics,temmuz  tarihinde resmi ziyaret gerçekleştirecektir
politics,ayrılmak isteyen vatandaşlarımızın  temmuz saat trablus büyükelçiliğimizle temas etmeleri gerekmektedir
politics,yaşayan vatandaşlarımız seyahat güvenlik duyurusu  temmuz
politics,israili gazzedeki insanlık dışı saldırılarına vermeye çağırıyoruz
politics,israilin gazzedeki cinayetlerine yönelik inceleme başlatılmalı sonucu uluslararası kamuoyu paylaş
politics,türkiyenin girişimiyle başlayan sürecin aynı kararlılıkla takipçisi olacağız
politics,cenevre birleşmiş milletler insan hakları konseyinin israilin gazzedeki savaş suçlarını inceleme kararı almasından
politics,libyadan ayrılmak isteyen vatandaşlarımızın  temmuz saat trablus büyükelçiliğimizle temas etmeleri gerekmektedir
politics,libyada yaşayan vatandaşlarımız seyahat güvenlik duyurusu  temmuz
politics,seyahat güvenlik duyurusu
politics,türkiye portekizce konuşan ülkeler topluluğuna ortak gözlemci kabul edildi ayrıntılar
politics,ulusal koalisyonu başkanı hadi bahrayla görüştü deki ele alındı
politics,kriz masası basın açıklaması  temmuz
politics,şeridindeki vatandaşlarımıza ilişkin duyuru
politics,halkıyla dayanışma içinde
politics,nün israille enerji savunma alanlarında işbirliği yapıldığı iddiaları hk soruya cevabı
politics,bakan yardımcısı göç özel temsilcisi sutherland görüştü
politics,kriz masasi açiklamasi  temmuz
politics,nin şecaiye mahallesine saldırısı hk basın açıklaması
politics,norveç dışişleri bakanı görüşerek gazzedeki gelişmeler ateşkes sağlanması yönündeki çab
politics,meydana gelen saldırı hk basın açıklaması
politics,dışişleri bakanlığı sözcüsünün kürecik üssüne ilişkin basında haberler hakkındaki soruya cevabı
politics,hava sahasında düşürülen havayolları uçağı hk basın açıklaması
politics,türkiyecaricom istişare işbirliği mekanizması birinci toplantısı sona erdi
politics,kriz masasi açiklamasi  temmuz
politics,güvenilir ortağıdır olmaya devam edecektir
politics,israilin gazzeye yönelik saldırısı hk basın açıklaması
politics,sessiz kalsa türkiye baskı zulme karşı sessiz kalmayacak
politics,dünyası bölge ülkelerinin aralarındaki ihtilafların bedelini filistinliler ödüyor
politics,kalıcı barışın önünü açacak şekilde kalıcı ateşkesin sağlanması gerekmektedir
politics,israilin kara hava operasyonları durdurulmalıdır konuda uluslararası toplumu harekete geçirmeye kararlıyız
politics,karayiplerdeki büyükelçiliklerimizin sayısı kosta rika tobagoda açılacak belerle  ulaşacak
politics,türkiyecaricom işbirliği süreklilik karşılıklı saygı dostluk yarar temelinde yakın gelecekte giderek artacak
politics,türkiye caricomun güvenilir ortağıdır olmaya devam edecektir
politics,istanbulda türkiyecaricom istişareampişbirliği mekanizması dibları toplantısına hitap
politics,hamas fetih yetkilileri temaslarımız sürüyor
politics,dönemde yoğun diyalog içinde olduğumuz dışişleri bakanı muhammed alattiyah tekrar görü
politics,kuruluş sebebi kudüs iitnin harekete geçmesi yönünde istişarede bulunduk
politics,ardından işbirliği teşkilatı genel sekreteri iyad medeni konuştum
