politics,daki görev süresini tamamlayan yunanistan büyükelçisi loukakisi kabul ettik
politics,kei yıldönümü zirvesi öncesi  mayısta kıdemli memurlar  mayısta dışişleri bakanları toplantıları gerçekleştirilecek
politics,karadeniz ekonomik işbirliği örgütükei  kuruluş yıldönümü zirvesine evsahipliği mayıs
politics,ülkemizin evsahipliğinde düzenlenen dünya insani zirvesinin birinci yıldönümü çalıştay vesilesiyle kutlandı
politics,nin küresel yardım tecrübelerinin aktarıldığı çalıştaya  yabancı hükümetler ngolardan temsi
politics,yarın sürecek çalıştayda insani yardım kalkınma aktörleri arasında etkin koordinasyon yöntemleri
politics,çalışma yöntemi nwow çalıştayı bakanlığımızın evsahipliğinde bugün düzenlenen üst düzey panelle
politics,dışişleri bakan yardımcısı büyükelçi yıldız
politics,bakanlığı dünya insani zirvesi yıl dönümü etkinliği dışişleri bakan yardımcısı büyükelçi ahmet yıldızın konuşmas
politics,dışişleri sözcüsünün çerkes kırım sürgünlerinin yıldönümleri hakkında soruya cevabı
politics,toplantıda mikta ülkelerinin göç mülteciler konusundaki yaklaşımları küresel mutabakatlara katkıları ele
politics,türkevi binası projesi hk
politics,milyonlarca suriyeli kardeşine kucak açan türkiye etkin müdahale sahraaltı afrikada örnek olmaya devam
politics,dizin sonucu nwow girişimine aktif destek veren türkiye  mayıs daki çalıştaya evsahipliği
politics,türkiyenin kalkınma odaklı insani yardım anlayışı artık insani toplumun gündeminde çalışma yöntemi nwow
politics,tarihteki insani zirvenin evsahibi türkiye muhtaçlara yardım çalışmalarını kesintisiz sürdürüyor
politics,cumhurbaşkanımız nin önde gelen şirketlerinin ceoları yöneticileriyle ekonomikticariyatırım
politics,cumhurbaşkanımız kanaat önderleriyle buluştu  mak
politics,görüşmelerin tamamlanmasının ardından beyaz saraydan ayrıldık başkanı cumhurbaşkanımızı arac
politics,ikili ilişkileri bölgesel konulardaki değerlendirmelere çalışma yemeğinde devam edildi
politics,cumhurbaşkanımız ın ziyaretinde vatandaşlarımızın coşku heyecanı caddelerinde yankıl
politics,cumhurbaşkanımız  washingtonı ziyaretinde beyaz saray şeref defterini imzaladı
politics,beyaz saraydaki ikili görüşmenin ardından cumhurbaşkanımız başkanı ortak basın toplantı
politics,cumhurbaşkanımız başkanı arasındaki görüşmede gündemdeki ikili bölgesel meseleler ele
politics,dünya insani zirvesi sonrası dönemde insani yardım kalkınma aktörleri müdahale çalışma yönte
politics,katılımcılar insani yardımlar kalkınma faaliyetlerinin krizlere etkin müdahale koordine edileceğini ele alac
politics,kuruluşları hükümetler temsilcileri  mayıs  tarihinde nwow çalıştayında buluşuyor
politics,dünya insani zirvesi sonrası dönemde insani yardım kalkınma aktörleri müdahale çalışma yöntemlerini ele alıyor
politics,göç mülteciler konulu mikta özel toplantısı  mayıs  tarihinde istanbulda gerçekleştirilecek
politics,makalemizin türkçesini bağlantıya tıklayarak okuyabilirsiniz
politics,katılımcılar insani yardımlar kalkınma faaliyetlerinin krizlere etkin müdahale koordine edileceğini ele alacak
politics,kuruluşları hükümetler temsilcileri  mayıs  tarihinde nwow çalıştayında buluşuyor
politics,fetönün abdden iadesi talebimiz hakkında policyde yayınlanan makalemiz
politics,demokratik halk cumhuriyetinin  mayıs  tarihinde gerçekleştirdiği balistik füze fırlatımı hk
politics,türkiyenin kalkınma odaklı insani yardım anlayışı küresel insani topluma rehberlik
politics,dünya insani zirvesi sonuçlarından çalışma yöntemi girişimi ilerliyor dışişleri bakanlığı nwow çalıştayının  mayısta evsahibi
politics,ülkemizde  saniyede  ünite ihtiyaç duyuluyor hayat kurtar yardımseven
politics,küresel insani toplum dünya insani zirvesinin takibi sürecinde  mayıs istanbulda tekrar buluşuyor
politics,sudanda ulusal mutabakat hükümeti kurulması hk
politics,cumhurbaşkanımız sırbistan başbakanı  seçilmiş cumhurbaşkanı aleksandar vuçiçle ikili bölgesel konula
politics,arasında karşılıklı kültür merkezleri kurulmasına anlaşmayı imzaladık
politics,cumhurbaşkanımız çin devlet başkanı jinpingle  işbirliğiampgüncel bölgeseluluslararası
politics,cumhurbaşkanımız macaristan başbakanı orban  ilişkilerini bölgesel
politics,cumhurbaşkanımız ın başbakanı navaz şerifi kabulünde ikili bölgesel işbirliği konuları ele
politics,cumhurbaşkanımız kuşak yol forumuna katılmak bulunduğu çinde başbakanı çiprası
politics,pakistanda meydana gelen terör saldırısı hk
politics,bakanlığımız diplomasi akademisinin düzenlediği eğitim programlarının haftaki konukları çadlı diplomatlardı
politics,büyükelçi mahmoodun ziyaretinde  dostluk bağlarının güçlendirilmesine katkılarından ö
politics,ulusal koalisyonu başkanlığına seçilen riad heyetini kabulümüzde suriyede mevcut durumu önümüzdek
politics,fetö bağlantılı eski askeri personelin iltica başvurularının almanya kabul hk
politics,dışişleri bakanı kamara diplomatik pasaport hamilleri vizelerin karşılıklı kaldırılmasına
politics,sözcü müftüoğlunun gazetesinde yayımlanan makalede ifadeler hk soruya cevabı
politics,cumhurbaşkanı vujanovicle görüşmemizde ın üyeliğine avrupaatlantik kurumlarıyla bütünleşmesine
politics,başkanı brajovicle görüşmemizde ülke parlamentoları arasındaki ilişkileri geliştirme
politics,ortak basın toplantısında dışişleri bakanı darmanovic medyanın güncel konulara ilişkin sorularını yanıtla
politics,dışişleri bakanı darmanovic ikili bölgesel konulardaki değerlendirmelerimize heyetlerarası görüşmede
politics,dışişleri bakanı darmanovic ülke ilişkilerinin yanı sıra bölgesel işbirliği konularını değerlendirdik
politics,cumhurbaşkanımız kuveyt emiri şeyh elsabah  ilişkileriyle bölgesel uluslararası
politics,havalimanı yolcu terminali inşası türk firmasının başına yurtdışında üstlendiği büyük iha
politics,dışişleri bakanı mevlüt çavuşoğlunun  mayıs avrupa günü münasebetiyle yayımladıkları mesaj
politics,cumhurbaşkanımız erdogan emiri elsabah kuveyt havalimanı terminalinin temel
politics,emiri şeyh sabah elahmed elcabir elsabah cumhurbaşkanımız ı resmi törenle karşıladı
politics,sözcü müftüoğlunun  martta isviçrede düzenlenen gösteriye ilişkin idari soruşturma kararı hk soruya cevabı
politics,bakanımızın karadağ ziyareti hk
politics,dönem başkanı olduğumuz nın meksikaendonezyagüney koretürkiyeavustralya kıdemli memurları  mayısta
politics,bakan yardımcımız büyükelçi ahmet yıldızın moğolistan ziyareti hk
politics,kişinev büyükelçiliğimiz kançılarya binasının resmi açılışı başbakanımız gerçekleştirildi
politics,başbakanımız ın ziyaretinde imzalanan anlaşmalar  arasındaki işbirliğini güçle
politics,heyetlerarası görüşmede  ilişkileri güncel konular ele alındı
politics,başbakanımız moldova başbakanı pavel filip görüşmesinde  ilişkileri bölgesel
politics,başbakanımız resmi törenle karşılandıprime officia
politics,deik düzenlenen toplantıda başbakanımız işadamlarıyla biraraya geldi
politics,asala mensubu teröristlerce abdde şehit edilen  fahri başkonsolos orhan gündüzü saygı rahmetle anıyoruz
politics,yunanistan iadesi reddedilen darbe girişimcisi hk
politics,suriyede çatışmasızlık bölgelerinin oluşturulmasına muhtıranın imzalanması hk
politics,iranın gülistan eyaletinde meydana gelen maden kazası hk
politics,kabilde konvoyuna düzenlenen terör saldırısı hk
politics,cumhurbaşkanımız putinin görüşmesinde  ilişkileri bölgesel uluslararası konular
politics,cumhurbaşkanımız  çalışma ziyareti bulunduğu devlet başkanı vladimir putin karşı
politics,diplomasi akademileri arasında işbirliğine ilişkin mutabakat zaptını imzaladık
politics,türkiyehindistan zirvesi cumhurbaşkanımız hindistan başbakanı modinin katılımıyla yapıldı
politics,cumhurbaşkanımız ziyaretinde cumhurbaşkanı mukherjee resmi törenle karşılandı
politics,cumhurbaşkanımız ın şirketlerin ceolarıyla toplantıya katıldık
politics,kırgızistanın güneyinde meydana gelen heyelan hk
politics,almanya dışişleri bakanı sigmar türkiyealmanya ilişkileri konularını ele aldık
politics,yüksek temsilci mogherini görüşmemizin gündeminde türkiyeab ilişkileri abnin politikaları
politics,dışişleri bakanları toplantısında politikaları türkiyeab ilişkileri konusunda gereken mesajları verdik http
politics,dışişleri bakanları resmi toplantısı öncesi dışişleri bakanı vella yüksek temsilci mogheri
politics,avrupa komşuluk politikası genişleme müzakerelerinden sorumlu komiseri hahn türkiyeab ilişkilerini
politics,güncel gelişmelerin ele alınacağı dışişleri bakanları resmi toplantısına katılmak maltanın
politics,mustafa ipteşin uluslararası hidrografi örgütü iho direktörü seçilmesi hk
politics,makedonyadaki gelişmeler hk
politics,asala mensubu teröristlerce tahranda şehit edilen büyükelçilik personeli şadiye yönderin eşi işık yönderi
politics,görev süresi sona eren nijerin büyükelçisi maradiyi kabulümüzdeiki ülke ilişkilerine katkılarından ötürü
politics,dışişleri uluslararası işbirliği bakanı yusuf garaad omar somaliye alanda süren desteğimizi ele
politics,mızın ev sahipliği türkiyeafrika tarım bakanları toplantısı tarım forumu fotoğrafı
politics,antalyada düzenlenen türkiyeafrika tarım bakanları toplantısı tarım forumunda afrika ülkeleriyle yakın ilişk
politics,bakanımızın dışişleri bakanları gayriresmi toplantısına katılımı hk
politics,çek cumtemsilciler mec alınan  olaylarına karar cmbşk zemanın aynı konudaki ifadeleri hk
politics,dışişleri bakanlığı sözcüsü müftüoğlunun yunanistan dışişleri bakanlığının açıklaması hakkında soruya cevabı
politics,özbekistan kamilov senato birinci bşkyrdsafayevle ikili bölgesel konulardaki değerlendirmelerimize çalışma
politics,sözcü müftüoğlunun dışişleri bakanlığı sözcü yardımcısının ifadeleri hk soruya cevabı
politics,özbekistan ziyaretimiz gündem hakkında basının sorularını yanıtladık
politics,cumhurbaşkanı mirziyoyev kabulümüzde özbekistanla ilişkilerimizi geliştirme hususunu ele aldık http
politics,taşkentteki temaslarımıza özbekistan senatosu başkanı birinci yardımcısı sadık safayev görüşmemizle devam ettik
politics,özbekistan dışişleri bakanı kamilovla ortak basın toplantısında taşkentteki temaslarımız hakkında basını bilgilendi
politics,türkiyeözbekistan dışişleri bakanlıkları arasındaki temasları güçlendirmek mevkidaşım kamilovla işbirliği
politics,özbekistan dışişleri bakanı kamilov türkiyeözbekistan ilişkileri bölgesel konularda görüş alışverişinde bulund
politics,yunanistanda türk bayrağı yakılması hk
politics,hindistanın chhattisgarh eyaletinde düzenlenen terör saldırısı hk
politics,ülkemizin akpm denetimine döndürülmesi kararı hk
politics,dışişleri bakanı althani ikili işbirliğimiz bölgesel gelişmeler hakkında kapsamlı görüşme yaptık
politics,doha ziyaretimiz sırasında yardımcısı abdullah hamad althani kabul edildik
politics,pakistanın kurram şehrinde gerçekleştirilen terör saldırısı hk
politics,ikili bölgesel uluslararası konularda temaslarda bulunmak katarın başkenti dohaya geldik
politics,başkanı trumpın  olaylarına ilişkin açıklaması hk
politics,ermenistanda türk bayrağı yakılması hk
politics,bakanımızın ziyareti hk
politics,suriye muhalefeti müzakere yüksek kurulu genel koordinatörü hicab suriyedeki durumu önümüzdeki dönemi ele aldı
politics,cumhurbaşkanımızın ermeni patrikhanesinde   tarihinde düzenlenen dini törene gönderdikleri mesaj
politics,irakta kaçırılan vatandaşlarının serbest bırakılması hk
politics,ulusal egemenlik çocuk bayramı coşkusu dış temsilciliklerimizce düzenlenen etkinliklerle dünyanın
politics,ulusal egemenlik çocuk bayramı coşkusu dış temsilciliklerimizce düzenlenen etkinliklerle dünyanın
politics,ulusal egemenlik çocuk bayramı coşkusu dış temsilciliklerimizce düzenlenen etkinliklerle dünyanın
politics,ulusal egemenlik çocuk bayramı coşkusu dış temsilciliklerimizce düzenlenen etkinliklerle dünyanın
politics,ukrayna özel gözlem misyonuna devriye aracının mayına çarpması hk
politics,bakanımızın   tarihlerinde özbekistanı ziyareti hk
politics,afganistanda meydana gelen terör saldırısı hk
politics,cumhurbaşkanımız orta amerika entegrasyon sistemi amerika karayipler topluluğu dörtlüsü bakanla
politics,türkiyeguyana dışişleri bakanlıkları arasında siyasi istişare mekanizması kurulmasına ilişkin mutabakat zaptını imzal
politics,salvadordominik cumekvatorguyanadan dostlarımızla türkiyelamerikaampkarayipler topluluğu celac dörtlüsü topl
politics,pariste düzenlenen terör saldırısı hk
politics,türkiyecelac dörtlüsü dışişleri bakanları toplantısında bölgesel uluslararası konularda kapsamlı değerlendirmelerd
politics,türkiyelatin amerika karayipler topluluğu celac dörtlüsü dışişleri bakanları toplantısını bugün istanbulda düze
politics,orta amerika entegrasyon sistemi amerika karayipler topluluğu dörtlüsü heyetlerini istanbulda resmi yemekt
politics,belize dışişleri bakanı elrington görüşmemizde türkiyebelize ilişkilerini ele aldık
politics,dışişleri bakanı bonilla siyasi ekonomik ilişkileri değerlendirdik
politics,kosta rika dışişleri bakanı sanzla uyuşturucu maddelerin uluslararası kaçakçılığına karşı mücadelede işbirliği anlaşm
politics,dışişleri bakanı agüero lara ikili bölgesel konularda görüş alışverişinde bulunduk http
politics,nikaragua devlet bakanı cumhurbaşkanının uluslararası ilişkiler danışmanı arauz türkiye nikaragua ilişkilerini
politics,dışişleri bakan yardımcısı luisa navarro ikili görüşmemizde türkiyepanama ilişkileri bölgesel gelişmel
politics,istanbulda türkiyeorta amerika entegrasyon sistemi forumunda ilişkilerimizi ilerletecek anlaşm
politics,türkiyeorta amerika entegrasyon sistemi dışişleri bakanları forumu ortak basın toplantısında gündeme ilişkin soruları
politics,türkiyeorta amerika entegrasyon sistemi dışişleri bakanları forumu fotoğrafı turkeysica foreig
politics,türkiyesica dışişleri bakanları forumu açılış oturumunda ülkemiz orta amerika ülkeleri arasında işbirliği
politics,türkiyesica iidışişleri bakanları forumuna dominik cumkosta rikael salvadorhondurasbelizenikaraguaamp
politics,türkiyeorta amerika entegrasyon sistemi sica dışişleri bakanları forumu istanbulda düzenleniyor
politics,ankaradaki büyükelçiliklerin sayısı artmaya devam büyükelçiliğinin açılışını mevkidaşım moralesle
politics,dışişleri bakanı ankarada ortak basın toplantısı düzenleyerek medyanın sorularını yanıtlad
politics,bugün imzaladığımız türkiyeguatemala hava ulaştırma anlaşması uzak coğrafyalardaki ülke yakınlaşaca
politics,dışişleri bakanı heyetiyle yaptığımız görüşmenin gündemini ülke ilişkileri güncel gelişmel
politics,guatemaladan ülkemize dışişleri bakanı düzeyinde resmi ziyarette mevkidaşım ikili bölgesel konula
politics,dominik cumhuriyeti dışişleri bakanı vargasla ortak basın toplantımızda medyanın gündeme ilişkin sorularını yanıtlad
politics,türkiyedominik cumhuriyeti dışişleri bakanlıkları arasında imzalanan niyet beyanı bakanlıklarımız arası işbirliği
politics,mevkidaşım vargasla türkiyedominik cumhuriyeti ilişkilerigüncel konular üzerindeki görüşmemize heyet üyelerimizle
politics,dominik cumhuriyetinden ülkemize dışişleri bakanı düzeyinde resmi ziyarette vargasla ikili ilişkilerbölgesel
politics,avrupa konseyi parlamenter meclisi eş raportörü ingebjorg godskesen akpm avrupa konseyi gündemindeki güncel
politics,dışişleri bakan yardımcısı büyükelçi ahmet yıldızın kosova makedonyayı ziyareti hk
politics,türkiyesica dışişleri bakanları toplantısı türkiyecelac dörtlüsü dışişleri bakanları toplantısı hk
politics,dominik cumhuriyeti dışişleri bakanı miguel vargas maldonadonun ülkemizi ziyareti hk
politics,dışişleri bakanı carlos raul moralesin ülkemizi ziyareti hk
politics,insan hakları ofisinin akpm gözlem heyetiyle halkoylamasına yönelik gözlem faaliyetleri hk
politics,halepin raşidin bölgesinde meydana gelen bombalı saldırı hk
politics,iranın kuzeybatısında meydana gelen felaketi hk
politics,sözcü müftüoğlunun grup raportörü ülkemiz hk halkoylaması öncesinde yayınlanan açıklama hk
politics,yurtdışında verme işleminin ardından pusulaları bugün  ülkemize getirildi teslim
politics,bakan yardımcımızın türkiyebelarus diplomatik ilişkilerinin tesisinin yıldönümü vesilesiyle belarusa ziyareti
politics,bakanımızın italyanın lucca şehrinde suriye konusunda düzenlenecek toplantıya katılımı hk
politics,somalide meydana gelen terör saldırısı hk
politics,mısırda meydana gelen terör saldırısı hk
politics,stokholmde   tarihinde meydana gelen terör saldırısı hk
politics,abdnin şayrat askeri üssüne operasyon hk
politics,gambiyada gerçekleştirilen seçimleri hk
politics,gkrynin hidrokarbon şirketleriyle keşif üretim sözleşmeleri imzalaması hk
politics,dışişleri bakanı çavuşoğlu anadolu ajansı sorumluluk üstlenmiş haber ajansıdır
politics,somalide meydana gelen terör saldırısı hk
politics,demokratik halk cumhuriyetinin   tarihinde gerçekleştirdiği balistik füze fırlatımı hk
politics,sözcü müftüoğlunun şeyhundaki kimyasal saldırılü ateşkes izleme mekanizması sorumlulukları hk soruya cevabı
politics,anayasa değişikliği halkoylaması hollanda kktcde verme işlemi yarın  başlıyor
politics,suriye rejiminin idlip vilayetine bağlı şeyhunda gerçekleştirdiği kimyasal saldırı hk
politics,kerkük meclisinin   tarihli kararı hk
politics,uluslararası genç diplomatlar eğitim programı başladı bakanlığımız diplomasi akademisi  ülkeden genç
politics,petersburgda meydana gelen terör saldırısı hk
politics,kolombiyada meydana gelen heyelan hk
politics,türkiye afganistan arasında gerçekleştirilecek siyasi istişareler hk
politics,anayasa değişikliği halkoylaması ülkelerdeki temsilciliklerimizde devam
politics,dışişleri bakanları fotoğrafı  fms
politics,dışişleri bakanları toplantısında terörizmle mücadele transatlantik bağ stratejik konuları ele aldık
politics,pakistanın paraçinar şehrinde gerçekleştirilen terör saldırısı hakkında basın açıklaması
politics,israil hükümetinin yasadışı yerleşim oluşturulmasını kararlaştırması hakkında basın açıklaması
politics,dışişleri bakanlığı müsteşarı shannonın ülkemizi ziyareti hakkında basın açıklaması
politics,ortak basın toplantısında dışişleri bakanı tillerson türkiyeyi ziyaretine gündeme ilişkin soruları yanıtla
politics,mevkidaşım tillersonla güncel konuları değerlendirdik
politics,dışişleri bakanı tillersonla türkiyeabd ilişkileri güncel bölgeseluluslararası konuları ankarada kapsamlı
politics,cumhurbaşkanımız ın dışişleri bakanı tillersonı kabulünde ikili bölgesel konular ele alındı
politics,ülkemize ziyaretini gerçekleştiren dışişleri bakanı tillerson başbakanımız kabul edildi http
politics,nikahtan sandığa koşan çift dışındaki vatandaşlarımızın anayasa değişikliği halkoylamasına katılımında
politics,dışişleri bakanı tillersonın ülkemizi ziyareti hakkında basın açıklaması
politics,lüksemburg anayasa değişikliği halkoylaması verme işlemi yarın  büyükelçiliğimizde başlıyor
politics,almanyaavusturyabelçikadanimarkafransaisviçredeki temsilciliklerimizde gümrük kapılarında verme süreci
politics,kerkük meclisinde kabul edilen karar hakkında basın açıklaması
politics,ülkelerdeki temsilciliklerimizde bugün  başlamış anayasa değişikliği halkoylamasından görüntül
politics,yurtdışı seçmen kaydınızı  adresinden kontrol edebilirsiniz
politics,dış temsilciliklerimizde tarihlerde adreslerde sandık kurulacağını  adresinde
politics,anayasa değişikliği halkoylaması almanyaavusturyabelçikadanimarkafransaisviçredeki temsilciliklerimizde yarın
politics,isviçrenin başkenti bernde bugün  düzenlenen gösteri hakkında basın açıklaması
politics,türkiye azerbaycan arasında gerçekleştirilecek siyasi istişareler hakkında basın açıklaması
politics,tuzhurmatuda deaş saldırısı hakkında basın açıklaması
politics,filistinle yapılacak siyasi istişareler hakkında basın açıklaması
politics,gkry lideri anastasiadisin abdde hidrokarbon şirketiyle temasları hakkındaki soruya cevabım
politics,bakanımızın isviçre ziyareti hakkında basın açıklaması
politics,viyana büyükelçiliğimizi hedef eylem hakkında soruya cevabım
politics,norveçin fetö mensubu eski subaylara iltica hakkı tanıması hakkındaki soruya cevabım
politics,londrada   tarihinde meydana gelen terör saldırıları hk
politics,vaşingtondaki deaşla mücadele küresel koalisyonu dışişleri bakanları toplantısında ülkemizin mücadeleye katkılar
politics,yunanistanın dimetoka şehrindeki çelebi mehmet camiinin  martta çıkan yangında ağır hasar görmesi hk
politics,organizationın etkinliğindeki hitabımızda stratejik ortaklığımızın geleceğini ele aldık sor
politics,başkanının ulusal güvenlik danışmanı mcmasterla beyaz saraydaki görüşmemizde ikili bölgesel konuları
politics,almanya cumhuriyeti istihbarat teşkilatı başkanının  temmuz darbe girişimi fetöye ilişkin ifadeleri hk
politics,adalet bakanı görüşmemizde fetö elebaşının geçici tutuklanması ülkemize iadesi talebimizi vurgulad
politics,lahey amsterdamda   günü gösteriler hk
politics,israil makamlarınca tutuklanan tika gazze yerel personeli hk yöneltilen soruya cevabım
politics,türkingiliz tatlıdil forumu toplantısı hakkında basın açıklaması
politics,bağdatta düzenlenen bombalı saldırı hakkında basın açıklaması
politics,bakanımızın   tarihlerinde abdye gerçekleştireceği ziyaret hk
politics,kerkük valiliğininikby bayrağının irak bayrağıyla göndere çekilmesi başvurusu hk soruya cevabım
politics,frankfurtta bugün  gösteri hakkında basın açıklaması
politics,şehitler günü vesilesiyle şehitlerimizi şehit diplomatlarımızı saygı rahmetle andık
politics,şehitler gününde ülkemizin şehitlerini şehit diplomatlarımızı saygı rahmetle anıyoruz
politics,kırımın gayrımeşru ilhakının üçüncü yıldönümü hakkında basın açıklaması
politics,şehitler gününde ülkemizin şehitlerini şehit diplomatlarımızı saygı rahmetle anıyoruz
politics,şehitler gününde dışişleri şehitliğinde düzenlenecek tören şehit diplomatlarımız
politics,bağdat tikritte meydana gelen terör saldırıları hk
politics,alman bild gazetesinde haber hakkındaki soruya cevabım
politics,türkiyeukrayna arasında bugün imzalanan kimlikle seyahate ilişkin anlaşmanın turizmin gelişmesine önemli katkı
politics,dışişleri bakanlığımızın edirne temsilciliğini ziyaret ettiktemsilciliklerimiz ülkemiz dünyanın köşesinde çalı
politics,cnn internationaldan gelişmelere ilişkin sorularını yanıtladık röportaj bugün türkiye saati
politics,yüksek mogherini kom hahnın üye ülkeleriyle yaşanan gerilime ilişkin basın açıklaması hk
politics,somalide meydana gelen terör saldırıları hakkında basın açıklaması
politics,isviçrede gazetesinde ülkemizdeki referandumla haber hakkındaki soruya cevabım
politics,hollanda gelişmeler hakkında basına bilgi notu
politics,hollandaya ilişkilerimiz hakkında basın açıklaması
politics,italya vatandaşı houda kharratın ailesine teslimi hk
politics,ihyknın ülkemizdeki terörle mücadele operasyonlarının insan hakları boyutuna ilişkin yayımladığı rapor hk
politics,büyükelçiliğimizde düzenlenen anma törenine basın mensuplarının yanısıra dışişleri bakan yrd aleksiç katılarak
politics,merhum büyükelçimiz galip balkarı şehit edilişinin  yıl dönümünde masası şahsi eşyaları önünde saygı rahmetle andı
politics,bulgaristan dışişleri bakanlığının basın açıklaması hakkındaki soruya cevabım
politics,jcag terör örgütü şehit edilen belgrad büyükelçimiz galip balkarı saygı rahmetle anıy
politics,yunanistan cumhurbaşkanının ege adalarının silahsızlandırılmış statüsüne ifadeleri hakkında basın açıklaması
politics,kabilde düzenlenen terör saldırısı hakkında
politics,dönem başkanlığında türkiye kadının güçlendirilmesine yönelik wwomen  açılım grubunun kurulmasına öncülük etmiştir
politics,cinsiyet eşitliğiampkadının güçlendirilmesi birimi avrupaamprta asya bölge ofisine ev sahipliği yapmaktadır
