politics,gerçekleştirilecek siyasi istişareler hk basın açıklaması
politics,cumhurbaşkanı refakaten ziyaret gerçekleştirdi
politics,kazakistanda yüksek düzeyli stratejik işbirliği konseyi toplantısına katıldık
politics,gerçekleştirecekleri ziyaret hk basın açıklaması
politics,astanada kazakistan dışişleri bakanı erlan idrissov türkiyekazakistan ilişkilerini kapsamlı şekilde ele aldık
politics,avrupa parlamentosunun  olayları kabul karar hk basın açıklaması
politics,ülkemizin salgınıyla mücadele çalışmalarına desteği hk basın açıklaması
politics,müsteşarımız jorgensen görüştü ayrıntılar
politics,deki gelişmeler güvenlik konseyinde hakkında  nisanda kabul edilen karar hk basın açıklaması
politics,gerçekleştirilen saldırı hk basın açıklaması
politics,kültürel mirasın tahribine yönelik saldırılar hk basın açıklaması
politics,meydana gelen terör saldırısı hk basın açıklaması
politics,pakistanın sohrab barajındaki köprü inşaatında çalışan işçilere yönelik terör saldırısı hk basın açıklaması
politics,ayrıntılar
politics,tarihinde vatikandaki ayinde kullanılan ifadeler hk basın açıklaması
politics,papanın tarihi hukuki gerçeklerden uzak beyanı kabul edilemezdini makamlar mesnetsiz ithamlarla nefreti kö
politics,cemaati islami genel sekreter yardımcısı kamaruzzamana verilen idam cezasının infazı hk
politics,verilen toplu idam ömür boyu hapis cezaları hk basın açıklaması
politics,lı mevkidaşıyla araya geldi ayrıntılar
politics,diplomasi akademimizin uluslararası genç diplomatlar eğitim programında türk dış politikasını anlattık
politics,dış politika enstitüsü başkanı seyfi taşhana plaket takdim ayrıntılar
politics,cumhuriyetine gerçekleştirecekleri resmi ziyaret hk basın açıklaması
politics,deaş karşıtı uluslararası koalisyonun yts çalışma grubunun ülkemizde kuruluş toplantısı hk soruya cevabım http
politics,gerçekleştireceği resmi ziyaret hk basın açıklaması
politics,avrupa parlamentosu başkanı schulz görüştü ayrıntılar
politics,dışişleri bakanı ali kartinin ülkemizi ziyareti hk basın açıklaması
politics,ülkemizde ağırladığımız avrupa parlamentosu başkanı schulz sürecimizi kıbrıs meselesini ele aldık
politics,cumhurbaşkanı erdoğan ayrıntılar
politics,iiyüksek düzeyli işbirliği konseyi toplantısı kapsamında  anlaşma  mutabakat metni imzaladık
politics,istiklal mücadelemizde milletimizin sesini duyurmak kurulanbugün mazlumların sesi haline gelen küresel
politics,deki vatandaşlarımızın tahliyesi hk basın açıklaması
politics,meydana gelen terör saldırısı hk basın açıklaması
politics,litvanya cumhurbaşkanı grybauskaite ikili bölgesel konuları değerlendirdik
politics,ın nükleer programına ilişkin uzlaşı hk basın açıklaması
politics,merkezdeki kurslara katılan yavrularımız söyledikleri türkçe şarkılarla türkiye sevgileriyle bizleri duygulandırdı
politics,vilnius kültür eğitim merkezini eşim hülya hanımla ziyaret ettik kardeşlerimizle buluştuk
politics,deki vatandaşlarımızın tahliyesi hk basın açıklaması
politics,litvanya dışişleri bakanı linkeviciusla ikili işbirliğimizi bölgesel konuları boyutlarıyla ele aldık
politics,litvanyada temaslarımıza başbakan butkeviciusu ziyaret başladık
politics,üniversiteye gerçekleştirilen saldırı hk basın açıklaması
politics,gkrynin soykırımın inkarı suçu kabul yasa değişikliği hakkındaki soruya cevabım http
politics,transdinyester sorunu takip sorunun  yükümlülükleri çerçevesinde çözülmesini
politics,bugün komratta ziyaret edeceğim gagavuz türklerini türkiye moldovayı birbirine yakınlaştıran köprü gö
politics,vize muafiyeti anlaşmamızın yardımıyla türkiye moldova vatandaşları tercih edilen turizm merkezi
politics,işbirliğimizin derinliğini yansıtmayan  dolarlık ticaret hacmini hızla düzeye çıkarmak ortak
politics,gherman tika işbirliği protokolünü imzaladıktika moldovada   değerinde  proje gerçekleştirdi
politics,şubatta kurulan hükümetin yürüttüğü reformları ilgiyle izliyor moldovanın avrupayla entegrasyon perspektif
politics,ortak coğrafyamıztarihi kültürel mirasımızgeleceğe yönelik ortak idealler moldova ilişkilerimizin potansiyeli
politics,kişinevde moldova başbakan yrdve dışişleri gherman görüşmelerimizde işbirliğimizi kapsamlı ele aldık
politics,cumhurbaşkanımıza refakaten bulunduğumuz slovenya slovakya romanyanın ardından bugün ikili resmi ziyaret kapsamın
politics,basınyayın organlarının faaliyetlerinin durdurulması hk basın açıklaması
politics,gerçekleştirilen devlet başkanlığı meclis seçimleri hk basın açıklaması
politics,romanya ziyaretimizde tarihi bağlara dayanan işbirliğimize katkı sağlayacak anlaşmalara imza atıldı
politics,arabinin zirve toplantısı sonrasında gerçekleştirilen basın toplantısında ülkemize ilişkin beyanları hk
politics,başbaşa görüşmenin ardından heyetlerarası görüşmelerde ikili ilişkilerimizi boyutlarıyla ele aldık
politics,cumhurbaşkanımız refaketen bulunduğumuz romanyada türk şehitliğini ziyaret ettik
politics,yunanistan sözcüsünün yunanistan savunma bakanının egeye ilişkin basına yansıyan ifadeleri hk soruya cevabımh
politics,cumhurbaşkanımızın slovakya temasları işbirliğimizi derinleştirecek samimi atmosferde gerçekleşiyor
politics,cumhurbaşkanı erdoğana refakaten  yı ziyaret ayrıntılar
politics,gerçekleştirecekleri ziyaret hk basın açıklaması
politics,moldovaya gerçekleştirecekleri ziyaret hk basın açıklaması
politics,pakistanın büyükelçisi sohail mahmoodu kabul ayrıntılar
politics,slovenyada dışişleri bakanı karl viktor erjavec görüşmemizde mevcut stratejik işbirliğimizi ele aldık
politics,cumhurbaşkanımızın slovenya ziyaretinde refakat ediyoruz
politics,türkiyenin zirve toplantısına katılımının engellendiği yönünde basına yansıyan haberlere ilişkin soruya cevabım
politics,barış ödülü sahibi tevekkül karmanı kabul ayrıntılar
politics,deki gelişmeler hk basın açıklaması
politics,polonya schetyna görüşmelerimizde işbirliğimizin gündeminde konuları kapsamlı ele aldık http
politics,türkiyepolonya forumunda  yılı aşan işbirliğimizi ekonomi alanında dernleştirmenin önemini vurguladık
politics,kurucu başbakanı yewin vefatı hk basın açıklaması
politics,türkamerikan konseyiatc başkanı beaseyyi kabul ettik
politics,meksika eski cumhurbaşkanı küresel iklim ekonomi komisyonu başkanı felipe görüştük
politics,cumhuriyeti gökoğuz yeri özerk bölgesinde   tarihinde düzenlenen başkanlık seçimleri hk
politics,deaş öldürülen peşmergeler hk basın açıklaması
politics,nın batısında saldırılar hk basın açıklaması
politics,suudi arabistanisveç ilişkilerinde dönemde ortaya çıkan gerginlik hakkında soruya cevabım
politics,camiye terör saldırısı hk basın açıklaması
politics,ukrayna dışişleri bakanı pavlo klimkinle görüştü ayrıntılar
politics,dışişleri bakanı grzegorz schetynanın ülkemizi ziyareti hk basın açıklaması
politics,suriye bölgesel mülteciler dayanıklılık planının türkiye bölümünün duyurulması toplantısına katıldı
politics,asyapasifik bölge turunda ayrıntılar
politics,uzakdoğu yolculuğumuzun dönüşünde hindistanda dışişleri bakanı sushma verimli görüşme gerçekleştirdik
politics,meydana gelen terör eylemi hk basın açıklaması
politics,vietnamda cumhurbaşkanı araya geldik türkiyevietnam ilişkilerini değerlendirdik
politics,başbakan yardımcısı dışişleri bakanı pham minh görüşmemizde gündem ekonomik ilişkilerdi http
politics,ziyaretine minh mozolesine çelenk koyarak başladık vietnamlı çocukların sıcak ilgisiyle karşılandık
politics,tayland dışişleri bakanlığı saranrom enstitüsünün ortak etkinliğinde türk dış politikası konulu konferansı verdim
politics,tayland başbakan yardımcısı dışişleri bakanı patimapragorn görüşmemizde ikili bölgesel konuları ele aldık
politics,ın kentinde düzenlenen intihar saldırıları hk basın açıklaması
politics,apnin  dünyada insan hakları demokrasi raporunda  olaylarıyla ifadeler hk soruya cevap
politics,ı ziyareti hk basın açıklaması
politics,arasında   tarihinde gerçekleştirilecek siyasi istişareler hk basın açıklaması
politics,dışişleri bakanı poposki türkiyede ayrıntılar
politics,ülke stratejik araştırmalar merkezleri arasında işbirliğinin arttırılması mutabakat zaptı imzaladık
politics,görüşmelerde makedonyanın üyeliklerine desteğimizi dile getirdik soydaşlarımızın durumunu ele aldık
politics,değerli dostum makedonya dışişleri bakanı nikola poposki ankarada biraraya geldik
politics,bosna hersek yüksek temsilcisi valentin inzkoyla görüştük
politics,arap ligi temsilcisi büyükelçi naciriyi kabul ayrıntılar
politics,dışişleri bakanı nikola poposkinin ülkemizi ziyareti hk basın açıklaması
politics,ayrıntılar
politics,parlamenterler asamblesi heyetiyle bölgesel gelişmeleri konuştuk heyet üyelerinin sorularını cevapladık http
politics,dünya kadınlar günü vesilesiyle yayımladıkları mesaj
politics,yı ziyareti hk basın açıklaması
politics,milli savunma bakanının deki faaliyetleri hk basın açıklaması
politics,bakanımızın dışişleri bakanları resmi toplantısına katılımı hk basın açıklaması
politics,ayrıntılar
politics,türkiyeportekiz hükümetlerarası zirve toplantısı öncesinde dışişleri bakanı araya geldik
politics,başbakanımız lizbon merkez camiini ziyaretinde buradaki müslüman toplumu temsilcileri araya geldi http
politics,başbakanımızın portekiz cumhurbaşkanı görüşmesinde bölgesel meseleler gündeme geldi
politics,ermeni terörü şehitleri anıtını başbakanımızla ziyaret ettik şehitlerimiz nadideamperkut akbayın ruhları şad
politics,başbakanımız lizbonda türk işadamlarıyla koordinasyon toplantısında araya geldi
politics,cumhurbaşkanı erdoğana refakaten suudi arabistana ziyaret gerçekleştiriyor
politics,cumhurbaşkanımızın sarabistan ziyareti cidde mekke sonrası bugün riyaddaki temaslarla devam
politics,dışişleri bakan büyükelçi insan hakları konseyi oturumuna katılımı hk basın açıklaması
politics,geçici hükümeti başbakanı abdullah elseninin ülkemize ilişkin asılsız iddiaları hk basın açıklaması
politics,suriyede kaçırılan süryaniler hakkındaki soruya cevabım
politics,doğu hristiyan okuluna saldırı hk basın açıklaması
politics,genel sekreteri musavi teşkilatın etkinlik görünürlüğünün artırılması ülkemizin iradesini paylaştık
politics,çin halk cumhuriyeti lankanın büyükelçilerini kabul ettik
politics,azerbaycandaki temaslarımızı ahıska türkleri vatan cemiyeti temsilcileriyle görüşerek tamamladık
politics,büyükelçiliğimize araçların geçtiği güzergahta gerçekleştirilen saldırı hk basın açıklaması
politics,katliamının yılında hayatını kaybeden kardeşlerimizin acısını yüreğimizde hissediyor vahşeti gerçekleşt
politics,azerbaycan halkının sevinci sevincimiz acısı acımızdır sussa susmayacağız hocalıyı unutmayacağız
politics,devlet anlayışına daim sahip çıkan türk halkıazeri kardeşlerimize hocalıda vahşeti yüre
politics,şubat hocalıda ü çocuki yaşlı sı kadın  masum insan hunharca katledildiyüzler
politics,batı şeriadaki elhuda camisine yönelik saldırı hk basın açıklaması
politics,afganistandaki menfur saldırıda maalesef  şehidimiz yaralımız şehidimize allahtan rahmetyaralı kardeşimize
politics,azerbaycan cumhurbaşkanı aliyevin davetiyle hocalı katliamını anma törenine katıldıkyaşadığımız hüzün tarifsiz
politics,hocalıda katledilen kardeşlerimizi rahmetle anıyoruz vahşeti unutmayacağız unutturmayacağız
politics,ın penşir vilayetinde meydana gelen çığ felaketleri hk basın açıklaması
politics,daayrıntılar
politics,hükümeti malideki silahlı gruplar arasında devam diyalog süreci neticesinde imzalanan deklarasyon hk
politics,azerbaycan diplomasi akademisi üniversitesinde türk dış politikasını kafkasyaazerbaycan perspektifimizi anlattık
politics,milli meclisi bşksn asadov azerbaycanla kardeşliğimizin parlamenter diplomasiye yansımasının önemini vurguladık
politics,azerbaycan başbakanı rasizadeyi ziyaretimizde işbirliğimizin gündemindeki meseleleri ele aldık
politics,dışişleri bakanı azerbaycana ikili resmi ziyaretimde kardeşim memmedyarov araya geldik http
politics,azerbaycandaki türk şehitliğimizi ziyaret ettik şehitlik defterini imzaladık ruhları şad
politics,baküde rahmetli haydar aliyevin anıt mezarını şehitler hıyabanını ziyaret ettik
politics,azerbaycan temaslarımıza cumhurbaşkanı aliyevi ziyaret başladık
politics,macar mevkidaşı biraraya geldi ayrıntılar
politics,başbakanımıza refakaten bulunduğumuz macaristanda dışişleri dış ticaret bakanı szijjarto araya geldik htt
politics,firmalarımızın libyadan çıkarılacaklarına ilişkin haberler hakkındaki soruya cevabı
politics,köstence limanından kalkan isimli geminin  şubat karadenizde ua sularda torpillenmesi hk
politics,mayıs ayında antalyamızda gerçekleştirilecek dışişleri bakanları toplantısının hazırlıklarını yerinde inceledik
politics,bugün gazetede çıkan gerçek dışı iddialara cevaben verdiğim beyan
politics,süleyman şah türbesi saygı karakolunun geçici nakli hk basın açıklaması
politics,antalya ajansının büyükelçilere verdiği resepsiyona katıldık temaslarımızda  öncelikli gündem
politics,kktc bayındırlık ulaştırma bakanı taçoy araya geldik
politics,uluslararası sivil havacılık organizasyonicao genel sekreteri raymond beraberindeki heyeti kabul ettik
politics,süleyman şah türbesindeki askerlerimizin deaşın elinde olduklarına ilişkin iddiaların gerçek dışı önc
politics,eğitdonat konusundaki mutabakat metni müst sinirlioğlu büyükelçisi imzalandı
politics,eylem grubunun  toplantısı  şubat  tarihinde palasta gerçekleştirilecektir ayrıntılar
politics,dolara yaklaşan ticaret hacmimizi hızla artırarak kosovanın dış ticaretteki  numaralı orta
politics,kosovanın fazla ülke tanınması uluslararası kuruluşlara üye yönündeki gayretlerimiz
politics,köklü tarihikültürel insani bağlarımız kosovaya alanda verdiğimiz samimi kararlı destek sonr
politics,kosova bağımsızlığını kazanmasından yana uluslararası toplumun güvenilir ortağı bölgede istikrar unsuru
politics,ülkemizde ağırladığımız başbakan yrd dışişleri bakanıkardeşim haşim thaçi işbirliğimizi ele aldık
politics,senatosu dış ilişkiler komitesi bşk corkera türkiyeabd işbirliğinde senatonun desteğinin önemini vurguladık
politics,mevkidaşıyla biraraya geldi ayrıntılar
politics,başkanı temsilciler meclisi silahlı hizmetler komitesi üyesi başkanlığındaki heyet kabul ettik
politics,şubat  tarihlerinde resmi ziyarette bulunacaktır ayrıntılar
politics,yüksek düzeyli işbirliği konseyi toplantısı gerçekleştirildi
politics,dışişleri bakanı özdil nami  şubat  tarihinde ülkemize çalışma ziyareti gerçekleştirecektir
politics,ın logar vilayetinde düzenlenen intihar saldırısı hk basın açıklaması
politics,ın lahor kentinde düzenlenen bombalı saldırı hk basın açıklaması
politics,başbakan yardımcısı dışişleri bakanı haşim thaçi  şubat  tarihlerinde ülkemizi ziyaret edecektir
politics,başbakanımıza refakaten bulunduğumuz pakistanda mevkidaşım azizle araya geldik
politics,terör örgütü deaşın libyada kaçırdığı masum mısır vatandaşlarını hunharca öldürmesini nefretle kınıyoruz
politics,gerçekleştirilen terör saldırılarını şiddetle kınıyoruz ayrıntılar
politics,büyükelçiliğimizin faaliyetlerini geçici askıya alması hk basın açıklaması
politics,nün genel kurulunun kıbrıstaki toplu mezarlar konulu karar hk soruya cevabı
politics,ilişkin duyuru
politics,ın peşaver şehrinde düzenlenen intihar saldırısı hk bakanlık açıklaması
politics,cumhurbaşkanımızın meksika ziyaretinde ilişkilerimizi ileri safhaya taşıyacak önemli adımlar atıldı
politics,meksikada ayrıntılar
politics,ilke imza atarak konsensüsle uluslararası enerji ajansı icra direktörlüğüne seçilen drfatih birolu tebrik eder
politics,krizine çözüm bulunmasına yönelik  şubat tarihli minsk anlaşması hk basın açıklaması
politics,fatih birolun uea icra direktörlüğüne seçilmesi hk basın açıklaması
politics,cumhurbaşkanımızın amerika temasları kapsamında küba ziyareti derece samimi atmosferde gerçekleşti
politics,havanada kübalı mevkidaşım çalışma kahvaltısında biraraya geldikişbirliğimizi değerlendirdik
politics,türkiyeden kübaya devlet başkanı seviyesinde gerçekleştirilen ziyarette cumhurbaşkanımıza eşlik ediyoruz http
politics,cumhurbaşkanımızın kolombiya ziyareti unutulmaz misafirperverliği işbirliğimiz önemli adımlarla tamamlandı
politics,cumhurbaşkanımıza refaketen buluduğumuz kolombiyada holguin görüştükişbirliğimizi kapsamlı ele aldık
politics,yasadışı yerleşim faaliyetleri hk basın açıklaması
politics,cumhurbaşkanı erdoğana refakaten kolombiya küba meksikaya ziyaret gerçekleştiriyor ayrıntılar
politics,deki siyasi gelişmeler hk basın açıklaması
politics,almanyada
politics,şubat tarihlerinde kolombiyakübaampmeksikayı ziyaret cbaşkanımıza eşlik edecektir
politics,sınırında meydana gelen terör saldırıları hk basın açıklaması
politics,ekonomik ortaklık komisyonu toplantısı hk basın açıklaması
politics,yurtdışında yaşayan vatandaşımızın sorunu sorunumuzdur çözümünü sağlam
politics,ysk bşk güven kurul üyeleri ytb bşkyrd dönmez meb dış ilişkiler gnmd yediyıldız toplantımıza katı
politics,kapsamda yurtdışı seçim düzenlemesi yabancı düşmanlığı eğitimgençlik köprüleri  olaylarıyla
politics,batı avrupadaki başkonsoloslarımızla berlinde araya gelerek vatandaşlarımızla konuları gözden geçirdik
politics,ilişkin seyahat güvenlik duyurusu
politics,almanya ziyareti hk basın açıklaması
politics,nün dışişleri bakanlığı  şubat günü yayımlanan açıklama hk soruya cevabı
politics,suriye ulusal konseyi başkanı halit hoca yönetimini kabul ettik
politics,muaz kasasbehin terör örgütü katledilmesi hk basın açıklaması
politics,ceza mahkemesinin  sanığa toplu idam cezası vermesi hk basın açıklaması
politics,vatandaşı kenji gotonun deaş terör örgütü katledilmesi hk basın açıklaması
politics,ermenistan cumhurbaşkanının  ocak  tarihli beyanı hk basın açıklaması
politics,açılış oturumuna ülkemizi temsilen katıldığımız afrika birliği zirvesi kapsamındaki yoğun temaslarımızı tamamladık
politics,etiopya cumhurbaşkanı wirtuyu ziyaret ettiktürkiyenin afrikadaki varlığının etkilerini kendisinden dinledik http
politics,komorlar cumhurbaşkanı dhoinine türkiye komorlarla işbirliğimizi güçlendirme irademizi paylaştık
politics,ın eyaletinde düzenlenen bombalı saldırı hk basın açıklaması
politics,meydana gelen terör saldırıları hk basın açıklaması
politics,insani işlerden sorumlu gensekyrd acil yardımlar koordinatörü bölgedeki gelişmeleri konuştuk http
politics,nijer cumhurbaşkanı issoufo tarihten gelen güçlü bağlarımızın üzerinde gelişen işbirliğimizi ele aldık
politics,milli meclisi başkan yardımcısı ün tutuklanması hk basın açıklaması
politics,işgal altında tuttuğu yasadışı yerleşim inşası kararını şiddetle kınıyoruz
politics,afrika birliği zirvesine katıldı ayrıntılar
politics,dün  ocak vilayetlerinde meydana gelen terör saldırılarını kınıyoruz
politics,afrika birliği zirvesi bulunduğumuz ababada etiopya dışişleri bakanı ghebreyesus araya geldik
politics,türkiyeazerbaycantürkmenistan üçlü toplantısı aşkabatta gerçekleştirildi ayrıntılar
politics,türkiyetürkmenistanazerbaycan dışişleri bakanları lü toplantısının ikincisini aşkabatta gerçekleştirdik
politics,türkiyetürkmenistanazerbaycan dışişleri bakanları lü toplantısı marjında azerbaycan memmedyarov görüştük
politics,türkmenistanda yatırım yapan türk işadamlarıyla büyükelçilik rezidansımızda araya geldik
politics,türkmenistan dışişleri bakanlığı uluslararası ilişkiler enstitüsünün öğrenci akademisyenlerine hitap ettik http
politics,türkmenistanın merhum devlet başkanı türkmenbaşının mozolesine çelenk koyduk kıpçak camiini ziyaret ettik http
politics,türkmenistan devlet başkanı berdimuhammedovu ziyaret ettik ülke halklarımız arasındaki kardeşliği vurguladık htt
politics,orta asyada ikili resmi ziyaretimi gerçekleştirdiğim türkmenistandadışişleri bkkardeşim meredov görüştük
politics,daayrıntılar
politics,düzenlenecek  zirve toplantısına katılımı hk basın açıklaması
politics,atr televizyon kanalı merkezinde arama hk basın açıklaması
politics,ülkemizin salgınıyla mücadele çalışmalarına desteği hk basın açıklaması
politics,meydana gelen terör saldırısı hk basın açıklaması
politics,abdullah suudi arabistanın büyükelçiliğinde açılan taziye defterini imzaladık
politics,uluslararası anma günü hk basın açıklaması
politics,tahrir devriminin yıldönümü vesilesiyle yaşanan hadiseler hk basın açıklaması
politics,zelanda işleri bakanı çanakkale savaşlarının yıl törenleriyle hazırlıkları konuştuk
politics,macaristanın üyelik sürecimize verdiği desteği memnuniyetle karşılıyor desteğin devamını önemsiyoruz
politics,macaristanla güçlü siyasi işbirliğimizi ekonomik alana yansıtarak ticaret hacmimizi  dolar seviyesine çıka
politics,köklü ortak tarihe dayanan türkmacar dostluğu karşılıklı güvensaygı ortak değerler temelinde işbirliğimiz
politics,ziyaret vesilesiyle bakanlıklarımız arasında işbirliğini geliştirmeye yönelik anlaşmayı imzaladık
politics,ülkemizde ağırladığımız macaristan dışişleri dış ticaret bakanı szijjarto ikili bölesel konuları ele aldık
politics,nın şehrindeki roket saldırıları hk basın açıklaması
politics,vatandaşı haruna yukawanın deaş terör örgütü katledilmesi hk basın açıklaması
politics,cumhurbaşkanımızın cibuti ziyaretinde gücünü ortak tarihten işbirliğimizi derinleştirecek  anlaşma imzaladık
politics,cumhurbaşkanımıza refakaten bulunduğumuz cibutide dışişleri bakanı yusuf görüştük
politics,deki hk basın açıklaması
politics,ukraynadaki kriz hk basın açıklaması
politics,suudi arabistan kralı abdullaha allahtan rahmet ailesine kardeş suud halkına başsağlığı dilerim
politics,daki ateşkes ihlali gelişmeler hk basın açıklaması
politics,deaşla mücadele uluslararası koalisyonu küçük grup toplantısına katıldı
politics,terör örgütü deaşla mücadele küçük grup toplantısında mücadelede etkin somut adımların önemini vurguladık http
politics,türkmenistan ziyareti trazetürkm dışişleri bakanları lü hk basın açıklaması
politics,dışişleri dış ticaret bakanının ülkemizi ziyareti hk basın açıklaması
politics,deaşla mücadele toplantısı geldiğimiz londrada genel sekreteri irak özel temsilcisi mladenov görüştük
politics,bölge ofisinin kurulmasına ilişkin anlaşmanın yürürlüğe girmesi hk basın açıklaması
politics,türk katarlı işadamlarıyla doha büyükelçiliğimizdeki resepsiyonda araya geldik
politics,ayrıntılar
politics,başbakanımızın hrant dinkin ölüm yıldönümü vesilesiyle açıklama
politics,katarda bizleri büyük misafirperverlikle ağırlayan değerli mevkidaşım kardeşim atiye araya geldik
politics,katarda başbakan içişleri bakanı thaniyi ziyaretimizde işbirliğimizdeki önemli konu başlıklarını ele aldık
politics,meydana gelen çatışmalar hk basın açıklaması
politics,genç diplomatlara hitap ettikten akif kireçci hocamızın türkiye tarihi dersine katıldık istifade ettik http
politics,uluslararası genç diplomatlar eğitim programımız kapsamında  farklı ülkeden genç diplomatla araya geldik http
politics,bakan yardımcımız büyükelçi etkinliğe konuşmacı katılmıştır
politics,ayrıntılar
politics,eşgüdümünde gerçekleştirilmiştir
politics,bugün palasta konulu düzenlenmiştir
politics,uluslararası genç diplomatlar eğitim programının açılış konuşmasını
politics,cumhurbaşkanı aliyev deayrıntılar
politics,dışişleri bakanları topl ülkemizin evsahipliğinde  mayıs  tarihlerinde antalyada düzenlenecektir
politics,unsmil evsahipliğinde gerçekleştirilen diyalog toplantısı hk basın açıklaması
politics,avrupa işkencenin önlenmesi komitesinin altıncı olağan ziyaretinin raporunun yayımlanması hk basın açıklaması
politics,dışişleri bakanı özdil nami kıbrıs davamızın uluslararası boyutuyla çalışmaları ele aldık
politics,bünyesinde oluşturulan mümtaz şahsiyetler paneli hk basın açıklaması
politics,ayrıntılar
